aiter/configs/model_configs/a8w8_blockscale_tuned_gemm_ds_v3.csv
cu_num,M,N,K,kernelId,splitK,us,kernelName,tflops,bw,errRatio
80,16,64,7168,8,0,22.9407,a8w8_blockscale_1x128x128_256x16x64x256_16x16_16x16_16x16x1_16x16x1_1x16x1x16_4_1x1_intrawave_v1,0,0,0
80,32,64,7168,8,0,22.2799,a8w8_blockscale_1x128x128_256x16x64x256_16x16_16x16_16x16x1_16x16x1_1x16x1x16_4_1x1_intrawave_v1,0,0,0
80,64,64,7168,8,0,22.0451,a8w8_blockscale_1x128x128_256x16x64x256_16x16_16x16_16x16x1_16x16x1_1x16x1x16_4_1x1_intrawave_v1,0,0,0
80,128,64,7168,8,0,21.7027,a8w8_blockscale_1x128x128_256x16x64x256_16x16_16x16_16x16x1_16x16x1_1x16x1x16_4_1x1_intrawave_v1,0,0,0
80,256,64,7168,8,0,20.9311,a8w8_blockscale_1x128x128_256x16x64x256_16x16_16x16_16x16x1_16x16x1_1x16x1x16_4_1x1_intrawave_v1,0,0,0
80,512,64,7168,8,0,21.4855,a8w8_blockscale_1x128x128_256x16x64x256_16x16_16x16_16x16x1_16x16x1_1x16x1x16_4_1x1_intrawave_v1,0,0,0
80,1024,64,7168,8,0,21.7759,a8w8_blockscale_1x128x128_256x16x64x256_16x16_16x16_16x16x1_16x16x1_1x16x1x16_4_1x1_intrawave_v1,0,0,0
80,2048,64,7168,8,0,31.3536,a8w8_blockscale_1x128x128_256x16x64x256_16x16_16x16_16x16x1_16x16x1_1x16x1x16_4_1x1_intrawave_v1,0,0,0
80,4096,64,7168,18,0,32.8716,a8w8_blockscale_1x128x128_256x64x64x256_16x16_32x32_16x16x1_16x16x1_1x32x1x8_8_1x1_intrawave_v1,0,0,0
80,8192,64,7168,18,0,57.1329,a8w8_blockscale_1x128x128_256x64x64x256_16x16_32x32_16x16x1_16x16x1_1x32x1x8_8_1x1_intrawave_v1,0,0,0
80,16384,64,7168,18,0,109.3048,a8w8_blockscale_1x128x128_256x64x64x256_16x16_32x32_16x16x1_16x16x1_1x32x1x8_8_1x1_intrawave_v1,0,0,0
80,32768,64,7168,18,0,190.0733,a8w8_blockscale_1x128x128_256x64x64x256_16x16_32x32_16x16x1_16x16x1_1x32x1x8_8_1x1_intrawave_v1,0,0,0
80,65536,64,7168,18,0,350.8382,a8w8_blockscale_1x128x128_256x64x64x256_16x16_32x32_16x16x1_16x16x1_1x32x1x8_8_1x1_intrawave_v1,0,0,0
80,1,128,7168,13,0,31.0068,a8w8_blockscale_1x128x128_256x32x64x256_16x16_16x16_16x16x1_16x16x1_1x32x1x8_8_2x1_intrawave_v1,0,0,0
80,2,128,7168,8,0,22.9607,a8w8_blockscale_1x128x128_256x16x64x256_16x16_16x16_16x16x1_16x16x1_1x16x1x16_4_1x1_intrawave_v1,0,0,0
80,4,128,7168,8,0,23.1411,a8w8_blockscale_1x128x128_256x16x64x256_16x16_16x16_16x16x1_16x16x1_1x16x1x16_4_1x1_intrawave_v1,0,0,0
80,8,128,7168,8,0,23.3771,a8w8_blockscale_1x128x128_256x16x64x256_16x16_16x16_16x16x1_16x16x1_1x16x1x16_4_1x1_intrawave_v1,0,0,0
80,16,128,7168,8,0,22.9747,a8w8_blockscale_1x128x128_256x16x64x256_16x16_16x16_16x16x1_16x16x1_1x16x1x16_4_1x1_intrawave_v1,0,0,0
80,32,128,7168,8,0,22.8355,a8w8_blockscale_1x128x128_256x16x64x256_16x16_16x16_16x16x1_16x16x1_1x16x1x16_4_1x1_intrawave_v1,0,0,0
80,64,128,7168,8,0,22.2911,a8w8_blockscale_1x128x128_256x16x64x256_16x16_16x16_16x16x1_16x16x1_1x16x1x16_4_1x1_intrawave_v1,0,0,0
80,96,128,7168,8,0,19.2111,a8w8_blockscale_1x128x128_256x16x64x256_16x16_16x16_16x16x1_16x16x1_1x16x1x16_4_1x1_intrawave_v1,0,0,0
80,128,128,7168,8,0,21.7803,a8w8_blockscale_1x128x128_256x16x64x256_16x16_16x16_16x16x1_16x16x1_1x16x1x16_4_1x1_intrawave_v1,0,0,0
80,160,128,7168,8,0,19.6555,a8w8_blockscale_1x128x128_256x16x64x256_16x16_16x16_16x16x1_16x16x1_1x16x1x16_4_1x1_intrawave_v1,0,0,0
80,192,128,7168,8,0,19.7799,a8w8_blockscale_1x128x128_256x16x64x256_16x16_16x16_16x16x1_16x16x1_1x16x1x16_4_1x1_intrawave_v1,0,0,0
80,224,128,7168,8,0,20.1755,a8w8_blockscale_1x128x128_256x16x64x256_16x16_16x16_16x16x1_16x16x1_1x16x1x16_4_1x1_intrawave_v1,0,0,0
80,256,128,7168,8,0,21.0991,a8w8_blockscale_1x128x128_256x16x64x256_16x16_16x16_16x16x1_16x16x1_1x16x1x16_4_1x1_intrawave_v1,0,0,0
80,288,128,7168,8,0,20.9287,a8w8_blockscale_1x128x128_256x16x64x256_16x16_16x16_16x16x1_16x16x1_1x16x1x16_4_1x1_intrawave_v1,0,0,0
80,320,128,7168,8,0,21.6103,a8w8_blockscale_1x128x128_256x16x64x256_16x16_16x16_16x16x1_16x16x1_1x16x1x16_4_1x1_intrawave_v1,0,0,0
80,352,128,7168,8,0,21.4607,a8w8_blockscale_1x128x128_256x16x64x256_16x16_16x16_16x16x1_16x16x1_1x16x1x16_4_1x1_intrawave_v1,0,0,0
80,384,128,7168,8,0,21.6103,a8w8_blockscale_1x128x128_256x16x64x256_16x16_16x16_16x16x1_16x16x1_1x16x1x16_4_1x1_intrawave_v1,0,0,0
80,416,128,7168,8,0,21.8407,a8w8_blockscale_1x128x128_256x16x64x256_16x16_16x16_16x16x1_16x16x1_1x16x1x16_4_1x1_intrawave_v1,0,0,0
80,448,128,7168,8,0,21.8071,a8w8_blockscale_1x128x128_256x16x64x256_16x16_16x16_16x16x1_16x16x1_1x16x1x16_4_1x1_intrawave_v1,0,0,0
80,480,128,7168,8,0,21.7087,a8w8_blockscale_1x128x128_256x16x64x256_16x16_16x16_16x16x1_16x16x1_1x16x1x16_4_1x1_intrawave_v1,0,0,0
80,512,128,7168,8,0,21.8127,a8w8_blockscale_1x128x128_256x16x64x256_16x16_16x16_16x16x1_16x16x1_1x16x1x16_4_1x1_intrawave_v1,0,0,0
80,1024,128,7168,8,0,29.8,a8w8_blockscale_1x128x128_256x16x64x256_16x16_16x16_16x16x1_16x16x1_1x16x1x16_4_1x1_intrawave_v1,0,0,0
80,2048,128,7168,18,0,32.7228,a8w8_blockscale_1x128x128_256x64x64x256_16x16_32x32_16x16x1_16x16x1_1x32x1x8_8_1x1_intrawave_v1,0,0,0
80,4096,128,7168,18,0,54.2453,a8w8_blockscale_1x128x128_256x64x64x256_16x16_32x32_16x16x1_16x16x1_1x32x1x8_8_1x1_intrawave_v1,0,0,0
80,6144,128,7168,18,0,80.2986,a8w8_blockscale_1x128x128_256x64x64x256_16x16_32x32_16x16x1_16x16x1_1x32x1x8_8_1x1_intrawave_v1,0,0,0
80,8192,128,7168,18,0,101.6448,a8w8_blockscale_1x128x128_256x64x64x256_16x16_32x32_16x16x1_16x16x1_1x32x1x8_8_1x1_intrawave_v1,0,0,0
80,10240,128,7168,18,0,105.886,a8w8_blockscale_1x128x128_256x64x64x256_16x16_32x32_16x16x1_16x16x1_1x32x1x8_8_1x1_intrawave_v1,0,0,0
80,12288,128,7168,18,0,130.3021,a8w8_blockscale_1x128x128_256x64x64x256_16x16_32x32_16x16x1_16x16x1_1x32x1x8_8_1x1_intrawave_v1,0,0,0
80,14336,128,7168,18,0,154.4819,a8w8_blockscale_1x128x128_256x64x64x256_16x16_32x32_16x16x1_16x16x1_1x32x1x8_8_1x1_intrawave_v1,0,0,0
80,16384,128,7168,0,0,178.0376,a8w8_blockscale_1x128x128_256x128x128x128_16x16_32x32_8x32x1_8x32x1_1x32x1x8_8_1x1_intrawave_v3,0,0,0
80,32768,128,7168,18,0,326.7444,a8w8_blockscale_1x128x128_256x64x64x256_16x16_32x32_16x16x1_16x16x1_1x32x1x8_8_1x1_intrawave_v1,0,0,0
80,65536,128,7168,0,0,608.956,a8w8_blockscale_1x128x128_256x128x128x128_16x16_32x32_8x32x1_8x32x1_1x32x1x8_8_1x1_intrawave_v3,0,0,0
80,98304,128,7168,0,0,869.1726,a8w8_blockscale_1x128x128_256x128x128x128_16x16_32x32_8x32x1_8x32x1_1x32x1x8_8_1x1_intrawave_v3,0,0,0
80,131072,128,7168,0,0,1131.8661,a8w8_blockscale_1x128x128_256x128x128x128_16x16_32x32_8x32x1_8x32x1_1x32x1x8_8_1x1_intrawave_v3,0,0,0
80,1,512,7168,8,0,28.6767,a8w8_blockscale_1x128x128_256x16x64x256_16x16_16x16_16x16x1_16x16x1_1x16x1x16_4_1x1_intrawave_v1,0,0,0
80,2,512,7168,8,0,28.3127,a8w8_blockscale_1x128x128_256x16x64x256_16x16_16x16_16x16x1_16x16x1_1x16x1x16_4_1x1_intrawave_v1,0,0,0
80,4,512,7168,8,0,29.6291,a8w8_blockscale_1x128x128_256x16x64x256_16x16_16x16_16x16x1_16x16x1_1x16x1x16_4_1x1_intrawave_v1,0,0,0
80,8,512,7168,8,0,30.1107,a8w8_blockscale_1x128x128_256x16x64x256_16x16_16x16_16x16x1_16x16x1_1x16x1x16_4_1x1_intrawave_v1,0,0,0
80,16,512,7168,8,0,23.3487,a8w8_blockscale_1x128x128_256x16x64x256_16x16_16x16_16x16x1_16x16x1_1x16x1x16_4_1x1_intrawave_v1,0,0,0
80,32,512,7168,8,0,23.3303,a8w8_blockscale_1x128x128_256x16x64x256_16x16_16x16_16x16x1_16x16x1_1x16x1x16_4_1x1_intrawave_v1,0,0,0
80,64,512,7168,8,0,23.1571,a8w8_blockscale_1x128x128_256x16x64x256_16x16_16x16_16x16x1_16x16x1_1x16x1x16_4_1x1_intrawave_v1,0,0,0
80,96,512,7168,8,0,22.4563,a8w8_blockscale_1x128x128_256x16x64x256_16x16_16x16_16x16x1_16x16x1_1x16x1x16_4_1x1_intrawave_v1,0,0,0
80,128,512,7168,8,0,23.0299,a8w8_blockscale_1x128x128_256x16x64x256_16x16_16x16_16x16x1_16x16x1_1x16x1x16_4_1x1_intrawave_v1,0,0,0
80,160,512,7168,8,0,28.3099,a8w8_blockscale_1x128x128_256x16x64x256_16x16_16x16_16x16x1_16x16x1_1x16x1x16_4_1x1_intrawave_v1,0,0,0
80,192,512,7168,8,0,26.9995,a8w8_blockscale_1x128x128_256x16x64x256_16x16_16x16_16x16x1_16x16x1_1x16x1x16_4_1x1_intrawave_v1,0,0,0
80,224,512,7168,8,0,28.0503,a8w8_blockscale_1x128x128_256x16x64x256_16x16_16x16_16x16x1_16x16x1_1x16x1x16_4_1x1_intrawave_v1,0,0,0
80,256,512,7168,8,0,28.7031,a8w8_blockscale_1x128x128_256x16x64x256_16x16_16x16_16x16x1_16x16x1_1x16x1x16_4_1x1_intrawave_v1,0,0,0
80,288,512,7168,8,0,28.7647,a8w8_blockscale_1x128x128_256x16x64x256_16x16_16x16_16x16x1_16x16x1_1x16x1x16_4_1x1_intrawave_v1,0,0,0
80,320,512,7168,8,0,29.4567,a8w8_blockscale_1x128x128_256x16x64x256_16x16_16x16_16x16x1_16x16x1_1x16x1x16_4_1x1_intrawave_v1,0,0,0
80,352,512,7168,18,0,36.2172,a8w8_blockscale_1x128x128_256x64x64x256_16x16_32x32_16x16x1_16x16x1_1x32x1x8_8_1x1_intrawave_v1,0,0,0
80,384,512,7168,18,0,32.4251,a8w8_blockscale_1x128x128_256x64x64x256_16x16_32x32_16x16x1_16x16x1_1x32x1x8_8_1x1_intrawave_v1,0,0,0
80,416,512,7168,12,0,36.4728,a8w8_blockscale_1x128x128_256x32x128x256_16x16_32x32_16x16x1_16x16x1_1x32x1x8_8_1x1_intrawave_v1,0,0,0
80,448,512,7168,18,0,32.4547,a8w8_blockscale_1x128x128_256x64x64x256_16x16_32x32_16x16x1_16x16x1_1x32x1x8_8_1x1_intrawave_v1,0,0,0
80,480,512,7168,18,0,36.4788,a8w8_blockscale_1x128x128_256x64x64x256_16x16_32x32_16x16x1_16x16x1_1x32x1x8_8_1x1_intrawave_v1,0,0,0
80,512,512,7168,18,0,32.1923,a8w8_blockscale_1x128x128_256x64x64x256_16x16_32x32_16x16x1_16x16x1_1x32x1x8_8_1x1_intrawave_v1,0,0,0
80,1024,512,7168,18,0,49.1544,a8w8_blockscale_1x128x128_256x64x64x256_16x16_32x32_16x16x1_16x16x1_1x32x1x8_8_1x1_intrawave_v1,0,0,0
80,1536,512,7168,18,0,78.5197,a8w8_blockscale_1x128x128_256x64x64x256_16x16_32x32_16x16x1_16x16x1_1x32x1x8_8_1x1_intrawave_v1,0,0,0
80,2048,512,7168,18,0,96.7626,a8w8_blockscale_1x128x128_256x64x64x256_16x16_32x32_16x16x1_16x16x1_1x32x1x8_8_1x1_intrawave_v1,0,0,0
80,4096,512,7168,18,0,170.3257,a8w8_blockscale_1x128x128_256x64x64x256_16x16_32x32_16x16x1_16x16x1_1x32x1x8_8_1x1_intrawave_v1,0,0,0
80,6144,512,7168,0,0,232.7081,a8w8_blockscale_1x128x128_256x128x128x128_16x16_32x32_8x32x1_8x32x1_1x32x1x8_8_1x1_intrawave_v3,0,0,0
80,10240,512,7168,0,0,315.2897,a8w8_blockscale_1x128x128_256x128x128x128_16x16_32x32_8x32x1_8x32x1_1x32x1x8_8_1x1_intrawave_v3,0,0,0
80,12288,512,7168,0,0,379.5964,a8w8_blockscale_1x128x128_256x128x128x128_16x16_32x32_8x32x1_8x32x1_1x32x1x8_8_1x1_intrawave_v3,0,0,0
80,14336,512,7168,0,0,448.1751,a8w8_blockscale_1x128x128_256x128x128x128_16x16_32x32_8x32x1_8x32x1_1x32x1x8_8_1x1_intrawave_v3,0,0,0
80,32768,512,7168,0,0,963.846,a8w8_blockscale_1x128x128_256x128x128x128_16x16_32x32_8x32x1_8x32x1_1x32x1x8_8_1x1_intrawave_v3,0,0,0
80,65536,512,7168,0,0,1946.2413,a8w8_blockscale_1x128x128_256x128x128x128_16x16_32x32_8x32x1_8x32x1_1x32x1x8_8_1x1_intrawave_v3,0,0,0
80,98304,512,7168,0,0,2849.7983,a8w8_blockscale_1x128x128_256x128x128x128_16x16_32x32_8x32x1_8x32x1_1x32x1x8_8_1x1_intrawave_v3,0,0,0
80,131072,512,7168,0,0,3803.5469,a8w8_blockscale_1x128x128_256x128x128x128_16x16_32x32_8x32x1_8x32x1_1x32x1x8_8_1x1_intrawave_v3,0,0,0
80,16,576,7168,8,0,23.4551,a8w8_blockscale_1x128x128_256x16x64x256_16x16_16x16_16x16x1_16x16x1_1x16x1x16_4_1x1_intrawave_v1,0,0,0
80,32,576,7168,8,0,23.4111,a8w8_blockscale_1x128x128_256x16x64x256_16x16_16x16_16x16x1_16x16x1_1x16x1x16_4_1x1_intrawave_v1,0,0,0
80,64,576,7168,8,0,23.0827,a8w8_blockscale_1x128x128_256x16x64x256_16x16_16x16_16x16x1_16x16x1_1x16x1x16_4_1x1_intrawave_v1,0,0,0
80,128,576,7168,8,0,22.7915,a8w8_blockscale_1x128x128_256x16x64x256_16x16_16x16_16x16x1_16x16x1_1x16x1x16_4_1x1_intrawave_v1,0,0,0
80,256,576,7168,8,0,29.3363,a8w8_blockscale_1x128x128_256x16x64x256_16x16_16x16_16x16x1_16x16x1_1x16x1x16_4_1x1_intrawave_v1,0,0,0
80,512,576,7168,18,0,32.2327,a8w8_blockscale_1x128x128_256x64x64x256_16x16_32x32_16x16x1_16x16x1_1x32x1x8_8_1x1_intrawave_v1,0,0,0
80,1024,576,7168,18,0,49.8928,a8w8_blockscale_1x128x128_256x64x64x256_16x16_32x32_16x16x1_16x16x1_1x32x1x8_8_1x1_intrawave_v1,0,0,0
80,1536,576,7168,18,0,78.9361,a8w8_blockscale_1x128x128_256x64x64x256_16x16_32x32_16x16x1_16x16x1_1x32x1x8_8_1x1_intrawave_v1,0,0,0
80,2048,576,7168,18,0,97.8062,a8w8_blockscale_1x128x128_256x64x64x256_16x16_32x32_16x16x1_16x16x1_1x32x1x8_8_1x1_intrawave_v1,0,0,0
80,4096,576,7168,18,0,188.7622,a8w8_blockscale_1x128x128_256x64x64x256_16x16_32x32_16x16x1_16x16x1_1x32x1x8_8_1x1_intrawave_v1,0,0,0
80,8192,576,7168,18,0,353.3597,a8w8_blockscale_1x128x128_256x64x64x256_16x16_32x32_16x16x1_16x16x1_1x32x1x8_8_1x1_intrawave_v1,0,0,0
80,16384,576,7168,18,0,679.861,a8w8_blockscale_1x128x128_256x64x64x256_16x16_32x32_16x16x1_16x16x1_1x32x1x8_8_1x1_intrawave_v1,0,0,0
80,20480,576,7168,18,0,844.2841,a8w8_blockscale_1x128x128_256x64x64x256_16x16_32x32_16x16x1_16x16x1_1x32x1x8_8_1x1_intrawave_v1,0,0,0
80,32768,576,7168,18,0,1350.8663,a8w8_blockscale_1x128x128_256x64x64x256_16x16_32x32_16x16x1_16x16x1_1x32x1x8_8_1x1_intrawave_v1,0,0,0
80,65536,576,7168,18,0,2678.1872,a8w8_blockscale_1x128x128_256x64x64x256_16x16_32x32_16x16x1_16x16x1_1x32x1x8_8_1x1_intrawave_v1,0,0,0
80,98304,576,7168,2,0,4586.9954,a8w8_blockscale_1x128x128_256x64x128x128_16x16_32x32_8x32x1_8x32x1_1x32x1x8_8_1x1_intrawave_v3,0,0,0
80,131072,576,7168,18,0,5376.424,a8w8_blockscale_1x128x128_256x64x64x256_16x16_32x32_16x16x1_16x16x1_1x32x1x8_8_1x1_intrawave_v1,0,0,0
80,16,1536,7168,8,0,23.9251,a8w8_blockscale_1x128x128_256x16x64x256_16x16_16x16_16x16x1_16x16x1_1x16x1x16_4_1x1_intrawave_v1,0,0,0
80,32,1536,7168,8,0,23.8595,a8w8_blockscale_1x128x128_256x16x64x256_16x16_16x16_16x16x1_16x16x1_1x16x1x16_4_1x1_intrawave_v1,0,0,0
80,64,1536,7168,8,0,27.2559,a8w8_blockscale_1x128x128_256x16x64x256_16x16_16x16_16x16x1_16x16x1_1x16x1x16_4_1x1_intrawave_v1,0,0,0
80,128,1536,7168,18,0,32.4591,a8w8_blockscale_1x128x128_256x64x64x256_16x16_32x32_16x16x1_16x16x1_1x32x1x8_8_1x1_intrawave_v1,0,0,0
80,256,1536,7168,18,0,48.3696,a8w8_blockscale_1x128x128_256x64x64x256_16x16_32x32_16x16x1_16x16x1_1x32x1x8_8_1x1_intrawave_v1,0,0,0
80,512,1536,7168,18,0,78.2381,a8w8_blockscale_1x128x128_256x64x64x256_16x16_32x32_16x16x1_16x16x1_1x32x1x8_8_1x1_intrawave_v1,0,0,0
80,1024,1536,7168,18,0,123.7307,a8w8_blockscale_1x128x128_256x64x64x256_16x16_32x32_16x16x1_16x16x1_1x32x1x8_8_1x1_intrawave_v1,0,0,0
80,1536,1536,7168,18,0,189.361,a8w8_blockscale_1x128x128_256x64x64x256_16x16_32x32_16x16x1_16x16x1_1x32x1x8_8_1x1_intrawave_v1,0,0,0
80,2048,1536,7168,18,0,235.344,a8w8_blockscale_1x128x128_256x64x64x256_16x16_32x32_16x16x1_16x16x1_1x32x1x8_8_1x1_intrawave_v1,0,0,0
80,4096,1536,7168,18,0,463.9265,a8w8_blockscale_1x128x128_256x64x64x256_16x16_32x32_16x16x1_16x16x1_1x32x1x8_8_1x1_intrawave_v1,0,0,0
80,8192,1536,7168,18,0,900.4323,a8w8_blockscale_1x128x128_256x64x64x256_16x16_32x32_16x16x1_16x16x1_1x32x1x8_8_1x1_intrawave_v1,0,0,0
80,16384,1536,7168,18,0,1774.7531,a8w8_blockscale_1x128x128_256x64x64x256_16x16_32x32_16x16x1_16x16x1_1x32x1x8_8_1x1_intrawave_v1,0,0,0
80,20480,1536,7168,2,0,2192.846,a8w8_blockscale_1x128x128_256x64x128x128_16x16_32x32_8x32x1_8x32x1_1x32x1x8_8_1x1_intrawave_v3,0,0,0
80,32768,1536,7168,0,0,2845.5978,a8w8_blockscale_1x128x128_256x128x128x128_16x16_32x32_8x32x1_8x32x1_1x32x1x8_8_1x1_intrawave_v3,0,0,0
80,65536,1536,7168,0,0,5455.1913,a8w8_blockscale_1x128x128_256x128x128x128_16x16_32x32_8x32x1_8x32x1_1x32x1x8_8_1x1_intrawave_v3,0,0,0
80,98304,1536,7168,0,0,8187.0758,a8w8_blockscale_1x128x128_256x128x128x128_16x16_32x32_8x32x1_8x32x1_1x32x1x8_8_1x1_intrawave_v3,0,0,0
80,131072,1536,7168,0,0,10881.6908,a8w8_blockscale_1x128x128_256x128x128x128_16x16_32x32_8x32x1_8x32x1_1x32x1x8_8_1x1_intrawave_v3,0,0,0
80,1,2112,7168,8,0,29.6812,a8w8_blockscale_1x128x128_256x16x64x256_16x16_16x16_16x16x1_16x16x1_1x16x1x16_4_1x1_intrawave_v1,0,0,0
80,2,2112,7168,8,0,29.936,a8w8_blockscale_1x128x128_256x16x64x256_16x16_16x16_16x16x1_16x16x1_1x16x1x16_4_1x1_intrawave_v1,0,0,0
80,4,2112,7168,8,0,30.8,a8w8_blockscale_1x128x128_256x16x64x256_16x16_16x16_16x16x1_16x16x1_1x16x1x16_4_1x1_intrawave_v1,0,0,0
80,8,2112,7168,8,0,31.0184,a8w8_blockscale_1x128x128_256x16x64x256_16x16_16x16_16x16x1_16x16x1_1x16x1x16_4_1x1_intrawave_v1,0,0,0
80,16,2112,7168,8,0,23.8827,a8w8_blockscale_1x128x128_256x16x64x256_16x16_16x16_16x16x1_16x16x1_1x16x1x16_4_1x1_intrawave_v1,0,0,0
80,32,2112,7168,8,0,23.8695,a8w8_blockscale_1x128x128_256x16x64x256_16x16_16x16_16x16x1_16x16x1_1x16x1x16_4_1x1_intrawave_v1,0,0,0
80,64,2112,7168,8,0,30.6896,a8w8_blockscale_1x128x128_256x16x64x256_16x16_16x16_16x16x1_16x16x1_1x16x1x16_4_1x1_intrawave_v1,0,0,0
80,96,2112,7168,18,0,36.1692,a8w8_blockscale_1x128x128_256x64x64x256_16x16_32x32_16x16x1_16x16x1_1x32x1x8_8_1x1_intrawave_v1,0,0,0
80,128,2112,7168,18,0,32.8696,a8w8_blockscale_1x128x128_256x64x64x256_16x16_32x32_16x16x1_16x16x1_1x32x1x8_8_1x1_intrawave_v1,0,0,0
80,160,2112,7168,18,0,53.5813,a8w8_blockscale_1x128x128_256x64x64x256_16x16_32x32_16x16x1_16x16x1_1x32x1x8_8_1x1_intrawave_v1,0,0,0
80,192,2112,7168,18,0,49.1485,a8w8_blockscale_1x128x128_256x64x64x256_16x16_32x32_16x16x1_16x16x1_1x32x1x8_8_1x1_intrawave_v1,0,0,0
80,224,2112,7168,18,0,54.1121,a8w8_blockscale_1x128x128_256x64x64x256_16x16_32x32_16x16x1_16x16x1_1x32x1x8_8_1x1_intrawave_v1,0,0,0
80,256,2112,7168,18,0,49.4557,a8w8_blockscale_1x128x128_256x64x64x256_16x16_32x32_16x16x1_16x16x1_1x32x1x8_8_1x1_intrawave_v1,0,0,0
80,288,2112,7168,13,0,81.8363,a8w8_blockscale_1x128x128_256x32x64x256_16x16_16x16_16x16x1_16x16x1_1x32x1x8_8_2x1_intrawave_v1,0,0,0
80,320,2112,7168,18,0,79.0835,a8w8_blockscale_1x128x128_256x64x64x256_16x16_32x32_16x16x1_16x16x1_1x32x1x8_8_1x1_intrawave_v1,0,0,0
80,352,2112,7168,18,0,86.7303,a8w8_blockscale_1x128x128_256x64x64x256_16x16_32x32_16x16x1_16x16x1_1x32x1x8_8_1x1_intrawave_v1,0,0,0
80,384,2112,7168,18,0,77.6818,a8w8_blockscale_1x128x128_256x64x64x256_16x16_32x32_16x16x1_16x16x1_1x32x1x8_8_1x1_intrawave_v1,0,0,0
80,416,2112,7168,18,0,85.7363,a8w8_blockscale_1x128x128_256x64x64x256_16x16_32x32_16x16x1_16x16x1_1x32x1x8_8_1x1_intrawave_v1,0,0,0
80,448,2112,7168,18,0,78.2418,a8w8_blockscale_1x128x128_256x64x64x256_16x16_32x32_16x16x1_16x16x1_1x32x1x8_8_1x1_intrawave_v1,0,0,0
80,480,2112,7168,2,0,101.052,a8w8_blockscale_1x128x128_256x64x128x128_16x16_32x32_8x32x1_8x32x1_1x32x1x8_8_1x1_intrawave_v3,0,0,0
80,512,2112,7168,18,0,95.2955,a8w8_blockscale_1x128x128_256x64x64x256_16x16_32x32_16x16x1_16x16x1_1x32x1x8_8_1x1_intrawave_v1,0,0,0
80,1024,2112,7168,18,0,167.8663,a8w8_blockscale_1x128x128_256x64x64x256_16x16_32x32_16x16x1_16x16x1_1x32x1x8_8_1x1_intrawave_v1,0,0,0
80,2048,2112,7168,18,0,322.7936,a8w8_blockscale_1x128x128_256x64x64x256_16x16_32x32_16x16x1_16x16x1_1x32x1x8_8_1x1_intrawave_v1,0,0,0
80,4096,2112,7168,18,0,621.3309,a8w8_blockscale_1x128x128_256x64x64x256_16x16_32x32_16x16x1_16x16x1_1x32x1x8_8_1x1_intrawave_v1,0,0,0
80,6144,2112,7168,18,0,913.7307,a8w8_blockscale_1x128x128_256x64x64x256_16x16_32x32_16x16x1_16x16x1_1x32x1x8_8_1x1_intrawave_v1,0,0,0
80,8192,2112,7168,18,0,1213.0298,a8w8_blockscale_1x128x128_256x64x64x256_16x16_32x32_16x16x1_16x16x1_1x32x1x8_8_1x1_intrawave_v1,0,0,0
80,10240,2112,7168,18,0,1515.2969,a8w8_blockscale_1x128x128_256x64x64x256_16x16_32x32_16x16x1_16x16x1_1x32x1x8_8_1x1_intrawave_v1,0,0,0
80,12288,2112,7168,18,0,1828.9839,a8w8_blockscale_1x128x128_256x64x64x256_16x16_32x32_16x16x1_16x16x1_1x32x1x8_8_1x1_intrawave_v1,0,0,0
80,14336,2112,7168,18,0,2116.3028,a8w8_blockscale_1x128x128_256x64x64x256_16x16_32x32_16x16x1_16x16x1_1x32x1x8_8_1x1_intrawave_v1,0,0,0
80,16384,2112,7168,18,0,2419.3022,a8w8_blockscale_1x128x128_256x64x64x256_16x16_32x32_16x16x1_16x16x1_1x32x1x8_8_1x1_intrawave_v1,0,0,0
80,32768,2112,7168,18,0,4824.1677,a8w8_blockscale_1x128x128_256x64x64x256_16x16_32x32_16x16x1_16x16x1_1x32x1x8_8_1x1_intrawave_v1,0,0,0
80,65536,2112,7168,18,0,9617.2811,a8w8_blockscale_1x128x128_256x64x64x256_16x16_32x32_16x16x1_16x16x1_1x32x1x8_8_1x1_intrawave_v1,0,0,0
80,98304,2112,7168,2,0,14838.37,a8w8_blockscale_1x128x128_256x64x128x128_16x16_32x32_8x32x1_8x32x1_1x32x1x8_8_1x1_intrawave_v3,0,0,0
80,131072,2112,7168,18,0,19268.6081,a8w8_blockscale_1x128x128_256x64x64x256_16x16_32x32_16x16x1_16x16x1_1x32x1x8_8_1x1_intrawave_v1,0,0,0
80,1,2240,7168,8,0,29.5828,a8w8_blockscale_1x128x128_256x16x64x256_16x16_16x16_16x16x1_16x16x1_1x16x1x16_4_1x1_intrawave_v1,0,0,0
80,2,2240,7168,8,0,29.5412,a8w8_blockscale_1x128x128_256x16x64x256_16x16_16x16_16x16x1_16x16x1_1x16x1x16_4_1x1_intrawave_v1,0,0,0
80,4,2240,7168,8,0,30.7308,a8w8_blockscale_1x128x128_256x16x64x256_16x16_16x16_16x16x1_16x16x1_1x16x1x16_4_1x1_intrawave_v1,0,0,0
80,8,2240,7168,8,0,31.1992,a8w8_blockscale_1x128x128_256x16x64x256_16x16_16x16_16x16x1_16x16x1_1x16x1x16_4_1x1_intrawave_v1,0,0,0
80,16,2240,7168,8,0,24.0495,a8w8_blockscale_1x128x128_256x16x64x256_16x16_16x16_16x16x1_16x16x1_1x16x1x16_4_1x1_intrawave_v1,0,0,0
80,32,2240,7168,8,0,24.0079,a8w8_blockscale_1x128x128_256x16x64x256_16x16_16x16_16x16x1_16x16x1_1x16x1x16_4_1x1_intrawave_v1,0,0,0
80,64,2240,7168,8,0,30.7432,a8w8_blockscale_1x128x128_256x16x64x256_16x16_16x16_16x16x1_16x16x1_1x16x1x16_4_1x1_intrawave_v1,0,0,0
80,96,2240,7168,18,0,36.3512,a8w8_blockscale_1x128x128_256x64x64x256_16x16_32x32_16x16x1_16x16x1_1x32x1x8_8_1x1_intrawave_v1,0,0,0
80,128,2240,7168,18,0,32.9736,a8w8_blockscale_1x128x128_256x64x64x256_16x16_32x32_16x16x1_16x16x1_1x32x1x8_8_1x1_intrawave_v1,0,0,0
80,160,2240,7168,18,0,54.0881,a8w8_blockscale_1x128x128_256x64x64x256_16x16_32x32_16x16x1_16x16x1_1x32x1x8_8_1x1_intrawave_v1,0,0,0
80,192,2240,7168,18,0,49.4897,a8w8_blockscale_1x128x128_256x64x64x256_16x16_32x32_16x16x1_16x16x1_1x32x1x8_8_1x1_intrawave_v1,0,0,0
80,224,2240,7168,18,0,54.4329,a8w8_blockscale_1x128x128_256x64x64x256_16x16_32x32_16x16x1_16x16x1_1x32x1x8_8_1x1_intrawave_v1,0,0,0
80,256,2240,7168,18,0,49.7517,a8w8_blockscale_1x128x128_256x64x64x256_16x16_32x32_16x16x1_16x16x1_1x32x1x8_8_1x1_intrawave_v1,0,0,0
80,288,2240,7168,13,0,82.4603,a8w8_blockscale_1x128x128_256x32x64x256_16x16_16x16_16x16x1_16x16x1_1x32x1x8_8_2x1_intrawave_v1,0,0,0
80,320,2240,7168,18,0,77.7226,a8w8_blockscale_1x128x128_256x64x64x256_16x16_32x32_16x16x1_16x16x1_1x32x1x8_8_1x1_intrawave_v1,0,0,0
80,352,2240,7168,18,0,85.4167,a8w8_blockscale_1x128x128_256x64x64x256_16x16_32x32_16x16x1_16x16x1_1x32x1x8_8_1x1_intrawave_v1,0,0,0
80,384,2240,7168,18,0,79.7882,a8w8_blockscale_1x128x128_256x64x64x256_16x16_32x32_16x16x1_16x16x1_1x32x1x8_8_1x1_intrawave_v1,0,0,0
80,416,2240,7168,2,0,100.4724,a8w8_blockscale_1x128x128_256x64x128x128_16x16_32x32_8x32x1_8x32x1_1x32x1x8_8_1x1_intrawave_v3,0,0,0
80,448,2240,7168,18,0,94.1239,a8w8_blockscale_1x128x128_256x64x64x256_16x16_32x32_16x16x1_16x16x1_1x32x1x8_8_1x1_intrawave_v1,0,0,0
80,480,2240,7168,2,0,100.3492,a8w8_blockscale_1x128x128_256x64x128x128_16x16_32x32_8x32x1_8x32x1_1x32x1x8_8_1x1_intrawave_v3,0,0,0
80,512,2240,7168,18,0,96.0611,a8w8_blockscale_1x128x128_256x64x64x256_16x16_32x32_16x16x1_16x16x1_1x32x1x8_8_1x1_intrawave_v1,0,0,0
80,1024,2240,7168,18,0,171.2028,a8w8_blockscale_1x128x128_256x64x64x256_16x16_32x32_16x16x1_16x16x1_1x32x1x8_8_1x1_intrawave_v1,0,0,0
80,2048,2240,7168,18,0,330.7757,a8w8_blockscale_1x128x128_256x64x64x256_16x16_32x32_16x16x1_16x16x1_1x32x1x8_8_1x1_intrawave_v1,0,0,0
80,4096,2240,7168,18,0,643.893,a8w8_blockscale_1x128x128_256x64x64x256_16x16_32x32_16x16x1_16x16x1_1x32x1x8_8_1x1_intrawave_v1,0,0,0
80,6144,2240,7168,18,0,963.2848,a8w8_blockscale_1x128x128_256x64x64x256_16x16_32x32_16x16x1_16x16x1_1x32x1x8_8_1x1_intrawave_v1,0,0,0
80,8192,2240,7168,18,0,1280.2434,a8w8_blockscale_1x128x128_256x64x64x256_16x16_32x32_16x16x1_16x16x1_1x32x1x8_8_1x1_intrawave_v1,0,0,0
80,10240,2240,7168,18,0,1636.782,a8w8_blockscale_1x128x128_256x64x64x256_16x16_32x32_16x16x1_16x16x1_1x32x1x8_8_1x1_intrawave_v1,0,0,0
80,12288,2240,7168,2,0,2046.9716,a8w8_blockscale_1x128x128_256x64x128x128_16x16_32x32_8x32x1_8x32x1_1x32x1x8_8_1x1_intrawave_v3,0,0,0
80,14336,2240,7168,18,0,2246.3365,a8w8_blockscale_1x128x128_256x64x64x256_16x16_32x32_16x16x1_16x16x1_1x32x1x8_8_1x1_intrawave_v1,0,0,0
80,16384,2240,7168,18,0,2564.4367,a8w8_blockscale_1x128x128_256x64x64x256_16x16_32x32_16x16x1_16x16x1_1x32x1x8_8_1x1_intrawave_v1,0,0,0
80,32768,2240,7168,18,0,5242.0726,a8w8_blockscale_1x128x128_256x64x64x256_16x16_32x32_16x16x1_16x16x1_1x32x1x8_8_1x1_intrawave_v1,0,0,0
80,65536,2240,7168,2,0,10800.6316,a8w8_blockscale_1x128x128_256x64x128x128_16x16_32x32_8x32x1_8x32x1_1x32x1x8_8_1x1_intrawave_v3,0,0,0
80,98304,2240,7168,18,0,15696.2548,a8w8_blockscale_1x128x128_256x64x64x256_16x16_32x32_16x16x1_16x16x1_1x32x1x8_8_1x1_intrawave_v1,0,0,0
80,131072,2240,7168,18,0,20374.7532,a8w8_blockscale_1x128x128_256x64x64x256_16x16_32x32_16x16x1_16x16x1_1x32x1x8_8_1x1_intrawave_v1,0,0,0
80,1,3072,1536,8,0,8.805,a8w8_blockscale_1x128x128_256x16x64x256_16x16_16x16_16x16x1_16x16x1_1x16x1x16_4_1x1_intrawave_v1,0,0,0
80,2,3072,1536,8,0,8.5502,a8w8_blockscale_1x128x128_256x16x64x256_16x16_16x16_16x16x1_16x16x1_1x16x1x16_4_1x1_intrawave_v1,0,0,0
80,4,3072,1536,8,0,8.4646,a8w8_blockscale_1x128x128_256x16x64x256_16x16_16x16_16x16x1_16x16x1_1x16x1x16_4_1x1_intrawave_v1,0,0,0
80,8,3072,1536,8,0,9.7794,a8w8_blockscale_1x128x128_256x16x64x256_16x16_16x16_16x16x1_16x16x1_1x16x1x16_4_1x1_intrawave_v1,0,0,0
80,16,3072,1536,8,0,8.4118,a8w8_blockscale_1x128x128_256x16x64x256_16x16_16x16_16x16x1_16x16x1_1x16x1x16_4_1x1_intrawave_v1,0,0,0
80,32,3072,1536,8,0,10.1678,a8w8_blockscale_1x128x128_256x16x64x256_16x16_16x16_16x16x1_16x16x1_1x16x1x16_4_1x1_intrawave_v1,0,0,0
80,64,3072,1536,18,0,10.6566,a8w8_blockscale_1x128x128_256x64x64x256_16x16_32x32_16x16x1_16x16x1_1x32x1x8_8_1x1_intrawave_v1,0,0,0
80,96,3072,1536,12,0,12.2499,a8w8_blockscale_1x128x128_256x32x128x256_16x16_32x32_16x16x1_16x16x1_1x32x1x8_8_1x1_intrawave_v1,0,0,0
80,128,3072,1536,18,0,16.6331,a8w8_blockscale_1x128x128_256x64x64x256_16x16_32x32_16x16x1_16x16x1_1x32x1x8_8_1x1_intrawave_v1,0,0,0
80,160,3072,1536,18,0,16.9339,a8w8_blockscale_1x128x128_256x64x64x256_16x16_32x32_16x16x1_16x16x1_1x32x1x8_8_1x1_intrawave_v1,0,0,0
80,192,3072,1536,18,0,16.5627,a8w8_blockscale_1x128x128_256x64x64x256_16x16_32x32_16x16x1_16x16x1_1x32x1x8_8_1x1_intrawave_v1,0,0,0
80,224,3072,1536,3,0,23.8183,a8w8_blockscale_1x128x128_256x64x64x128_16x16_32x32_8x32x1_8x32x1_1x32x1x8_8_1x1_intrawave_v3,0,0,0
80,256,3072,1536,18,0,23.6371,a8w8_blockscale_1x128x128_256x64x64x256_16x16_32x32_16x16x1_16x16x1_1x32x1x8_8_1x1_intrawave_v1,0,0,0
80,288,3072,1536,3,0,25.3575,a8w8_blockscale_1x128x128_256x64x64x128_16x16_32x32_8x32x1_8x32x1_1x32x1x8_8_1x1_intrawave_v3,0,0,0
80,320,3072,1536,18,0,23.6307,a8w8_blockscale_1x128x128_256x64x64x256_16x16_32x32_16x16x1_16x16x1_1x32x1x8_8_1x1_intrawave_v1,0,0,0
80,352,3072,1536,2,0,29.2036,a8w8_blockscale_1x128x128_256x64x128x128_16x16_32x32_8x32x1_8x32x1_1x32x1x8_8_1x1_intrawave_v3,0,0,0
80,384,3072,1536,2,0,30.3712,a8w8_blockscale_1x128x128_256x64x128x128_16x16_32x32_8x32x1_8x32x1_1x32x1x8_8_1x1_intrawave_v3,0,0,0
80,416,3072,1536,3,0,36.8592,a8w8_blockscale_1x128x128_256x64x64x128_16x16_32x32_8x32x1_8x32x1_1x32x1x8_8_1x1_intrawave_v3,0,0,0
80,448,3072,1536,18,0,36.0088,a8w8_blockscale_1x128x128_256x64x64x256_16x16_32x32_16x16x1_16x16x1_1x32x1x8_8_1x1_intrawave_v1,0,0,0
80,480,3072,1536,3,0,37.096,a8w8_blockscale_1x128x128_256x64x64x128_16x16_32x32_8x32x1_8x32x1_1x32x1x8_8_1x1_intrawave_v3,0,0,0
80,512,3072,1536,18,0,36.9459,a8w8_blockscale_1x128x128_256x64x64x256_16x16_32x32_16x16x1_16x16x1_1x32x1x8_8_1x1_intrawave_v1,0,0,0
80,1024,3072,1536,16,0,65.0637,a8w8_blockscale_1x128x128_256x64x64x128_16x16_32x32_8x32x1_8x32x1_1x32x1x8_8_1x1_intrawave_v1,0,0,0
80,1536,3072,1536,16,0,92.7146,a8w8_blockscale_1x128x128_256x64x64x128_16x16_32x32_8x32x1_8x32x1_1x32x1x8_8_1x1_intrawave_v1,0,0,0
80,2048,3072,1536,16,0,120.9511,a8w8_blockscale_1x128x128_256x64x64x128_16x16_32x32_8x32x1_8x32x1_1x32x1x8_8_1x1_intrawave_v1,0,0,0
80,4096,3072,1536,16,0,226.6147,a8w8_blockscale_1x128x128_256x64x64x128_16x16_32x32_8x32x1_8x32x1_1x32x1x8_8_1x1_intrawave_v1,0,0,0
80,6144,3072,1536,16,0,330.8397,a8w8_blockscale_1x128x128_256x64x64x128_16x16_32x32_8x32x1_8x32x1_1x32x1x8_8_1x1_intrawave_v1,0,0,0
80,8192,3072,1536,16,0,438.686,a8w8_blockscale_1x128x128_256x64x64x128_16x16_32x32_8x32x1_8x32x1_1x32x1x8_8_1x1_intrawave_v1,0,0,0
80,10240,3072,1536,16,0,547.2561,a8w8_blockscale_1x128x128_256x64x64x128_16x16_32x32_8x32x1_8x32x1_1x32x1x8_8_1x1_intrawave_v1,0,0,0
80,12288,3072,1536,0,0,554.6374,a8w8_blockscale_1x128x128_256x128x128x128_16x16_32x32_8x32x1_8x32x1_1x32x1x8_8_1x1_intrawave_v3,0,0,0
80,14336,3072,1536,3,0,757.7926,a8w8_blockscale_1x128x128_256x64x64x128_16x16_32x32_8x32x1_8x32x1_1x32x1x8_8_1x1_intrawave_v3,0,0,0
80,16384,3072,1536,16,0,862.8613,a8w8_blockscale_1x128x128_256x64x64x128_16x16_32x32_8x32x1_8x32x1_1x32x1x8_8_1x1_intrawave_v1,0,0,0
80,20480,3072,1536,16,0,1076.861,a8w8_blockscale_1x128x128_256x64x64x128_16x16_32x32_8x32x1_8x32x1_1x32x1x8_8_1x1_intrawave_v1,0,0,0
80,32768,3072,1536,0,0,1461.7662,a8w8_blockscale_1x128x128_256x128x128x128_16x16_32x32_8x32x1_8x32x1_1x32x1x8_8_1x1_intrawave_v3,0,0,0
80,65536,3072,1536,3,0,3441.6001,a8w8_blockscale_1x128x128_256x64x64x128_16x16_32x32_8x32x1_8x32x1_1x32x1x8_8_1x1_intrawave_v3,0,0,0
80,98304,3072,1536,0,0,4372.9543,a8w8_blockscale_1x128x128_256x128x128x128_16x16_32x32_8x32x1_8x32x1_1x32x1x8_8_1x1_intrawave_v3,0,0,0
80,131072,3072,1536,3,0,6873.7457,a8w8_blockscale_1x128x128_256x64x64x128_16x16_32x32_8x32x1_8x32x1_1x32x1x8_8_1x1_intrawave_v3,0,0,0
80,1,4096,512,8,0,4.2994,a8w8_blockscale_1x128x128_256x16x64x256_16x16_16x16_16x16x1_16x16x1_1x16x1x16_4_1x1_intrawave_v1,0,0,0
80,2,4096,512,8,0,4.319,a8w8_blockscale_1x128x128_256x16x64x256_16x16_16x16_16x16x1_16x16x1_1x16x1x16_4_1x1_intrawave_v1,0,0,0
80,4,4096,512,8,0,4.3014,a8w8_blockscale_1x128x128_256x16x64x256_16x16_16x16_16x16x1_16x16x1_1x16x1x16_4_1x1_intrawave_v1,0,0,0
80,8,4096,512,8,0,4.2922,a8w8_blockscale_1x128x128_256x16x64x256_16x16_16x16_16x16x1_16x16x1_1x16x1x16_4_1x1_intrawave_v1,0,0,0
80,16,4096,512,8,0,4.2662,a8w8_blockscale_1x128x128_256x16x64x256_16x16_16x16_16x16x1_16x16x1_1x16x1x16_4_1x1_intrawave_v1,0,0,0
80,32,4096,512,13,0,4.8618,a8w8_blockscale_1x128x128_256x32x64x256_16x16_16x16_16x16x1_16x16x1_1x32x1x8_8_2x1_intrawave_v1,0,0,0
80,64,4096,512,18,0,6.7134,a8w8_blockscale_1x128x128_256x64x64x256_16x16_32x32_16x16x1_16x16x1_1x32x1x8_8_1x1_intrawave_v1,0,0,0
80,96,4096,512,18,0,9.8511,a8w8_blockscale_1x128x128_256x64x64x256_16x16_32x32_16x16x1_16x16x1_1x32x1x8_8_1x1_intrawave_v1,0,0,0
80,128,4096,512,18,0,9.695,a8w8_blockscale_1x128x128_256x64x64x256_16x16_32x32_16x16x1_16x16x1_1x32x1x8_8_1x1_intrawave_v1,0,0,0
80,160,4096,512,11,0,11.1599,a8w8_blockscale_1x128x128_256x32x64x128_16x16_16x16_8x32x1_8x32x1_1x32x1x8_8_2x1_intrawave_v1,0,0,0
80,192,4096,512,18,0,12.7227,a8w8_blockscale_1x128x128_256x64x64x256_16x16_32x32_16x16x1_16x16x1_1x32x1x8_8_1x1_intrawave_v1,0,0,0
80,224,4096,512,10,0,14.9871,a8w8_blockscale_1x128x128_256x32x128x128_16x16_32x32_8x32x1_8x32x1_1x32x1x8_8_1x1_intrawave_v1,0,0,0
80,256,4096,512,16,0,15.7294,a8w8_blockscale_1x128x128_256x64x64x128_16x16_32x32_8x32x1_8x32x1_1x32x1x8_8_1x1_intrawave_v1,0,0,0
80,288,4096,512,16,0,14.6299,a8w8_blockscale_1x128x128_256x64x64x128_16x16_32x32_8x32x1_8x32x1_1x32x1x8_8_1x1_intrawave_v1,0,0,0
80,320,4096,512,3,0,13.9711,a8w8_blockscale_1x128x128_256x64x64x128_16x16_32x32_8x32x1_8x32x1_1x32x1x8_8_1x1_intrawave_v3,0,0,0
80,352,4096,512,16,0,19.1615,a8w8_blockscale_1x128x128_256x64x64x128_16x16_32x32_8x32x1_8x32x1_1x32x1x8_8_1x1_intrawave_v1,0,0,0
80,384,4096,512,16,0,18.5131,a8w8_blockscale_1x128x128_256x64x64x128_16x16_32x32_8x32x1_8x32x1_1x32x1x8_8_1x1_intrawave_v1,0,0,0
80,416,4096,512,16,0,21.6743,a8w8_blockscale_1x128x128_256x64x64x128_16x16_32x32_8x32x1_8x32x1_1x32x1x8_8_1x1_intrawave_v1,0,0,0
80,448,4096,512,16,0,21.0995,a8w8_blockscale_1x128x128_256x64x64x128_16x16_32x32_8x32x1_8x32x1_1x32x1x8_8_1x1_intrawave_v1,0,0,0
80,480,4096,512,16,0,22.2995,a8w8_blockscale_1x128x128_256x64x64x128_16x16_32x32_8x32x1_8x32x1_1x32x1x8_8_1x1_intrawave_v1,0,0,0
80,512,4096,512,16,0,24.0675,a8w8_blockscale_1x128x128_256x64x64x128_16x16_32x32_8x32x1_8x32x1_1x32x1x8_8_1x1_intrawave_v1,0,0,0
80,1024,4096,512,16,0,39.5012,a8w8_blockscale_1x128x128_256x64x64x128_16x16_32x32_8x32x1_8x32x1_1x32x1x8_8_1x1_intrawave_v1,0,0,0
80,1536,4096,512,16,0,56.6284,a8w8_blockscale_1x128x128_256x64x64x128_16x16_32x32_8x32x1_8x32x1_1x32x1x8_8_1x1_intrawave_v1,0,0,0
80,2048,4096,512,16,0,71.9193,a8w8_blockscale_1x128x128_256x64x64x128_16x16_32x32_8x32x1_8x32x1_1x32x1x8_8_1x1_intrawave_v1,0,0,0
80,4096,4096,512,16,0,135.4396,a8w8_blockscale_1x128x128_256x64x64x128_16x16_32x32_8x32x1_8x32x1_1x32x1x8_8_1x1_intrawave_v1,0,0,0
80,6144,4096,512,16,0,196.9929,a8w8_blockscale_1x128x128_256x64x64x128_16x16_32x32_8x32x1_8x32x1_1x32x1x8_8_1x1_intrawave_v1,0,0,0
80,8192,4096,512,16,0,262.4441,a8w8_blockscale_1x128x128_256x64x64x128_16x16_32x32_8x32x1_8x32x1_1x32x1x8_8_1x1_intrawave_v1,0,0,0
80,10240,4096,512,16,0,322.5837,a8w8_blockscale_1x128x128_256x64x64x128_16x16_32x32_8x32x1_8x32x1_1x32x1x8_8_1x1_intrawave_v1,0,0,0
80,12288,4096,512,3,0,388.9976,a8w8_blockscale_1x128x128_256x64x64x128_16x16_32x32_8x32x1_8x32x1_1x32x1x8_8_1x1_intrawave_v3,0,0,0
80,14336,4096,512,16,0,451.8624,a8w8_blockscale_1x128x128_256x64x64x128_16x16_32x32_8x32x1_8x32x1_1x32x1x8_8_1x1_intrawave_v1,0,0,0
80,16384,4096,512,16,0,517.0127,a8w8_blockscale_1x128x128_256x64x64x128_16x16_32x32_8x32x1_8x32x1_1x32x1x8_8_1x1_intrawave_v1,0,0,0
80,20480,4096,512,16,0,643.2625,a8w8_blockscale_1x128x128_256x64x64x128_16x16_32x32_8x32x1_8x32x1_1x32x1x8_8_1x1_intrawave_v1,0,0,0
80,32768,4096,512,16,0,1024.1373,a8w8_blockscale_1x128x128_256x64x64x128_16x16_32x32_8x32x1_8x32x1_1x32x1x8_8_1x1_intrawave_v1,0,0,0
80,65536,4096,512,16,0,2019.1043,a8w8_blockscale_1x128x128_256x64x64x128_16x16_32x32_8x32x1_8x32x1_1x32x1x8_8_1x1_intrawave_v1,0,0,0
80,98304,4096,512,3,0,3142.5369,a8w8_blockscale_1x128x128_256x64x64x128_16x16_32x32_8x32x1_8x32x1_1x32x1x8_8_1x1_intrawave_v3,0,0,0
80,131072,4096,512,16,0,4029.3703,a8w8_blockscale_1x128x128_256x64x64x128_16x16_32x32_8x32x1_8x32x1_1x32x1x8_8_1x1_intrawave_v1,0,0,0
80,1,4096,7168,8,0,30.2807,a8w8_blockscale_1x128x128_256x16x64x256_16x16_16x16_16x16x1_16x16x1_1x16x1x16_4_1x1_intrawave_v1,0,0,0
80,2,4096,7168,8,0,30.4452,a8w8_blockscale_1x128x128_256x16x64x256_16x16_16x16_16x16x1_16x16x1_1x16x1x16_4_1x1_intrawave_v1,0,0,0
80,4,4096,7168,8,0,31.1835,a8w8_blockscale_1x128x128_256x16x64x256_16x16_16x16_16x16x1_16x16x1_1x16x1x16_4_1x1_intrawave_v1,0,0,0
80,8,4096,7168,8,0,31.6459,a8w8_blockscale_1x128x128_256x16x64x256_16x16_16x16_16x16x1_16x16x1_1x16x1x16_4_1x1_intrawave_v1,0,0,0
80,16,4096,7168,8,0,29.3875,a8w8_blockscale_1x128x128_256x16x64x256_16x16_16x16_16x16x1_16x16x1_1x16x1x16_4_1x1_intrawave_v1,0,0,0
80,32,4096,7168,7,0,32.7,a8w8_blockscale_1x128x128_256x16x128x256_16x16_16x16_16x16x1_16x16x1_1x16x1x16_8_1x2_intrawave_v1,0,0,0
80,64,4096,7168,18,0,33.6092,a8w8_blockscale_1x128x128_256x64x64x256_16x16_32x32_16x16x1_16x16x1_1x32x1x8_8_1x1_intrawave_v1,0,0,0
80,96,4096,7168,10,0,70.1189,a8w8_blockscale_1x128x128_256x32x128x128_16x16_32x32_8x32x1_8x32x1_1x32x1x8_8_1x1_intrawave_v1,0,0,0
80,128,4096,7168,18,0,51.234,a8w8_blockscale_1x128x128_256x64x64x256_16x16_32x32_16x16x1_16x16x1_1x32x1x8_8_1x1_intrawave_v1,0,0,0
80,160,4096,7168,12,0,71.1633,a8w8_blockscale_1x128x128_256x32x128x256_16x16_32x32_16x16x1_16x16x1_1x32x1x8_8_1x1_intrawave_v1,0,0,0
80,192,4096,7168,18,0,78.657,a8w8_blockscale_1x128x128_256x64x64x256_16x16_32x32_16x16x1_16x16x1_1x32x1x8_8_1x1_intrawave_v1,0,0,0
80,224,4096,7168,2,0,100.7899,a8w8_blockscale_1x128x128_256x64x128x128_16x16_32x32_8x32x1_8x32x1_1x32x1x8_8_1x1_intrawave_v3,0,0,0
80,256,4096,7168,0,0,107.5719,a8w8_blockscale_1x128x128_256x128x128x128_16x16_32x32_8x32x1_8x32x1_1x32x1x8_8_1x1_intrawave_v3,0,0,0
80,288,4096,7168,18,0,106.7871,a8w8_blockscale_1x128x128_256x64x64x256_16x16_32x32_16x16x1_16x16x1_1x32x1x8_8_1x1_intrawave_v1,0,0,0
80,320,4096,7168,18,0,99.8999,a8w8_blockscale_1x128x128_256x64x64x256_16x16_32x32_16x16x1_16x16x1_1x32x1x8_8_1x1_intrawave_v1,0,0,0
80,352,4096,7168,18,0,135.5164,a8w8_blockscale_1x128x128_256x64x64x256_16x16_32x32_16x16x1_16x16x1_1x32x1x8_8_1x1_intrawave_v1,0,0,0
80,384,4096,7168,2,0,157.4221,a8w8_blockscale_1x128x128_256x64x128x128_16x16_32x32_8x32x1_8x32x1_1x32x1x8_8_1x1_intrawave_v3,0,0,0
80,416,4096,7168,2,0,162.395,a8w8_blockscale_1x128x128_256x64x128x128_16x16_32x32_8x32x1_8x32x1_1x32x1x8_8_1x1_intrawave_v3,0,0,0
80,448,4096,7168,18,0,143.2833,a8w8_blockscale_1x128x128_256x64x64x256_16x16_32x32_16x16x1_16x16x1_1x32x1x8_8_1x1_intrawave_v1,0,0,0
80,480,4096,7168,2,0,193.8503,a8w8_blockscale_1x128x128_256x64x128x128_16x16_32x32_8x32x1_8x32x1_1x32x1x8_8_1x1_intrawave_v3,0,0,0
80,512,4096,7168,0,0,145.8489,a8w8_blockscale_1x128x128_256x128x128x128_16x16_32x32_8x32x1_8x32x1_1x32x1x8_8_1x1_intrawave_v3,0,0,0
80,1024,4096,7168,0,0,293.2092,a8w8_blockscale_1x128x128_256x128x128x128_16x16_32x32_8x32x1_8x32x1_1x32x1x8_8_1x1_intrawave_v3,0,0,0
80,2048,4096,7168,0,0,506.1934,a8w8_blockscale_1x128x128_256x128x128x128_16x16_32x32_8x32x1_8x32x1_1x32x1x8_8_1x1_intrawave_v3,0,0,0
80,4096,4096,7168,0,0,907.0889,a8w8_blockscale_1x128x128_256x128x128x128_16x16_32x32_8x32x1_8x32x1_1x32x1x8_8_1x1_intrawave_v3,0,0,0
80,6144,4096,7168,0,0,1377.5484,a8w8_blockscale_1x128x128_256x128x128x128_16x16_32x32_8x32x1_8x32x1_1x32x1x8_8_1x1_intrawave_v3,0,0,0
80,8192,4096,7168,0,0,1793.3575,a8w8_blockscale_1x128x128_256x128x128x128_16x16_32x32_8x32x1_8x32x1_1x32x1x8_8_1x1_intrawave_v3,0,0,0
80,10240,4096,7168,0,0,2250.9998,a8w8_blockscale_1x128x128_256x128x128x128_16x16_32x32_8x32x1_8x32x1_1x32x1x8_8_1x1_intrawave_v3,0,0,0
80,12288,4096,7168,0,0,2718.6056,a8w8_blockscale_1x128x128_256x128x128x128_16x16_32x32_8x32x1_8x32x1_1x32x1x8_8_1x1_intrawave_v3,0,0,0
80,14336,4096,7168,0,0,3229.5757,a8w8_blockscale_1x128x128_256x128x128x128_16x16_32x32_8x32x1_8x32x1_1x32x1x8_8_1x1_intrawave_v3,0,0,0
80,16384,4096,7168,0,0,3558.282,a8w8_blockscale_1x128x128_256x128x128x128_16x16_32x32_8x32x1_8x32x1_1x32x1x8_8_1x1_intrawave_v3,0,0,0
80,32768,4096,7168,0,0,7182.5926,a8w8_blockscale_1x128x128_256x128x128x128_16x16_32x32_8x32x1_8x32x1_1x32x1x8_8_1x1_intrawave_v3,0,0,0
80,65536,4096,7168,0,0,14374.4254,a8w8_blockscale_1x128x128_256x128x128x128_16x16_32x32_8x32x1_8x32x1_1x32x1x8_8_1x1_intrawave_v3,0,0,0
80,98304,4096,7168,0,0,21200.0175,a8w8_blockscale_1x128x128_256x128x128x128_16x16_32x32_8x32x1_8x32x1_1x32x1x8_8_1x1_intrawave_v3,0,0,0
80,131072,4096,7168,0,0,28332.6632,a8w8_blockscale_1x128x128_256x128x128x128_16x16_32x32_8x32x1_8x32x1_1x32x1x8_8_1x1_intrawave_v3,0,0,0
80,1,4608,7168,8,0,30.2356,a8w8_blockscale_1x128x128_256x16x64x256_16x16_16x16_16x16x1_16x16x1_1x16x1x16_4_1x1_intrawave_v1,0,0,0
80,2,4608,7168,18,0,35.42,a8w8_blockscale_1x128x128_256x64x64x256_16x16_32x32_16x16x1_16x16x1_1x32x1x8_8_1x1_intrawave_v1,0,0,0
80,4,4608,7168,8,0,31.122,a8w8_blockscale_1x128x128_256x16x64x256_16x16_16x16_16x16x1_16x16x1_1x16x1x16_4_1x1_intrawave_v1,0,0,0
80,8,4608,7168,8,0,31.6788,a8w8_blockscale_1x128x128_256x16x64x256_16x16_16x16_16x16x1_16x16x1_1x16x1x16_4_1x1_intrawave_v1,0,0,0
80,16,4608,7168,8,0,24.6427,a8w8_blockscale_1x128x128_256x16x64x256_16x16_16x16_16x16x1_16x16x1_1x16x1x16_4_1x1_intrawave_v1,0,0,0
80,32,4608,7168,7,0,32.9403,a8w8_blockscale_1x128x128_256x16x128x256_16x16_16x16_16x16x1_16x16x1_1x16x1x16_8_1x2_intrawave_v1,0,0,0
80,64,4608,7168,18,0,33.4247,a8w8_blockscale_1x128x128_256x64x64x256_16x16_32x32_16x16x1_16x16x1_1x32x1x8_8_1x1_intrawave_v1,0,0,0
80,96,4608,7168,18,0,54.5221,a8w8_blockscale_1x128x128_256x64x64x256_16x16_32x32_16x16x1_16x16x1_1x32x1x8_8_1x1_intrawave_v1,0,0,0
80,128,4608,7168,18,0,52.1776,a8w8_blockscale_1x128x128_256x64x64x256_16x16_32x32_16x16x1_16x16x1_1x32x1x8_8_1x1_intrawave_v1,0,0,0
80,160,4608,7168,3,0,81.3331,a8w8_blockscale_1x128x128_256x64x64x128_16x16_32x32_8x32x1_8x32x1_1x32x1x8_8_1x1_intrawave_v3,0,0,0
80,192,4608,7168,18,0,78.2074,a8w8_blockscale_1x128x128_256x64x64x256_16x16_32x32_16x16x1_16x16x1_1x32x1x8_8_1x1_intrawave_v1,0,0,0
80,224,4608,7168,2,0,103.4296,a8w8_blockscale_1x128x128_256x64x128x128_16x16_32x32_8x32x1_8x32x1_1x32x1x8_8_1x1_intrawave_v3,0,0,0
80,256,4608,7168,18,0,97.8358,a8w8_blockscale_1x128x128_256x64x64x256_16x16_32x32_16x16x1_16x16x1_1x32x1x8_8_1x1_intrawave_v1,0,0,0
80,288,4608,7168,18,0,134.2474,a8w8_blockscale_1x128x128_256x64x64x256_16x16_32x32_16x16x1_16x16x1_1x32x1x8_8_1x1_intrawave_v1,0,0,0
80,320,4608,7168,18,0,126.6017,a8w8_blockscale_1x128x128_256x64x64x256_16x16_32x32_16x16x1_16x16x1_1x32x1x8_8_1x1_intrawave_v1,0,0,0
80,352,4608,7168,18,0,156.3831,a8w8_blockscale_1x128x128_256x64x64x256_16x16_32x32_16x16x1_16x16x1_1x32x1x8_8_1x1_intrawave_v1,0,0,0
80,384,4608,7168,0,0,138.3706,a8w8_blockscale_1x128x128_256x128x128x128_16x16_32x32_8x32x1_8x32x1_1x32x1x8_8_1x1_intrawave_v3,0,0,0
80,416,4608,7168,2,0,195.7449,a8w8_blockscale_1x128x128_256x64x128x128_16x16_32x32_8x32x1_8x32x1_1x32x1x8_8_1x1_intrawave_v3,0,0,0
80,448,4608,7168,18,0,167.8608,a8w8_blockscale_1x128x128_256x64x64x256_16x16_32x32_16x16x1_16x16x1_1x32x1x8_8_1x1_intrawave_v1,0,0,0
80,480,4608,7168,2,0,197.4349,a8w8_blockscale_1x128x128_256x64x128x128_16x16_32x32_8x32x1_8x32x1_1x32x1x8_8_1x1_intrawave_v3,0,0,0
80,512,4608,7168,18,0,188.8186,a8w8_blockscale_1x128x128_256x64x64x256_16x16_32x32_16x16x1_16x16x1_1x32x1x8_8_1x1_intrawave_v1,0,0,0
80,1024,4608,7168,18,0,350.2185,a8w8_blockscale_1x128x128_256x64x64x256_16x16_32x32_16x16x1_16x16x1_1x32x1x8_8_1x1_intrawave_v1,0,0,0
80,1536,4608,7168,18,0,510.7043,a8w8_blockscale_1x128x128_256x64x64x256_16x16_32x32_16x16x1_16x16x1_1x32x1x8_8_1x1_intrawave_v1,0,0,0
80,2048,4608,7168,18,0,668.9049,a8w8_blockscale_1x128x128_256x64x64x256_16x16_32x32_16x16x1_16x16x1_1x32x1x8_8_1x1_intrawave_v1,0,0,0
80,4096,4608,7168,2,0,1326.7729,a8w8_blockscale_1x128x128_256x64x128x128_16x16_32x32_8x32x1_8x32x1_1x32x1x8_8_1x1_intrawave_v3,0,0,0
80,6144,4608,7168,0,0,1526.3692,a8w8_blockscale_1x128x128_256x128x128x128_16x16_32x32_8x32x1_8x32x1_1x32x1x8_8_1x1_intrawave_v3,0,0,0
80,8192,4608,7168,2,0,2612.1569,a8w8_blockscale_1x128x128_256x64x128x128_16x16_32x32_8x32x1_8x32x1_1x32x1x8_8_1x1_intrawave_v3,0,0,0
80,10240,4608,7168,0,0,2530.3997,a8w8_blockscale_1x128x128_256x128x128x128_16x16_32x32_8x32x1_8x32x1_1x32x1x8_8_1x1_intrawave_v3,0,0,0
80,12288,4608,7168,0,0,2993.2517,a8w8_blockscale_1x128x128_256x128x128x128_16x16_32x32_8x32x1_8x32x1_1x32x1x8_8_1x1_intrawave_v3,0,0,0
80,14336,4608,7168,0,0,3576.6846,a8w8_blockscale_1x128x128_256x128x128x128_16x16_32x32_8x32x1_8x32x1_1x32x1x8_8_1x1_intrawave_v3,0,0,0
80,16384,4608,7168,2,0,5184.7895,a8w8_blockscale_1x128x128_256x64x128x128_16x16_32x32_8x32x1_8x32x1_1x32x1x8_8_1x1_intrawave_v3,0,0,0
80,20480,4608,7168,2,0,6440.0431,a8w8_blockscale_1x128x128_256x64x128x128_16x16_32x32_8x32x1_8x32x1_1x32x1x8_8_1x1_intrawave_v3,0,0,0
80,32768,4608,7168,2,0,10392.1318,a8w8_blockscale_1x128x128_256x64x128x128_16x16_32x32_8x32x1_8x32x1_1x32x1x8_8_1x1_intrawave_v3,0,0,0
80,65536,4608,7168,0,0,15930.1957,a8w8_blockscale_1x128x128_256x128x128x128_16x16_32x32_8x32x1_8x32x1_1x32x1x8_8_1x1_intrawave_v3,0,0,0
80,98304,4608,7168,2,0,31224.8208,a8w8_blockscale_1x128x128_256x64x128x128_16x16_32x32_8x32x1_8x32x1_1x32x1x8_8_1x1_intrawave_v3,0,0,0
80,1,7168,256,6,0,4.389,a8w8_blockscale_1x128x128_256x16x64x128_8x16_16x16_16x16x1_8x32x1_1x16x1x16_4_1x1_intrawave_v1,0,0,0
80,2,7168,256,6,0,4.3638,a8w8_blockscale_1x128x128_256x16x64x128_8x16_16x16_16x16x1_8x32x1_1x16x1x16_4_1x1_intrawave_v1,0,0,0
80,4,7168,256,6,0,4.3806,a8w8_blockscale_1x128x128_256x16x64x128_8x16_16x16_16x16x1_8x32x1_1x16x1x16_4_1x1_intrawave_v1,0,0,0
80,8,7168,256,8,0,4.2986,a8w8_blockscale_1x128x128_256x16x64x256_16x16_16x16_16x16x1_16x16x1_1x16x1x16_4_1x1_intrawave_v1,0,0,0
80,16,7168,256,8,0,4.0534,a8w8_blockscale_1x128x128_256x16x64x256_16x16_16x16_16x16x1_16x16x1_1x16x1x16_4_1x1_intrawave_v1,0,0,0
80,32,7168,256,11,0,4.8618,a8w8_blockscale_1x128x128_256x32x64x128_16x16_16x16_8x32x1_8x32x1_1x32x1x8_8_2x1_intrawave_v1,0,0,0
80,64,7168,256,11,0,7.015,a8w8_blockscale_1x128x128_256x32x64x128_16x16_16x16_8x32x1_8x32x1_1x32x1x8_8_2x1_intrawave_v1,0,0,0
80,96,7168,256,6,0,9.3194,a8w8_blockscale_1x128x128_256x16x64x128_8x16_16x16_16x16x1_8x32x1_1x16x1x16_4_1x1_intrawave_v1,0,0,0
80,128,7168,256,16,0,9.5886,a8w8_blockscale_1x128x128_256x64x64x128_16x16_32x32_8x32x1_8x32x1_1x32x1x8_8_1x1_intrawave_v1,0,0,0
80,160,7168,256,11,0,10.8494,a8w8_blockscale_1x128x128_256x32x64x128_16x16_16x16_8x32x1_8x32x1_1x32x1x8_8_2x1_intrawave_v1,0,0,0
80,192,7168,256,16,0,12.7423,a8w8_blockscale_1x128x128_256x64x64x128_16x16_32x32_8x32x1_8x32x1_1x32x1x8_8_1x1_intrawave_v1,0,0,0
80,224,7168,256,11,0,13.9371,a8w8_blockscale_1x128x128_256x32x64x128_16x16_16x16_8x32x1_8x32x1_1x32x1x8_8_2x1_intrawave_v1,0,0,0
80,256,7168,256,16,0,14.5362,a8w8_blockscale_1x128x128_256x64x64x128_16x16_32x32_8x32x1_8x32x1_1x32x1x8_8_1x1_intrawave_v1,0,0,0
80,288,7168,256,11,0,16.8451,a8w8_blockscale_1x128x128_256x32x64x128_16x16_16x16_8x32x1_8x32x1_1x32x1x8_8_2x1_intrawave_v1,0,0,0
80,320,7168,256,16,0,16.5307,a8w8_blockscale_1x128x128_256x64x64x128_16x16_32x32_8x32x1_8x32x1_1x32x1x8_8_1x1_intrawave_v1,0,0,0
80,352,7168,256,11,0,19.9235,a8w8_blockscale_1x128x128_256x32x64x128_16x16_16x16_8x32x1_8x32x1_1x32x1x8_8_2x1_intrawave_v1,0,0,0
80,384,7168,256,16,0,19.8795,a8w8_blockscale_1x128x128_256x64x64x128_16x16_32x32_8x32x1_8x32x1_1x32x1x8_8_1x1_intrawave_v1,0,0,0
80,416,7168,256,11,0,22.6419,a8w8_blockscale_1x128x128_256x32x64x128_16x16_16x16_8x32x1_8x32x1_1x32x1x8_8_2x1_intrawave_v1,0,0,0
80,448,7168,256,16,0,21.6627,a8w8_blockscale_1x128x128_256x64x64x128_16x16_32x32_8x32x1_8x32x1_1x32x1x8_8_1x1_intrawave_v1,0,0,0
80,480,7168,256,11,0,25.0591,a8w8_blockscale_1x128x128_256x32x64x128_16x16_16x16_8x32x1_8x32x1_1x32x1x8_8_2x1_intrawave_v1,0,0,0
80,512,7168,256,16,0,24.5763,a8w8_blockscale_1x128x128_256x64x64x128_16x16_32x32_8x32x1_8x32x1_1x32x1x8_8_1x1_intrawave_v1,0,0,0
80,1024,7168,256,16,0,42.6144,a8w8_blockscale_1x128x128_256x64x64x128_16x16_32x32_8x32x1_8x32x1_1x32x1x8_8_1x1_intrawave_v1,0,0,0
80,1536,7168,256,16,0,60.2732,a8w8_blockscale_1x128x128_256x64x64x128_16x16_32x32_8x32x1_8x32x1_1x32x1x8_8_1x1_intrawave_v1,0,0,0
80,2048,7168,256,16,0,77.9877,a8w8_blockscale_1x128x128_256x64x64x128_16x16_32x32_8x32x1_8x32x1_1x32x1x8_8_1x1_intrawave_v1,0,0,0
80,4096,7168,256,16,0,149.8256,a8w8_blockscale_1x128x128_256x64x64x128_16x16_32x32_8x32x1_8x32x1_1x32x1x8_8_1x1_intrawave_v1,0,0,0
80,6144,7168,256,16,0,229.0933,a8w8_blockscale_1x128x128_256x64x64x128_16x16_32x32_8x32x1_8x32x1_1x32x1x8_8_1x1_intrawave_v1,0,0,0
80,8192,7168,256,16,0,293.267,a8w8_blockscale_1x128x128_256x64x64x128_16x16_32x32_8x32x1_8x32x1_1x32x1x8_8_1x1_intrawave_v1,0,0,0
80,10240,7168,256,16,0,368.4904,a8w8_blockscale_1x128x128_256x64x64x128_16x16_32x32_8x32x1_8x32x1_1x32x1x8_8_1x1_intrawave_v1,0,0,0
80,12288,7168,256,16,0,442.8496,a8w8_blockscale_1x128x128_256x64x64x128_16x16_32x32_8x32x1_8x32x1_1x32x1x8_8_1x1_intrawave_v1,0,0,0
80,14336,7168,256,16,0,524.9808,a8w8_blockscale_1x128x128_256x64x64x128_16x16_32x32_8x32x1_8x32x1_1x32x1x8_8_1x1_intrawave_v1,0,0,0
80,16384,7168,256,16,0,579.5334,a8w8_blockscale_1x128x128_256x64x64x128_16x16_32x32_8x32x1_8x32x1_1x32x1x8_8_1x1_intrawave_v1,0,0,0
80,20480,7168,256,16,0,723.218,a8w8_blockscale_1x128x128_256x64x64x128_16x16_32x32_8x32x1_8x32x1_1x32x1x8_8_1x1_intrawave_v1,0,0,0
80,32768,7168,256,16,0,1261.8447,a8w8_blockscale_1x128x128_256x64x64x128_16x16_32x32_8x32x1_8x32x1_1x32x1x8_8_1x1_intrawave_v1,0,0,0
80,65536,7168,256,16,0,2331.7635,a8w8_blockscale_1x128x128_256x64x64x128_16x16_32x32_8x32x1_8x32x1_1x32x1x8_8_1x1_intrawave_v1,0,0,0
80,98304,7168,256,16,0,3479.2173,a8w8_blockscale_1x128x128_256x64x64x128_16x16_32x32_8x32x1_8x32x1_1x32x1x8_8_1x1_intrawave_v1,0,0,0
80,131072,7168,256,16,0,4668.3753,a8w8_blockscale_1x128x128_256x64x64x128_16x16_32x32_8x32x1_8x32x1_1x32x1x8_8_1x1_intrawave_v1,0,0,0
80,1,7168,2048,8,0,13.3935,a8w8_blockscale_1x128x128_256x16x64x256_16x16_16x16_16x16x1_16x16x1_1x16x1x16_4_1x1_intrawave_v1,0,0,0
80,2,7168,2048,8,0,13.5635,a8w8_blockscale_1x128x128_256x16x64x256_16x16_16x16_16x16x1_16x16x1_1x16x1x16_4_1x1_intrawave_v1,0,0,0
80,4,7168,2048,8,0,13.6655,a8w8_blockscale_1x128x128_256x16x64x256_16x16_16x16_16x16x1_16x16x1_1x16x1x16_4_1x1_intrawave_v1,0,0,0
80,8,7168,2048,8,0,13.9275,a8w8_blockscale_1x128x128_256x16x64x256_16x16_16x16_16x16x1_16x16x1_1x16x1x16_4_1x1_intrawave_v1,0,0,0
80,16,7168,2048,8,0,12.9347,a8w8_blockscale_1x128x128_256x16x64x256_16x16_16x16_16x16x1_16x16x1_1x16x1x16_4_1x1_intrawave_v1,0,0,0
80,32,7168,2048,12,0,15.0959,a8w8_blockscale_1x128x128_256x32x128x256_16x16_32x32_16x16x1_16x16x1_1x32x1x8_8_1x1_intrawave_v1,0,0,0
80,64,7168,2048,18,0,21.5203,a8w8_blockscale_1x128x128_256x64x64x256_16x16_32x32_16x16x1_16x16x1_1x32x1x8_8_1x1_intrawave_v1,0,0,0
80,96,7168,2048,18,0,30.9572,a8w8_blockscale_1x128x128_256x64x64x256_16x16_32x32_16x16x1_16x16x1_1x32x1x8_8_1x1_intrawave_v1,0,0,0
80,128,7168,2048,18,0,29.8219,a8w8_blockscale_1x128x128_256x64x64x256_16x16_32x32_16x16x1_16x16x1_1x32x1x8_8_1x1_intrawave_v1,0,0,0
80,160,7168,2048,18,0,47.0101,a8w8_blockscale_1x128x128_256x64x64x256_16x16_32x32_16x16x1_16x16x1_1x32x1x8_8_1x1_intrawave_v1,0,0,0
80,192,7168,2048,18,0,44.5893,a8w8_blockscale_1x128x128_256x64x64x256_16x16_32x32_16x16x1_16x16x1_1x32x1x8_8_1x1_intrawave_v1,0,0,0
80,224,7168,2048,2,0,55.3617,a8w8_blockscale_1x128x128_256x64x128x128_16x16_32x32_8x32x1_8x32x1_1x32x1x8_8_1x1_intrawave_v3,0,0,0
80,256,7168,2048,18,0,53.1296,a8w8_blockscale_1x128x128_256x64x64x256_16x16_32x32_16x16x1_16x16x1_1x32x1x8_8_1x1_intrawave_v1,0,0,0
80,288,7168,2048,18,0,65.1418,a8w8_blockscale_1x128x128_256x64x64x256_16x16_32x32_16x16x1_16x16x1_1x32x1x8_8_1x1_intrawave_v1,0,0,0
80,320,7168,2048,18,0,63.8546,a8w8_blockscale_1x128x128_256x64x64x256_16x16_32x32_16x16x1_16x16x1_1x32x1x8_8_1x1_intrawave_v1,0,0,0
80,352,7168,2048,18,0,81.6351,a8w8_blockscale_1x128x128_256x64x64x256_16x16_32x32_16x16x1_16x16x1_1x32x1x8_8_1x1_intrawave_v1,0,0,0
80,384,7168,2048,18,0,76.1686,a8w8_blockscale_1x128x128_256x64x64x256_16x16_32x32_16x16x1_16x16x1_1x32x1x8_8_1x1_intrawave_v1,0,0,0
80,416,7168,2048,2,0,86.7631,a8w8_blockscale_1x128x128_256x64x128x128_16x16_32x32_8x32x1_8x32x1_1x32x1x8_8_1x1_intrawave_v3,0,0,0
80,448,7168,2048,18,0,84.8563,a8w8_blockscale_1x128x128_256x64x64x256_16x16_32x32_16x16x1_16x16x1_1x32x1x8_8_1x1_intrawave_v1,0,0,0
80,480,7168,2048,2,0,97.8496,a8w8_blockscale_1x128x128_256x64x128x128_16x16_32x32_8x32x1_8x32x1_1x32x1x8_8_1x1_intrawave_v3,0,0,0
80,512,7168,2048,18,0,100.9298,a8w8_blockscale_1x128x128_256x64x64x256_16x16_32x32_16x16x1_16x16x1_1x32x1x8_8_1x1_intrawave_v1,0,0,0
80,1024,7168,2048,18,0,188.3418,a8w8_blockscale_1x128x128_256x64x64x256_16x16_32x32_16x16x1_16x16x1_1x32x1x8_8_1x1_intrawave_v1,0,0,0
80,1536,7168,2048,2,0,264.6833,a8w8_blockscale_1x128x128_256x64x128x128_16x16_32x32_8x32x1_8x32x1_1x32x1x8_8_1x1_intrawave_v3,0,0,0
80,2048,7168,2048,2,0,352.5768,a8w8_blockscale_1x128x128_256x64x128x128_16x16_32x32_8x32x1_8x32x1_1x32x1x8_8_1x1_intrawave_v3,0,0,0
80,4096,7168,2048,2,0,677.8042,a8w8_blockscale_1x128x128_256x64x128x128_16x16_32x32_8x32x1_8x32x1_1x32x1x8_8_1x1_intrawave_v3,0,0,0
80,6144,7168,2048,0,0,809.0744,a8w8_blockscale_1x128x128_256x128x128x128_16x16_32x32_8x32x1_8x32x1_1x32x1x8_8_1x1_intrawave_v3,0,0,0
80,8192,7168,2048,0,0,1332.8349,a8w8_blockscale_1x128x128_256x128x128x128_16x16_32x32_8x32x1_8x32x1_1x32x1x8_8_1x1_intrawave_v3,0,0,0
80,10240,7168,2048,0,0,1327.4494,a8w8_blockscale_1x128x128_256x128x128x128_16x16_32x32_8x32x1_8x32x1_1x32x1x8_8_1x1_intrawave_v3,0,0,0
80,12288,7168,2048,0,0,1607.9242,a8w8_blockscale_1x128x128_256x128x128x128_16x16_32x32_8x32x1_8x32x1_1x32x1x8_8_1x1_intrawave_v3,0,0,0
80,14336,7168,2048,0,0,1856.2897,a8w8_blockscale_1x128x128_256x128x128x128_16x16_32x32_8x32x1_8x32x1_1x32x1x8_8_1x1_intrawave_v3,0,0,0
80,16384,7168,2048,0,0,2650.6467,a8w8_blockscale_1x128x128_256x128x128x128_16x16_32x32_8x32x1_8x32x1_1x32x1x8_8_1x1_intrawave_v3,0,0,0
80,20480,7168,2048,0,0,3312.2434,a8w8_blockscale_1x128x128_256x128x128x128_16x16_32x32_8x32x1_8x32x1_1x32x1x8_8_1x1_intrawave_v3,0,0,0
80,32768,7168,2048,0,0,4614.1608,a8w8_blockscale_1x128x128_256x128x128x128_16x16_32x32_8x32x1_8x32x1_1x32x1x8_8_1x1_intrawave_v3,0,0,0
80,65536,7168,2048,0,0,8385.3458,a8w8_blockscale_1x128x128_256x128x128x128_16x16_32x32_8x32x1_8x32x1_1x32x1x8_8_1x1_intrawave_v3,0,0,0
80,98304,7168,2048,0,0,12615.4473,a8w8_blockscale_1x128x128_256x128x128x128_16x16_32x32_8x32x1_8x32x1_1x32x1x8_8_1x1_intrawave_v3,0,0,0
80,131072,7168,2048,0,0,17225.8363,a8w8_blockscale_1x128x128_256x128x128x128_16x16_32x32_8x32x1_8x32x1_1x32x1x8_8_1x1_intrawave_v3,0,0,0
80,1,7168,2048,8,0,13.3935,a8w8_blockscale_1x128x128_256x16x64x256_16x16_16x16_16x16x1_16x16x1_1x16x1x16_4_1x1_intrawave_v1,0,0,0
80,2,7168,2048,8,0,13.5635,a8w8_blockscale_1x128x128_256x16x64x256_16x16_16x16_16x16x1_16x16x1_1x16x1x16_4_1x1_intrawave_v1,0,0,0
80,4,7168,2048,8,0,13.6655,a8w8_blockscale_1x128x128_256x16x64x256_16x16_16x16_16x16x1_16x16x1_1x16x1x16_4_1x1_intrawave_v1,0,0,0
80,8,7168,2048,8,0,13.9275,a8w8_blockscale_1x128x128_256x16x64x256_16x16_16x16_16x16x1_16x16x1_1x16x1x16_4_1x1_intrawave_v1,0,0,0
80,96,7168,2048,18,0,30.9572,a8w8_blockscale_1x128x128_256x64x64x256_16x16_32x32_16x16x1_16x16x1_1x32x1x8_8_1x1_intrawave_v1,0,0,0
80,160,7168,2048,18,0,47.0101,a8w8_blockscale_1x128x128_256x64x64x256_16x16_32x32_16x16x1_16x16x1_1x32x1x8_8_1x1_intrawave_v1,0,0,0
80,192,7168,2048,18,0,44.5893,a8w8_blockscale_1x128x128_256x64x64x256_16x16_32x32_16x16x1_16x16x1_1x32x1x8_8_1x1_intrawave_v1,0,0,0
80,224,7168,2048,2,0,55.3617,a8w8_blockscale_1x128x128_256x64x128x128_16x16_32x32_8x32x1_8x32x1_1x32x1x8_8_1x1_intrawave_v3,0,0,0
80,288,7168,2048,18,0,65.1418,a8w8_blockscale_1x128x128_256x64x64x256_16x16_32x32_16x16x1_16x16x1_1x32x1x8_8_1x1_intrawave_v1,0,0,0
80,320,7168,2048,18,0,63.8546,a8w8_blockscale_1x128x128_256x64x64x256_16x16_32x32_16x16x1_16x16x1_1x32x1x8_8_1x1_intrawave_v1,0,0,0
80,352,7168,2048,18,0,81.6351,a8w8_blockscale_1x128x128_256x64x64x256_16x16_32x32_16x16x1_16x16x1_1x32x1x8_8_1x1_intrawave_v1,0,0,0
80,384,7168,2048,18,0,76.1686,a8w8_blockscale_1x128x128_256x64x64x256_16x16_32x32_16x16x1_16x16x1_1x32x1x8_8_1x1_intrawave_v1,0,0,0
80,416,7168,2048,2,0,86.7631,a8w8_blockscale_1x128x128_256x64x128x128_16x16_32x32_8x32x1_8x32x1_1x32x1x8_8_1x1_intrawave_v3,0,0,0
80,448,7168,2048,18,0,84.8563,a8w8_blockscale_1x128x128_256x64x64x256_16x16_32x32_16x16x1_16x16x1_1x32x1x8_8_1x1_intrawave_v1,0,0,0
80,480,7168,2048,2,0,97.8496,a8w8_blockscale_1x128x128_256x64x128x128_16x16_32x32_8x32x1_8x32x1_1x32x1x8_8_1x1_intrawave_v3,0,0,0
80,6144,7168,2048,0,0,809.0744,a8w8_blockscale_1x128x128_256x128x128x128_16x16_32x32_8x32x1_8x32x1_1x32x1x8_8_1x1_intrawave_v3,0,0,0
80,10240,7168,2048,0,0,1327.4494,a8w8_blockscale_1x128x128_256x128x128x128_16x16_32x32_8x32x1_8x32x1_1x32x1x8_8_1x1_intrawave_v3,0,0,0
80,12288,7168,2048,0,0,1607.9242,a8w8_blockscale_1x128x128_256x128x128x128_16x16_32x32_8x32x1_8x32x1_1x32x1x8_8_1x1_intrawave_v3,0,0,0
80,14336,7168,2048,0,0,1856.2897,a8w8_blockscale_1x128x128_256x128x128x128_16x16_32x32_8x32x1_8x32x1_1x32x1x8_8_1x1_intrawave_v3,0,0,0
80,32768,7168,2048,0,0,4614.1608,a8w8_blockscale_1x128x128_256x128x128x128_16x16_32x32_8x32x1_8x32x1_1x32x1x8_8_1x1_intrawave_v3,0,0,0
80,65536,7168,2048,0,0,8385.3458,a8w8_blockscale_1x128x128_256x128x128x128_16x16_32x32_8x32x1_8x32x1_1x32x1x8_8_1x1_intrawave_v3,0,0,0
80,98304,7168,2048,0,0,12615.4473,a8w8_blockscale_1x128x128_256x128x128x128_16x16_32x32_8x32x1_8x32x1_1x32x1x8_8_1x1_intrawave_v3,0,0,0
80,131072,7168,2048,0,0,17225.8363,a8w8_blockscale_1x128x128_256x128x128x128_16x16_32x32_8x32x1_8x32x1_1x32x1x8_8_1x1_intrawave_v3,0,0,0
80,1,7168,2304,8,0,13.4935,a8w8_blockscale_1x128x128_256x16x64x256_16x16_16x16_16x16x1_16x16x1_1x16x1x16_4_1x1_intrawave_v1,0,0,0
80,2,7168,2304,8,0,13.5891,a8w8_blockscale_1x128x128_256x16x64x256_16x16_16x16_16x16x1_16x16x1_1x16x1x16_4_1x1_intrawave_v1,0,0,0
80,4,7168,2304,7,0,12.4283,a8w8_blockscale_1x128x128_256x16x128x256_16x16_16x16_16x16x1_16x16x1_1x16x1x16_8_1x2_intrawave_v1,0,0,0
80,8,7168,2304,7,0,12.4415,a8w8_blockscale_1x128x128_256x16x128x256_16x16_16x16_16x16x1_16x16x1_1x16x1x16_8_1x2_intrawave_v1,0,0,0
80,16,7168,2304,7,0,12.2382,a8w8_blockscale_1x128x128_256x16x128x256_16x16_16x16_16x16x1_16x16x1_1x16x1x16_8_1x2_intrawave_v1,0,0,0
80,32,7168,2304,12,0,14.9967,a8w8_blockscale_1x128x128_256x32x128x256_16x16_32x32_16x16x1_16x16x1_1x32x1x8_8_1x1_intrawave_v1,0,0,0
80,64,7168,2304,18,0,20.1871,a8w8_blockscale_1x128x128_256x64x64x256_16x16_32x32_16x16x1_16x16x1_1x32x1x8_8_1x1_intrawave_v1,0,0,0
80,96,7168,2304,3,0,31.2932,a8w8_blockscale_1x128x128_256x64x64x128_16x16_32x32_8x32x1_8x32x1_1x32x1x8_8_1x1_intrawave_v3,0,0,0
80,128,7168,2304,18,0,30.3515,a8w8_blockscale_1x128x128_256x64x64x256_16x16_32x32_16x16x1_16x16x1_1x32x1x8_8_1x1_intrawave_v1,0,0,0
80,160,7168,2304,10,0,45.9093,a8w8_blockscale_1x128x128_256x32x128x128_16x16_32x32_8x32x1_8x32x1_1x32x1x8_8_1x1_intrawave_v1,0,0,0
80,192,7168,2304,3,0,42.1737,a8w8_blockscale_1x128x128_256x64x64x128_16x16_32x32_8x32x1_8x32x1_1x32x1x8_8_1x1_intrawave_v3,0,0,0
80,224,7168,2304,3,0,53.5745,a8w8_blockscale_1x128x128_256x64x64x128_16x16_32x32_8x32x1_8x32x1_1x32x1x8_8_1x1_intrawave_v3,0,0,0
80,256,7168,2304,18,0,55.3696,a8w8_blockscale_1x128x128_256x64x64x256_16x16_32x32_16x16x1_16x16x1_1x32x1x8_8_1x1_intrawave_v1,0,0,0
80,288,7168,2304,3,0,63.8426,a8w8_blockscale_1x128x128_256x64x64x128_16x16_32x32_8x32x1_8x32x1_1x32x1x8_8_1x1_intrawave_v3,0,0,0
80,320,7168,2304,18,0,63.521,a8w8_blockscale_1x128x128_256x64x64x256_16x16_32x32_16x16x1_16x16x1_1x32x1x8_8_1x1_intrawave_v1,0,0,0
80,352,7168,2304,3,0,77.3487,a8w8_blockscale_1x128x128_256x64x64x128_16x16_32x32_8x32x1_8x32x1_1x32x1x8_8_1x1_intrawave_v3,0,0,0
80,384,7168,2304,3,0,79.7931,a8w8_blockscale_1x128x128_256x64x64x128_16x16_32x32_8x32x1_8x32x1_1x32x1x8_8_1x1_intrawave_v3,0,0,0
80,416,7168,2304,3,0,86.4847,a8w8_blockscale_1x128x128_256x64x64x128_16x16_32x32_8x32x1_8x32x1_1x32x1x8_8_1x1_intrawave_v3,0,0,0
80,448,7168,2304,2,0,79.8603,a8w8_blockscale_1x128x128_256x64x128x128_16x16_32x32_8x32x1_8x32x1_1x32x1x8_8_1x1_intrawave_v3,0,0,0
80,480,7168,2304,3,0,98.382,a8w8_blockscale_1x128x128_256x64x64x128_16x16_32x32_8x32x1_8x32x1_1x32x1x8_8_1x1_intrawave_v3,0,0,0
80,512,7168,2304,3,0,101.0378,a8w8_blockscale_1x128x128_256x64x64x128_16x16_32x32_8x32x1_8x32x1_1x32x1x8_8_1x1_intrawave_v3,0,0,0
80,1024,7168,2304,3,0,183.7845,a8w8_blockscale_1x128x128_256x64x64x128_16x16_32x32_8x32x1_8x32x1_1x32x1x8_8_1x1_intrawave_v3,0,0,0
80,1536,7168,2304,3,0,265.1321,a8w8_blockscale_1x128x128_256x64x64x128_16x16_32x32_8x32x1_8x32x1_1x32x1x8_8_1x1_intrawave_v3,0,0,0
80,2048,7168,2304,3,0,347.5556,a8w8_blockscale_1x128x128_256x64x64x128_16x16_32x32_8x32x1_8x32x1_1x32x1x8_8_1x1_intrawave_v3,0,0,0
80,4096,7168,2304,3,0,680.0186,a8w8_blockscale_1x128x128_256x64x64x128_16x16_32x32_8x32x1_8x32x1_1x32x1x8_8_1x1_intrawave_v3,0,0,0
80,6144,7168,2304,0,0,851.0657,a8w8_blockscale_1x128x128_256x128x128x128_16x16_32x32_8x32x1_8x32x1_1x32x1x8_8_1x1_intrawave_v3,0,0,0
80,8192,7168,2304,3,0,1342.3805,a8w8_blockscale_1x128x128_256x64x64x128_16x16_32x32_8x32x1_8x32x1_1x32x1x8_8_1x1_intrawave_v3,0,0,0
80,10240,7168,2304,0,0,1388.6326,a8w8_blockscale_1x128x128_256x128x128x128_16x16_32x32_8x32x1_8x32x1_1x32x1x8_8_1x1_intrawave_v3,0,0,0
80,12288,7168,2304,0,0,1685.1739,a8w8_blockscale_1x128x128_256x128x128x128_16x16_32x32_8x32x1_8x32x1_1x32x1x8_8_1x1_intrawave_v3,0,0,0
80,14336,7168,2304,0,0,1951.3416,a8w8_blockscale_1x128x128_256x128x128x128_16x16_32x32_8x32x1_8x32x1_1x32x1x8_8_1x1_intrawave_v3,0,0,0
80,16384,7168,2304,3,0,2670.4624,a8w8_blockscale_1x128x128_256x64x64x128_16x16_32x32_8x32x1_8x32x1_1x32x1x8_8_1x1_intrawave_v3,0,0,0
80,20480,7168,2304,3,0,3334.2791,a8w8_blockscale_1x128x128_256x64x64x128_16x16_32x32_8x32x1_8x32x1_1x32x1x8_8_1x1_intrawave_v3,0,0,0
80,32768,7168,2304,0,0,4884.5134,a8w8_blockscale_1x128x128_256x128x128x128_16x16_32x32_8x32x1_8x32x1_1x32x1x8_8_1x1_intrawave_v3,0,0,0
80,65536,7168,2304,3,0,10515.839,a8w8_blockscale_1x128x128_256x64x64x128_16x16_32x32_8x32x1_8x32x1_1x32x1x8_8_1x1_intrawave_v3,0,0,0
80,98304,7168,2304,3,0,15786.6506,a8w8_blockscale_1x128x128_256x64x64x128_16x16_32x32_8x32x1_8x32x1_1x32x1x8_8_1x1_intrawave_v3,0,0,0
80,1,7168,16384,8,0,80.4411,a8w8_blockscale_1x128x128_256x16x64x256_16x16_16x16_16x16x1_16x16x1_1x16x1x16_4_1x1_intrawave_v1,0,0,0
80,2,7168,16384,8,0,81.0783,a8w8_blockscale_1x128x128_256x16x64x256_16x16_16x16_16x16x1_16x16x1_1x16x1x16_4_1x1_intrawave_v1,0,0,0
80,4,7168,16384,8,0,81.1975,a8w8_blockscale_1x128x128_256x16x64x256_16x16_16x16_16x16x1_16x16x1_1x16x1x16_4_1x1_intrawave_v1,0,0,0
80,8,7168,16384,8,0,84.4723,a8w8_blockscale_1x128x128_256x16x64x256_16x16_16x16_16x16x1_16x16x1_1x16x1x16_4_1x1_intrawave_v1,0,0,0
80,16,7168,16384,7,0,81.0135,a8w8_blockscale_1x128x128_256x16x128x256_16x16_16x16_16x16x1_16x16x1_1x16x1x16_8_1x2_intrawave_v1,0,0,0
80,32,7168,16384,12,0,90.6679,a8w8_blockscale_1x128x128_256x32x128x256_16x16_32x32_16x16x1_16x16x1_1x32x1x8_8_1x1_intrawave_v1,0,0,0
80,64,7168,16384,18,0,142.6302,a8w8_blockscale_1x128x128_256x64x64x256_16x16_32x32_16x16x1_16x16x1_1x32x1x8_8_1x1_intrawave_v1,0,0,0
80,96,7168,16384,12,0,226.0095,a8w8_blockscale_1x128x128_256x32x128x256_16x16_32x32_16x16x1_16x16x1_1x32x1x8_8_1x1_intrawave_v1,0,0,0
80,128,7168,16384,18,0,187.9301,a8w8_blockscale_1x128x128_256x64x64x256_16x16_32x32_16x16x1_16x16x1_1x32x1x8_8_1x1_intrawave_v1,0,0,0
80,160,7168,16384,18,0,293.8983,a8w8_blockscale_1x128x128_256x64x64x256_16x16_32x32_16x16x1_16x16x1_1x32x1x8_8_1x1_intrawave_v1,0,0,0
80,192,7168,16384,12,0,381.2924,a8w8_blockscale_1x128x128_256x32x128x256_16x16_32x32_16x16x1_16x16x1_1x32x1x8_8_1x1_intrawave_v1,0,0,0
80,224,7168,16384,18,0,349.3654,a8w8_blockscale_1x128x128_256x64x64x256_16x16_32x32_16x16x1_16x16x1_1x32x1x8_8_1x1_intrawave_v1,0,0,0
80,256,7168,16384,18,0,343.3197,a8w8_blockscale_1x128x128_256x64x64x256_16x16_32x32_16x16x1_16x16x1_1x32x1x8_8_1x1_intrawave_v1,0,0,0
80,288,7168,16384,2,0,521.2036,a8w8_blockscale_1x128x128_256x64x128x128_16x16_32x32_8x32x1_8x32x1_1x32x1x8_8_1x1_intrawave_v3,0,0,0
80,320,7168,16384,18,0,440.8611,a8w8_blockscale_1x128x128_256x64x64x256_16x16_32x32_16x16x1_16x16x1_1x32x1x8_8_1x1_intrawave_v1,0,0,0
80,352,7168,16384,18,0,528.4344,a8w8_blockscale_1x128x128_256x64x64x256_16x16_32x32_16x16x1_16x16x1_1x32x1x8_8_1x1_intrawave_v1,0,0,0
80,384,7168,16384,18,0,510.7671,a8w8_blockscale_1x128x128_256x64x64x256_16x16_32x32_16x16x1_16x16x1_1x32x1x8_8_1x1_intrawave_v1,0,0,0
80,416,7168,16384,2,0,638.6827,a8w8_blockscale_1x128x128_256x64x128x128_16x16_32x32_8x32x1_8x32x1_1x32x1x8_8_1x1_intrawave_v3,0,0,0
80,448,7168,16384,18,0,568.7454,a8w8_blockscale_1x128x128_256x64x64x256_16x16_32x32_16x16x1_16x16x1_1x32x1x8_8_1x1_intrawave_v1,0,0,0
80,480,7168,16384,2,0,685.2973,a8w8_blockscale_1x128x128_256x64x128x128_16x16_32x32_8x32x1_8x32x1_1x32x1x8_8_1x1_intrawave_v3,0,0,0
80,512,7168,16384,0,0,616.2237,a8w8_blockscale_1x128x128_256x128x128x128_16x16_32x32_8x32x1_8x32x1_1x32x1x8_8_1x1_intrawave_v3,0,0,0
80,1024,7168,16384,0,0,1140.981,a8w8_blockscale_1x128x128_256x128x128x128_16x16_32x32_8x32x1_8x32x1_1x32x1x8_8_1x1_intrawave_v3,0,0,0
80,2048,7168,16384,0,0,2211.9911,a8w8_blockscale_1x128x128_256x128x128x128_16x16_32x32_8x32x1_8x32x1_1x32x1x8_8_1x1_intrawave_v3,0,0,0
80,4096,7168,16384,0,0,4302.3785,a8w8_blockscale_1x128x128_256x128x128x128_16x16_32x32_8x32x1_8x32x1_1x32x1x8_8_1x1_intrawave_v3,0,0,0
80,6144,7168,16384,0,0,6608.4842,a8w8_blockscale_1x128x128_256x128x128x128_16x16_32x32_8x32x1_8x32x1_1x32x1x8_8_1x1_intrawave_v3,0,0,0
80,8192,7168,16384,0,0,8622.1052,a8w8_blockscale_1x128x128_256x128x128x128_16x16_32x32_8x32x1_8x32x1_1x32x1x8_8_1x1_intrawave_v3,0,0,0
80,10240,7168,16384,0,0,11023.5824,a8w8_blockscale_1x128x128_256x128x128x128_16x16_32x32_8x32x1_8x32x1_1x32x1x8_8_1x1_intrawave_v3,0,0,0
80,12288,7168,16384,0,0,12947.739,a8w8_blockscale_1x128x128_256x128x128x128_16x16_32x32_8x32x1_8x32x1_1x32x1x8_8_1x1_intrawave_v3,0,0,0
80,14336,7168,16384,0,0,15187.1505,a8w8_blockscale_1x128x128_256x128x128x128_16x16_32x32_8x32x1_8x32x1_1x32x1x8_8_1x1_intrawave_v3,0,0,0
80,16384,7168,16384,0,0,17329.3114,a8w8_blockscale_1x128x128_256x128x128x128_16x16_32x32_8x32x1_8x32x1_1x32x1x8_8_1x1_intrawave_v3,0,0,0
80,32768,7168,16384,0,0,34852.366,a8w8_blockscale_1x128x128_256x128x128x128_16x16_32x32_8x32x1_8x32x1_1x32x1x8_8_1x1_intrawave_v3,0,0,0
80,65536,7168,16384,0,0,70478.0846,a8w8_blockscale_1x128x128_256x128x128x128_16x16_32x32_8x32x1_8x32x1_1x32x1x8_8_1x1_intrawave_v3,0,0,0
80,98304,7168,16384,0,0,105519.4606,a8w8_blockscale_1x128x128_256x128x128x128_16x16_32x32_8x32x1_8x32x1_1x32x1x8_8_1x1_intrawave_v3,0,0,0
80,131072,7168,16384,18,0,154106.4002,a8w8_blockscale_1x128x128_256x64x64x256_16x16_32x32_16x16x1_16x16x1_1x32x1x8_8_1x1_intrawave_v1,0,0,0
80,1,7168,18432,8,0,90.1639,a8w8_blockscale_1x128x128_256x16x64x256_16x16_16x16_16x16x1_16x16x1_1x16x1x16_4_1x1_intrawave_v1,0,0,0
80,2,7168,18432,8,0,87.2351,a8w8_blockscale_1x128x128_256x16x64x256_16x16_16x16_16x16x1_16x16x1_1x16x1x16_4_1x1_intrawave_v1,0,0,0
80,4,7168,18432,8,0,93.2707,a8w8_blockscale_1x128x128_256x16x64x256_16x16_16x16_16x16x1_16x16x1_1x16x1x16_4_1x1_intrawave_v1,0,0,0
80,8,7168,18432,8,0,93.7435,a8w8_blockscale_1x128x128_256x16x64x256_16x16_16x16_16x16x1_16x16x1_1x16x1x16_4_1x1_intrawave_v1,0,0,0
80,16,7168,18432,7,0,83.8083,a8w8_blockscale_1x128x128_256x16x128x256_16x16_16x16_16x16x1_16x16x1_1x16x1x16_8_1x2_intrawave_v1,0,0,0
80,32,7168,18432,12,0,91.0487,a8w8_blockscale_1x128x128_256x32x128x256_16x16_32x32_16x16x1_16x16x1_1x32x1x8_8_1x1_intrawave_v1,0,0,0
80,64,7168,18432,18,0,130.9413,a8w8_blockscale_1x128x128_256x64x64x256_16x16_32x32_16x16x1_16x16x1_1x32x1x8_8_1x1_intrawave_v1,0,0,0
80,96,7168,18432,18,0,211.557,a8w8_blockscale_1x128x128_256x64x64x256_16x16_32x32_16x16x1_16x16x1_1x32x1x8_8_1x1_intrawave_v1,0,0,0
80,128,7168,18432,18,0,189.0192,a8w8_blockscale_1x128x128_256x64x64x256_16x16_32x32_16x16x1_16x16x1_1x32x1x8_8_1x1_intrawave_v1,0,0,0
80,160,7168,18432,2,0,379.9103,a8w8_blockscale_1x128x128_256x64x128x128_16x16_32x32_8x32x1_8x32x1_1x32x1x8_8_1x1_intrawave_v3,0,0,0
80,192,7168,18432,18,0,293.6094,a8w8_blockscale_1x128x128_256x64x64x256_16x16_32x32_16x16x1_16x16x1_1x32x1x8_8_1x1_intrawave_v1,0,0,0
80,224,7168,18432,18,0,381.1539,a8w8_blockscale_1x128x128_256x64x64x256_16x16_32x32_16x16x1_16x16x1_1x32x1x8_8_1x1_intrawave_v1,0,0,0
80,256,7168,18432,18,0,342.1461,a8w8_blockscale_1x128x128_256x64x64x256_16x16_32x32_16x16x1_16x16x1_1x32x1x8_8_1x1_intrawave_v1,0,0,0
80,288,7168,18432,18,0,450.2698,a8w8_blockscale_1x128x128_256x64x64x256_16x16_32x32_16x16x1_16x16x1_1x32x1x8_8_1x1_intrawave_v1,0,0,0
80,320,7168,18432,2,0,552.8448,a8w8_blockscale_1x128x128_256x64x128x128_16x16_32x32_8x32x1_8x32x1_1x32x1x8_8_1x1_intrawave_v3,0,0,0
80,352,7168,18432,18,0,564.1177,a8w8_blockscale_1x128x128_256x64x64x256_16x16_32x32_16x16x1_16x16x1_1x32x1x8_8_1x1_intrawave_v1,0,0,0
80,384,7168,18432,18,0,520.9614,a8w8_blockscale_1x128x128_256x64x64x256_16x16_32x32_16x16x1_16x16x1_1x32x1x8_8_1x1_intrawave_v1,0,0,0
80,416,7168,18432,18,0,625.0472,a8w8_blockscale_1x128x128_256x64x64x256_16x16_32x32_16x16x1_16x16x1_1x32x1x8_8_1x1_intrawave_v1,0,0,0
80,448,7168,18432,18,0,571.0165,a8w8_blockscale_1x128x128_256x64x64x256_16x16_32x32_16x16x1_16x16x1_1x32x1x8_8_1x1_intrawave_v1,0,0,0
80,480,7168,18432,2,0,722.8485,a8w8_blockscale_1x128x128_256x64x128x128_16x16_32x32_8x32x1_8x32x1_1x32x1x8_8_1x1_intrawave_v3,0,0,0
80,512,7168,18432,0,0,587.1778,a8w8_blockscale_1x128x128_256x128x128x128_16x16_32x32_8x32x1_8x32x1_1x32x1x8_8_1x1_intrawave_v3,0,0,0
80,1024,7168,18432,0,0,1164.9336,a8w8_blockscale_1x128x128_256x128x128x128_16x16_32x32_8x32x1_8x32x1_1x32x1x8_8_1x1_intrawave_v3,0,0,0
80,2048,7168,18432,0,0,2123.1521,a8w8_blockscale_1x128x128_256x128x128x128_16x16_32x32_8x32x1_8x32x1_1x32x1x8_8_1x1_intrawave_v3,0,0,0
80,4096,7168,18432,0,0,4033.3849,a8w8_blockscale_1x128x128_256x128x128x128_16x16_32x32_8x32x1_8x32x1_1x32x1x8_8_1x1_intrawave_v3,0,0,0
80,6144,7168,18432,0,0,6181.2122,a8w8_blockscale_1x128x128_256x128x128x128_16x16_32x32_8x32x1_8x32x1_1x32x1x8_8_1x1_intrawave_v3,0,0,0
80,8192,7168,18432,0,0,8118.7627,a8w8_blockscale_1x128x128_256x128x128x128_16x16_32x32_8x32x1_8x32x1_1x32x1x8_8_1x1_intrawave_v3,0,0,0
80,10240,7168,18432,0,0,10175.6663,a8w8_blockscale_1x128x128_256x128x128x128_16x16_32x32_8x32x1_8x32x1_1x32x1x8_8_1x1_intrawave_v3,0,0,0
80,12288,7168,18432,0,0,12232.127,a8w8_blockscale_1x128x128_256x128x128x128_16x16_32x32_8x32x1_8x32x1_1x32x1x8_8_1x1_intrawave_v3,0,0,0
80,14336,7168,18432,0,0,14287.2359,a8w8_blockscale_1x128x128_256x128x128x128_16x16_32x32_8x32x1_8x32x1_1x32x1x8_8_1x1_intrawave_v3,0,0,0
80,16384,7168,18432,0,0,16294.5139,a8w8_blockscale_1x128x128_256x128x128x128_16x16_32x32_8x32x1_8x32x1_1x32x1x8_8_1x1_intrawave_v3,0,0,0
80,32768,7168,18432,0,0,32659.3895,a8w8_blockscale_1x128x128_256x128x128x128_16x16_32x32_8x32x1_8x32x1_1x32x1x8_8_1x1_intrawave_v3,0,0,0
80,65536,7168,18432,0,0,65026.138,a8w8_blockscale_1x128x128_256x128x128x128_16x16_32x32_8x32x1_8x32x1_1x32x1x8_8_1x1_intrawave_v3,0,0,0
80,98304,7168,18432,0,0,99003.4516,a8w8_blockscale_1x128x128_256x128x128x128_16x16_32x32_8x32x1_8x32x1_1x32x1x8_8_1x1_intrawave_v3,0,0,0
80,131072,7168,18432,0,0,131465.7679,a8w8_blockscale_1x128x128_256x128x128x128_16x16_32x32_8x32x1_8x32x1_1x32x1x8_8_1x1_intrawave_v3,0,0,0
80,1,8192,1536,8,0,10.8235,a8w8_blockscale_1x128x128_256x16x64x256_16x16_16x16_16x16x1_16x16x1_1x16x1x16_4_1x1_intrawave_v1,0,0,0
80,2,8192,1536,8,0,11.0715,a8w8_blockscale_1x128x128_256x16x64x256_16x16_16x16_16x16x1_16x16x1_1x16x1x16_4_1x1_intrawave_v1,0,0,0
80,4,8192,1536,8,0,11.1999,a8w8_blockscale_1x128x128_256x16x64x256_16x16_16x16_16x16x1_16x16x1_1x16x1x16_4_1x1_intrawave_v1,0,0,0
80,8,8192,1536,8,0,11.3803,a8w8_blockscale_1x128x128_256x16x64x256_16x16_16x16_16x16x1_16x16x1_1x16x1x16_4_1x1_intrawave_v1,0,0,0
80,16,8192,1536,8,0,10.1315,a8w8_blockscale_1x128x128_256x16x64x256_16x16_16x16_16x16x1_16x16x1_1x16x1x16_4_1x1_intrawave_v1,0,0,0
80,32,8192,1536,12,0,12.3951,a8w8_blockscale_1x128x128_256x32x128x256_16x16_32x32_16x16x1_16x16x1_1x32x1x8_8_1x1_intrawave_v1,0,0,0
80,64,8192,1536,18,0,16.5967,a8w8_blockscale_1x128x128_256x64x64x256_16x16_32x32_16x16x1_16x16x1_1x32x1x8_8_1x1_intrawave_v1,0,0,0
80,96,8192,1536,2,0,29.3651,a8w8_blockscale_1x128x128_256x64x128x128_16x16_32x32_8x32x1_8x32x1_1x32x1x8_8_1x1_intrawave_v3,0,0,0
80,128,8192,1536,18,0,29.2096,a8w8_blockscale_1x128x128_256x64x64x256_16x16_32x32_16x16x1_16x16x1_1x32x1x8_8_1x1_intrawave_v1,0,0,0
80,160,8192,1536,3,0,38.2228,a8w8_blockscale_1x128x128_256x64x64x128_16x16_32x32_8x32x1_8x32x1_1x32x1x8_8_1x1_intrawave_v3,0,0,0
80,192,8192,1536,16,0,38.6744,a8w8_blockscale_1x128x128_256x64x64x128_16x16_32x32_8x32x1_8x32x1_1x32x1x8_8_1x1_intrawave_v1,0,0,0
80,224,8192,1536,3,0,48.1293,a8w8_blockscale_1x128x128_256x64x64x128_16x16_32x32_8x32x1_8x32x1_1x32x1x8_8_1x1_intrawave_v3,0,0,0
80,256,8192,1536,0,0,45.4237,a8w8_blockscale_1x128x128_256x128x128x128_16x16_32x32_8x32x1_8x32x1_1x32x1x8_8_1x1_intrawave_v3,0,0,0
80,288,8192,1536,2,0,56.7309,a8w8_blockscale_1x128x128_256x64x128x128_16x16_32x32_8x32x1_8x32x1_1x32x1x8_8_1x1_intrawave_v3,0,0,0
80,320,8192,1536,18,0,55.9177,a8w8_blockscale_1x128x128_256x64x64x256_16x16_32x32_16x16x1_16x16x1_1x32x1x8_8_1x1_intrawave_v1,0,0,0
80,352,8192,1536,3,0,66.795,a8w8_blockscale_1x128x128_256x64x64x128_16x16_32x32_8x32x1_8x32x1_1x32x1x8_8_1x1_intrawave_v3,0,0,0
80,384,8192,1536,0,0,66.5862,a8w8_blockscale_1x128x128_256x128x128x128_16x16_32x32_8x32x1_8x32x1_1x32x1x8_8_1x1_intrawave_v3,0,0,0
80,416,8192,1536,3,0,79.0346,a8w8_blockscale_1x128x128_256x64x64x128_16x16_32x32_8x32x1_8x32x1_1x32x1x8_8_1x1_intrawave_v3,0,0,0
80,448,8192,1536,2,0,77.745,a8w8_blockscale_1x128x128_256x64x128x128_16x16_32x32_8x32x1_8x32x1_1x32x1x8_8_1x1_intrawave_v3,0,0,0
80,480,8192,1536,3,0,83.5863,a8w8_blockscale_1x128x128_256x64x64x128_16x16_32x32_8x32x1_8x32x1_1x32x1x8_8_1x1_intrawave_v3,0,0,0
80,512,8192,1536,0,0,82.2627,a8w8_blockscale_1x128x128_256x128x128x128_16x16_32x32_8x32x1_8x32x1_1x32x1x8_8_1x1_intrawave_v3,0,0,0
80,1024,8192,1536,0,0,141.623,a8w8_blockscale_1x128x128_256x128x128x128_16x16_32x32_8x32x1_8x32x1_1x32x1x8_8_1x1_intrawave_v3,0,0,0
80,2048,8192,1536,0,0,252.5388,a8w8_blockscale_1x128x128_256x128x128x128_16x16_32x32_8x32x1_8x32x1_1x32x1x8_8_1x1_intrawave_v3,0,0,0
80,4096,8192,1536,0,0,492.553,a8w8_blockscale_1x128x128_256x128x128x128_16x16_32x32_8x32x1_8x32x1_1x32x1x8_8_1x1_intrawave_v3,0,0,0
80,6144,8192,1536,0,0,819.0652,a8w8_blockscale_1x128x128_256x128x128x128_16x16_32x32_8x32x1_8x32x1_1x32x1x8_8_1x1_intrawave_v3,0,0,0
80,8192,8192,1536,0,0,974.0173,a8w8_blockscale_1x128x128_256x128x128x128_16x16_32x32_8x32x1_8x32x1_1x32x1x8_8_1x1_intrawave_v3,0,0,0
80,10240,8192,1536,3,0,1430.6685,a8w8_blockscale_1x128x128_256x64x64x128_16x16_32x32_8x32x1_8x32x1_1x32x1x8_8_1x1_intrawave_v3,0,0,0
80,12288,8192,1536,0,0,1449.011,a8w8_blockscale_1x128x128_256x128x128x128_16x16_32x32_8x32x1_8x32x1_1x32x1x8_8_1x1_intrawave_v3,0,0,0
80,14336,8192,1536,3,0,1969.4415,a8w8_blockscale_1x128x128_256x64x64x128_16x16_32x32_8x32x1_8x32x1_1x32x1x8_8_1x1_intrawave_v3,0,0,0
80,16384,8192,1536,0,0,1921.1494,a8w8_blockscale_1x128x128_256x128x128x128_16x16_32x32_8x32x1_8x32x1_1x32x1x8_8_1x1_intrawave_v3,0,0,0
80,32768,8192,1536,0,0,3815.3061,a8w8_blockscale_1x128x128_256x128x128x128_16x16_32x32_8x32x1_8x32x1_1x32x1x8_8_1x1_intrawave_v3,0,0,0
80,65536,8192,1536,0,0,7621.6687,a8w8_blockscale_1x128x128_256x128x128x128_16x16_32x32_8x32x1_8x32x1_1x32x1x8_8_1x1_intrawave_v3,0,0,0
80,98304,8192,1536,0,0,11517.8223,a8w8_blockscale_1x128x128_256x128x128x128_16x16_32x32_8x32x1_8x32x1_1x32x1x8_8_1x1_intrawave_v3,0,0,0
80,131072,8192,1536,0,0,15358.2359,a8w8_blockscale_1x128x128_256x128x128x128_16x16_32x32_8x32x1_8x32x1_1x32x1x8_8_1x1_intrawave_v3,0,0,0
80,1,11264,1536,8,0,14.1259,a8w8_blockscale_1x128x128_256x16x64x256_16x16_16x16_16x16x1_16x16x1_1x16x1x16_4_1x1_intrawave_v1,0,0,0
80,2,11264,1536,8,0,14.8831,a8w8_blockscale_1x128x128_256x16x64x256_16x16_16x16_16x16x1_16x16x1_1x16x1x16_4_1x1_intrawave_v1,0,0,0
80,4,11264,1536,8,0,13.9487,a8w8_blockscale_1x128x128_256x16x64x256_16x16_16x16_16x16x1_16x16x1_1x16x1x16_4_1x1_intrawave_v1,0,0,0
80,8,11264,1536,8,0,14.3103,a8w8_blockscale_1x128x128_256x16x64x256_16x16_16x16_16x16x1_16x16x1_1x16x1x16_4_1x1_intrawave_v1,0,0,0
80,16,11264,1536,8,0,13.7603,a8w8_blockscale_1x128x128_256x16x64x256_16x16_16x16_16x16x1_16x16x1_1x16x1x16_4_1x1_intrawave_v1,0,0,0
80,32,11264,1536,8,0,19.3971,a8w8_blockscale_1x128x128_256x16x64x256_16x16_16x16_16x16x1_16x16x1_1x16x1x16_4_1x1_intrawave_v1,0,0,0
80,64,11264,1536,18,0,23.2527,a8w8_blockscale_1x128x128_256x64x64x256_16x16_32x32_16x16x1_16x16x1_1x32x1x8_8_1x1_intrawave_v1,0,0,0
80,96,11264,1536,18,0,38.5268,a8w8_blockscale_1x128x128_256x64x64x256_16x16_32x32_16x16x1_16x16x1_1x32x1x8_8_1x1_intrawave_v1,0,0,0
80,128,11264,1536,18,0,36.5868,a8w8_blockscale_1x128x128_256x64x64x256_16x16_32x32_16x16x1_16x16x1_1x32x1x8_8_1x1_intrawave_v1,0,0,0
80,160,11264,1536,3,0,50.0469,a8w8_blockscale_1x128x128_256x64x64x128_16x16_32x32_8x32x1_8x32x1_1x32x1x8_8_1x1_intrawave_v3,0,0,0
80,192,11264,1536,18,0,49.4729,a8w8_blockscale_1x128x128_256x64x64x256_16x16_32x32_16x16x1_16x16x1_1x32x1x8_8_1x1_intrawave_v1,0,0,0
80,224,11264,1536,3,0,62.5822,a8w8_blockscale_1x128x128_256x64x64x128_16x16_32x32_8x32x1_8x32x1_1x32x1x8_8_1x1_intrawave_v3,0,0,0
80,256,11264,1536,18,0,62.9586,a8w8_blockscale_1x128x128_256x64x64x256_16x16_32x32_16x16x1_16x16x1_1x32x1x8_8_1x1_intrawave_v1,0,0,0
80,288,11264,1536,3,0,76.3027,a8w8_blockscale_1x128x128_256x64x64x128_16x16_32x32_8x32x1_8x32x1_1x32x1x8_8_1x1_intrawave_v3,0,0,0
80,320,11264,1536,2,0,81.5799,a8w8_blockscale_1x128x128_256x64x128x128_16x16_32x32_8x32x1_8x32x1_1x32x1x8_8_1x1_intrawave_v3,0,0,0
80,352,11264,1536,1,0,90.9328,a8w8_blockscale_1x128x128_256x128x64x128_16x16_32x32_8x32x1_8x32x1_1x32x1x8_8_1x1_intrawave_v3,0,0,0
80,384,11264,1536,0,0,86.1339,a8w8_blockscale_1x128x128_256x128x128x128_16x16_32x32_8x32x1_8x32x1_1x32x1x8_8_1x1_intrawave_v3,0,0,0
80,416,11264,1536,16,0,110.7437,a8w8_blockscale_1x128x128_256x64x64x128_16x16_32x32_8x32x1_8x32x1_1x32x1x8_8_1x1_intrawave_v1,0,0,0
80,448,11264,1536,2,0,103.8016,a8w8_blockscale_1x128x128_256x64x128x128_16x16_32x32_8x32x1_8x32x1_1x32x1x8_8_1x1_intrawave_v3,0,0,0
80,480,11264,1536,3,0,112.3881,a8w8_blockscale_1x128x128_256x64x64x128_16x16_32x32_8x32x1_8x32x1_1x32x1x8_8_1x1_intrawave_v3,0,0,0
80,512,11264,1536,0,0,99.7424,a8w8_blockscale_1x128x128_256x128x128x128_16x16_32x32_8x32x1_8x32x1_1x32x1x8_8_1x1_intrawave_v3,0,0,0
80,1024,11264,1536,3,0,212.6951,a8w8_blockscale_1x128x128_256x64x64x128_16x16_32x32_8x32x1_8x32x1_1x32x1x8_8_1x1_intrawave_v3,0,0,0
80,2048,11264,1536,0,0,347.4495,a8w8_blockscale_1x128x128_256x128x128x128_16x16_32x32_8x32x1_8x32x1_1x32x1x8_8_1x1_intrawave_v3,0,0,0
80,4096,11264,1536,0,0,729.0026,a8w8_blockscale_1x128x128_256x128x128x128_16x16_32x32_8x32x1_8x32x1_1x32x1x8_8_1x1_intrawave_v3,0,0,0
80,6144,11264,1536,0,0,996.9846,a8w8_blockscale_1x128x128_256x128x128x128_16x16_32x32_8x32x1_8x32x1_1x32x1x8_8_1x1_intrawave_v3,0,0,0
80,8192,11264,1536,0,0,1327.773,a8w8_blockscale_1x128x128_256x128x128x128_16x16_32x32_8x32x1_8x32x1_1x32x1x8_8_1x1_intrawave_v3,0,0,0
80,10240,11264,1536,0,0,1650.8577,a8w8_blockscale_1x128x128_256x128x128x128_16x16_32x32_8x32x1_8x32x1_1x32x1x8_8_1x1_intrawave_v3,0,0,0
80,12288,11264,1536,3,0,2345.0071,a8w8_blockscale_1x128x128_256x64x64x128_16x16_32x32_8x32x1_8x32x1_1x32x1x8_8_1x1_intrawave_v3,0,0,0
80,14336,11264,1536,0,0,2380.0822,a8w8_blockscale_1x128x128_256x128x128x128_16x16_32x32_8x32x1_8x32x1_1x32x1x8_8_1x1_intrawave_v3,0,0,0
80,16384,11264,1536,3,0,3104.6685,a8w8_blockscale_1x128x128_256x64x64x128_16x16_32x32_8x32x1_8x32x1_1x32x1x8_8_1x1_intrawave_v3,0,0,0
80,32768,11264,1536,0,0,5271.9454,a8w8_blockscale_1x128x128_256x128x128x128_16x16_32x32_8x32x1_8x32x1_1x32x1x8_8_1x1_intrawave_v3,0,0,0
80,65536,11264,1536,3,0,12267.214,a8w8_blockscale_1x128x128_256x64x64x128_16x16_32x32_8x32x1_8x32x1_1x32x1x8_8_1x1_intrawave_v3,0,0,0
80,98304,11264,1536,0,0,15928.1433,a8w8_blockscale_1x128x128_256x128x128x128_16x16_32x32_8x32x1_8x32x1_1x32x1x8_8_1x1_intrawave_v3,0,0,0
80,1,24576,1536,8,0,21.7723,a8w8_blockscale_1x128x128_256x16x64x256_16x16_16x16_16x16x1_16x16x1_1x16x1x16_4_1x1_intrawave_v1,0,0,0
80,2,24576,1536,8,0,22.0947,a8w8_blockscale_1x128x128_256x16x64x256_16x16_16x16_16x16x1_16x16x1_1x16x1x16_4_1x1_intrawave_v1,0,0,0
80,4,24576,1536,8,0,22.3543,a8w8_blockscale_1x128x128_256x16x64x256_16x16_16x16_16x16x1_16x16x1_1x16x1x16_4_1x1_intrawave_v1,0,0,0
80,8,24576,1536,8,0,22.9327,a8w8_blockscale_1x128x128_256x16x64x256_16x16_16x16_16x16x1_16x16x1_1x16x1x16_4_1x1_intrawave_v1,0,0,0
80,16,24576,1536,8,0,20.9171,a8w8_blockscale_1x128x128_256x16x64x256_16x16_16x16_16x16x1_16x16x1_1x16x1x16_4_1x1_intrawave_v1,0,0,0
80,32,24576,1536,13,0,32.0868,a8w8_blockscale_1x128x128_256x32x64x256_16x16_16x16_16x16x1_16x16x1_1x32x1x8_8_2x1_intrawave_v1,0,0,0
80,64,24576,1536,18,0,37.2172,a8w8_blockscale_1x128x128_256x64x64x256_16x16_32x32_16x16x1_16x16x1_1x32x1x8_8_1x1_intrawave_v1,0,0,0
80,96,24576,1536,2,0,71.0526,a8w8_blockscale_1x128x128_256x64x128x128_16x16_32x32_8x32x1_8x32x1_1x32x1x8_8_1x1_intrawave_v3,0,0,0
80,128,24576,1536,0,0,71.0226,a8w8_blockscale_1x128x128_256x128x128x128_16x16_32x32_8x32x1_8x32x1_1x32x1x8_8_1x1_intrawave_v3,0,0,0
80,160,24576,1536,3,0,100.982,a8w8_blockscale_1x128x128_256x64x64x128_16x16_32x32_8x32x1_8x32x1_1x32x1x8_8_1x1_intrawave_v3,0,0,0
80,192,24576,1536,18,0,102.1488,a8w8_blockscale_1x128x128_256x64x64x256_16x16_32x32_16x16x1_16x16x1_1x32x1x8_8_1x1_intrawave_v1,0,0,0
80,224,24576,1536,0,0,128.7353,a8w8_blockscale_1x128x128_256x128x128x128_16x16_32x32_8x32x1_8x32x1_1x32x1x8_8_1x1_intrawave_v3,0,0,0
80,256,24576,1536,0,0,108.7836,a8w8_blockscale_1x128x128_256x128x128x128_16x16_32x32_8x32x1_8x32x1_1x32x1x8_8_1x1_intrawave_v3,0,0,0
80,288,24576,1536,3,0,158.2255,a8w8_blockscale_1x128x128_256x64x64x128_16x16_32x32_8x32x1_8x32x1_1x32x1x8_8_1x1_intrawave_v3,0,0,0
80,320,24576,1536,18,0,163.7415,a8w8_blockscale_1x128x128_256x64x64x256_16x16_32x32_16x16x1_16x16x1_1x32x1x8_8_1x1_intrawave_v1,0,0,0
80,352,24576,1536,3,0,185.6181,a8w8_blockscale_1x128x128_256x64x64x128_16x16_32x32_8x32x1_8x32x1_1x32x1x8_8_1x1_intrawave_v3,0,0,0
80,384,24576,1536,0,0,160.4975,a8w8_blockscale_1x128x128_256x128x128x128_16x16_32x32_8x32x1_8x32x1_1x32x1x8_8_1x1_intrawave_v3,0,0,0
80,416,24576,1536,2,0,214.7142,a8w8_blockscale_1x128x128_256x64x128x128_16x16_32x32_8x32x1_8x32x1_1x32x1x8_8_1x1_intrawave_v3,0,0,0
80,448,24576,1536,2,0,215.2938,a8w8_blockscale_1x128x128_256x64x128x128_16x16_32x32_8x32x1_8x32x1_1x32x1x8_8_1x1_intrawave_v3,0,0,0
80,480,24576,1536,3,0,236.2091,a8w8_blockscale_1x128x128_256x64x64x128_16x16_32x32_8x32x1_8x32x1_1x32x1x8_8_1x1_intrawave_v3,0,0,0
80,512,24576,1536,0,0,199.0229,a8w8_blockscale_1x128x128_256x128x128x128_16x16_32x32_8x32x1_8x32x1_1x32x1x8_8_1x1_intrawave_v3,0,0,0
80,1024,24576,1536,0,0,390.4668,a8w8_blockscale_1x128x128_256x128x128x128_16x16_32x32_8x32x1_8x32x1_1x32x1x8_8_1x1_intrawave_v3,0,0,0
80,2048,24576,1536,0,0,740.166,a8w8_blockscale_1x128x128_256x128x128x128_16x16_32x32_8x32x1_8x32x1_1x32x1x8_8_1x1_intrawave_v3,0,0,0
80,4096,24576,1536,0,0,1448.9153,a8w8_blockscale_1x128x128_256x128x128x128_16x16_32x32_8x32x1_8x32x1_1x32x1x8_8_1x1_intrawave_v3,0,0,0
80,6144,24576,1536,3,0,2533.8727,a8w8_blockscale_1x128x128_256x64x64x128_16x16_32x32_8x32x1_8x32x1_1x32x1x8_8_1x1_intrawave_v3,0,0,0
80,8192,24576,1536,0,0,2886.1359,a8w8_blockscale_1x128x128_256x128x128x128_16x16_32x32_8x32x1_8x32x1_1x32x1x8_8_1x1_intrawave_v3,0,0,0
80,10240,24576,1536,0,0,3651.431,a8w8_blockscale_1x128x128_256x128x128x128_16x16_32x32_8x32x1_8x32x1_1x32x1x8_8_1x1_intrawave_v3,0,0,0
80,12288,24576,1536,0,0,4305.7272,a8w8_blockscale_1x128x128_256x128x128x128_16x16_32x32_8x32x1_8x32x1_1x32x1x8_8_1x1_intrawave_v3,0,0,0
80,14336,24576,1536,3,0,5951.0038,a8w8_blockscale_1x128x128_256x64x64x128_16x16_32x32_8x32x1_8x32x1_1x32x1x8_8_1x1_intrawave_v3,0,0,0
80,16384,24576,1536,3,0,6732.7083,a8w8_blockscale_1x128x128_256x64x64x128_16x16_32x32_8x32x1_8x32x1_1x32x1x8_8_1x1_intrawave_v3,0,0,0
80,32768,24576,1536,3,0,13388.3528,a8w8_blockscale_1x128x128_256x64x64x128_16x16_32x32_8x32x1_8x32x1_1x32x1x8_8_1x1_intrawave_v3,0,0,0
80,65536,24576,1536,0,0,22949.6148,a8w8_blockscale_1x128x128_256x128x128x128_16x16_32x32_8x32x1_8x32x1_1x32x1x8_8_1x1_intrawave_v3,0,0,0
80,1,32768,512,8,0,11.9511,a8w8_blockscale_1x128x128_256x16x64x256_16x16_16x16_16x16x1_16x16x1_1x16x1x16_4_1x1_intrawave_v1,0,0,0
80,2,32768,512,8,0,13.3839,a8w8_blockscale_1x128x128_256x16x64x256_16x16_16x16_16x16x1_16x16x1_1x16x1x16_4_1x1_intrawave_v1,0,0,0
80,4,32768,512,8,0,11.9811,a8w8_blockscale_1x128x128_256x16x64x256_16x16_16x16_16x16x1_16x16x1_1x16x1x16_4_1x1_intrawave_v1,0,0,0
80,8,32768,512,8,0,12.1631,a8w8_blockscale_1x128x128_256x16x64x256_16x16_16x16_16x16x1_16x16x1_1x16x1x16_4_1x1_intrawave_v1,0,0,0
80,16,32768,512,8,0,12.3079,a8w8_blockscale_1x128x128_256x16x64x256_16x16_16x16_16x16x1_16x16x1_1x16x1x16_4_1x1_intrawave_v1,0,0,0
80,32,32768,512,13,0,18.3123,a8w8_blockscale_1x128x128_256x32x64x256_16x16_16x16_16x16x1_16x16x1_1x32x1x8_8_2x1_intrawave_v1,0,0,0
80,64,32768,512,18,0,24.9151,a8w8_blockscale_1x128x128_256x64x64x256_16x16_32x32_16x16x1_16x16x1_1x32x1x8_8_1x1_intrawave_v1,0,0,0
80,96,32768,512,10,0,39.2468,a8w8_blockscale_1x128x128_256x32x128x128_16x16_32x32_8x32x1_8x32x1_1x32x1x8_8_1x1_intrawave_v1,0,0,0
80,128,32768,512,16,0,41.9332,a8w8_blockscale_1x128x128_256x64x64x128_16x16_32x32_8x32x1_8x32x1_1x32x1x8_8_1x1_intrawave_v1,0,0,0
80,160,32768,512,3,0,59.4173,a8w8_blockscale_1x128x128_256x64x64x128_16x16_32x32_8x32x1_8x32x1_1x32x1x8_8_1x1_intrawave_v3,0,0,0
80,192,32768,512,16,0,58.0269,a8w8_blockscale_1x128x128_256x64x64x128_16x16_32x32_8x32x1_8x32x1_1x32x1x8_8_1x1_intrawave_v1,0,0,0
80,224,32768,512,16,0,74.8462,a8w8_blockscale_1x128x128_256x64x64x128_16x16_32x32_8x32x1_8x32x1_1x32x1x8_8_1x1_intrawave_v1,0,0,0
80,256,32768,512,16,0,74.2042,a8w8_blockscale_1x128x128_256x64x64x128_16x16_32x32_8x32x1_8x32x1_1x32x1x8_8_1x1_intrawave_v1,0,0,0
80,288,32768,512,16,0,91.3867,a8w8_blockscale_1x128x128_256x64x64x128_16x16_32x32_8x32x1_8x32x1_1x32x1x8_8_1x1_intrawave_v1,0,0,0
80,320,32768,512,16,0,91.3327,a8w8_blockscale_1x128x128_256x64x64x128_16x16_32x32_8x32x1_8x32x1_1x32x1x8_8_1x1_intrawave_v1,0,0,0
80,352,32768,512,16,0,107.482,a8w8_blockscale_1x128x128_256x64x64x128_16x16_32x32_8x32x1_8x32x1_1x32x1x8_8_1x1_intrawave_v1,0,0,0
80,384,32768,512,16,0,106.8048,a8w8_blockscale_1x128x128_256x64x64x128_16x16_32x32_8x32x1_8x32x1_1x32x1x8_8_1x1_intrawave_v1,0,0,0
80,416,32768,512,16,0,124.5641,a8w8_blockscale_1x128x128_256x64x64x128_16x16_32x32_8x32x1_8x32x1_1x32x1x8_8_1x1_intrawave_v1,0,0,0
80,448,32768,512,16,0,122.9093,a8w8_blockscale_1x128x128_256x64x64x128_16x16_32x32_8x32x1_8x32x1_1x32x1x8_8_1x1_intrawave_v1,0,0,0
80,480,32768,512,3,0,140.615,a8w8_blockscale_1x128x128_256x64x64x128_16x16_32x32_8x32x1_8x32x1_1x32x1x8_8_1x1_intrawave_v3,0,0,0
80,512,32768,512,16,0,138.6678,a8w8_blockscale_1x128x128_256x64x64x128_16x16_32x32_8x32x1_8x32x1_1x32x1x8_8_1x1_intrawave_v1,0,0,0
80,1024,32768,512,16,0,263.8865,a8w8_blockscale_1x128x128_256x64x64x128_16x16_32x32_8x32x1_8x32x1_1x32x1x8_8_1x1_intrawave_v1,0,0,0
80,2048,32768,512,16,0,513.9487,a8w8_blockscale_1x128x128_256x64x64x128_16x16_32x32_8x32x1_8x32x1_1x32x1x8_8_1x1_intrawave_v1,0,0,0
80,4096,32768,512,16,0,1016.0847,a8w8_blockscale_1x128x128_256x64x64x128_16x16_32x32_8x32x1_8x32x1_1x32x1x8_8_1x1_intrawave_v1,0,0,0
80,6144,32768,512,16,0,1515.4856,a8w8_blockscale_1x128x128_256x64x64x128_16x16_32x32_8x32x1_8x32x1_1x32x1x8_8_1x1_intrawave_v1,0,0,0
80,8192,32768,512,16,0,2016.3824,a8w8_blockscale_1x128x128_256x64x64x128_16x16_32x32_8x32x1_8x32x1_1x32x1x8_8_1x1_intrawave_v1,0,0,0
80,10240,32768,512,16,0,2515.5457,a8w8_blockscale_1x128x128_256x64x64x128_16x16_32x32_8x32x1_8x32x1_1x32x1x8_8_1x1_intrawave_v1,0,0,0
80,12288,32768,512,16,0,3016.8385,a8w8_blockscale_1x128x128_256x64x64x128_16x16_32x32_8x32x1_8x32x1_1x32x1x8_8_1x1_intrawave_v1,0,0,0
80,14336,32768,512,3,0,3544.876,a8w8_blockscale_1x128x128_256x64x64x128_16x16_32x32_8x32x1_8x32x1_1x32x1x8_8_1x1_intrawave_v3,0,0,0
80,16384,32768,512,16,0,4019.012,a8w8_blockscale_1x128x128_256x64x64x128_16x16_32x32_8x32x1_8x32x1_1x32x1x8_8_1x1_intrawave_v1,0,0,0
80,32768,32768,512,3,0,8065.9904,a8w8_blockscale_1x128x128_256x64x64x128_16x16_32x32_8x32x1_8x32x1_1x32x1x8_8_1x1_intrawave_v3,0,0,0
80,1,32768,1536,8,0,28.4212,a8w8_blockscale_1x128x128_256x16x64x256_16x16_16x16_16x16x1_16x16x1_1x16x1x16_4_1x1_intrawave_v1,0,0,0
80,2,32768,1536,8,0,28.4788,a8w8_blockscale_1x128x128_256x16x64x256_16x16_16x16_16x16x1_16x16x1_1x16x1x16_4_1x1_intrawave_v1,0,0,0
80,4,32768,1536,8,0,28.9084,a8w8_blockscale_1x128x128_256x16x64x256_16x16_16x16_16x16x1_16x16x1_1x16x1x16_4_1x1_intrawave_v1,0,0,0
80,8,32768,1536,6,0,41.504,a8w8_blockscale_1x128x128_256x16x64x128_8x16_16x16_16x16x1_8x32x1_1x16x1x16_4_1x1_intrawave_v1,0,0,0
80,16,32768,1536,8,0,27.3928,a8w8_blockscale_1x128x128_256x16x64x256_16x16_16x16_16x16x1_16x16x1_1x16x1x16_4_1x1_intrawave_v1,0,0,0
80,32,32768,1536,13,0,42.9012,a8w8_blockscale_1x128x128_256x32x64x256_16x16_16x16_16x16x1_16x16x1_1x32x1x8_8_2x1_intrawave_v1,0,0,0
80,64,32768,1536,18,0,50.8693,a8w8_blockscale_1x128x128_256x64x64x256_16x16_32x32_16x16x1_16x16x1_1x32x1x8_8_1x1_intrawave_v1,0,0,0
80,96,32768,1536,3,0,90.8503,a8w8_blockscale_1x128x128_256x64x64x128_16x16_32x32_8x32x1_8x32x1_1x32x1x8_8_1x1_intrawave_v3,0,0,0
80,128,32768,1536,0,0,90.0163,a8w8_blockscale_1x128x128_256x128x128x128_16x16_32x32_8x32x1_8x32x1_1x32x1x8_8_1x1_intrawave_v3,0,0,0
80,160,32768,1536,2,0,130.1209,a8w8_blockscale_1x128x128_256x64x128x128_16x16_32x32_8x32x1_8x32x1_1x32x1x8_8_1x1_intrawave_v3,0,0,0
80,192,32768,1536,2,0,132.3045,a8w8_blockscale_1x128x128_256x64x128x128_16x16_32x32_8x32x1_8x32x1_1x32x1x8_8_1x1_intrawave_v3,0,0,0
80,224,32768,1536,2,0,167.1315,a8w8_blockscale_1x128x128_256x64x128x128_16x16_32x32_8x32x1_8x32x1_1x32x1x8_8_1x1_intrawave_v3,0,0,0
80,256,32768,1536,0,0,151.9194,a8w8_blockscale_1x128x128_256x128x128x128_16x16_32x32_8x32x1_8x32x1_1x32x1x8_8_1x1_intrawave_v3,0,0,0
80,288,32768,1536,3,0,209.4934,a8w8_blockscale_1x128x128_256x64x64x128_16x16_32x32_8x32x1_8x32x1_1x32x1x8_8_1x1_intrawave_v3,0,0,0
80,320,32768,1536,2,0,220.1254,a8w8_blockscale_1x128x128_256x64x128x128_16x16_32x32_8x32x1_8x32x1_1x32x1x8_8_1x1_intrawave_v3,0,0,0
80,352,32768,1536,0,0,240.9319,a8w8_blockscale_1x128x128_256x128x128x128_16x16_32x32_8x32x1_8x32x1_1x32x1x8_8_1x1_intrawave_v3,0,0,0
80,384,32768,1536,0,0,200.5321,a8w8_blockscale_1x128x128_256x128x128x128_16x16_32x32_8x32x1_8x32x1_1x32x1x8_8_1x1_intrawave_v3,0,0,0
80,416,32768,1536,2,0,286.0878,a8w8_blockscale_1x128x128_256x64x128x128_16x16_32x32_8x32x1_8x32x1_1x32x1x8_8_1x1_intrawave_v3,0,0,0
80,448,32768,1536,2,0,285.5158,a8w8_blockscale_1x128x128_256x64x128x128_16x16_32x32_8x32x1_8x32x1_1x32x1x8_8_1x1_intrawave_v3,0,0,0
80,480,32768,1536,0,0,310.0055,a8w8_blockscale_1x128x128_256x128x128x128_16x16_32x32_8x32x1_8x32x1_1x32x1x8_8_1x1_intrawave_v3,0,0,0
80,512,32768,1536,0,0,258.5844,a8w8_blockscale_1x128x128_256x128x128x128_16x16_32x32_8x32x1_8x32x1_1x32x1x8_8_1x1_intrawave_v3,0,0,0
80,1024,32768,1536,0,0,502.3442,a8w8_blockscale_1x128x128_256x128x128x128_16x16_32x32_8x32x1_8x32x1_1x32x1x8_8_1x1_intrawave_v3,0,0,0
80,2048,32768,1536,0,0,982.4949,a8w8_blockscale_1x128x128_256x128x128x128_16x16_32x32_8x32x1_8x32x1_1x32x1x8_8_1x1_intrawave_v3,0,0,0
80,4096,32768,1536,0,0,1930.1166,a8w8_blockscale_1x128x128_256x128x128x128_16x16_32x32_8x32x1_8x32x1_1x32x1x8_8_1x1_intrawave_v3,0,0,0
80,6144,32768,1536,0,0,2916.9733,a8w8_blockscale_1x128x128_256x128x128x128_16x16_32x32_8x32x1_8x32x1_1x32x1x8_8_1x1_intrawave_v3,0,0,0
80,8192,32768,1536,3,0,4534.0043,a8w8_blockscale_1x128x128_256x64x64x128_16x16_32x32_8x32x1_8x32x1_1x32x1x8_8_1x1_intrawave_v3,0,0,0
80,10240,32768,1536,0,0,4837.2435,a8w8_blockscale_1x128x128_256x128x128x128_16x16_32x32_8x32x1_8x32x1_1x32x1x8_8_1x1_intrawave_v3,0,0,0
80,12288,32768,1536,0,0,5785.9662,a8w8_blockscale_1x128x128_256x128x128x128_16x16_32x32_8x32x1_8x32x1_1x32x1x8_8_1x1_intrawave_v3,0,0,0
80,14336,32768,1536,0,0,6695.5133,a8w8_blockscale_1x128x128_256x128x128x128_16x16_32x32_8x32x1_8x32x1_1x32x1x8_8_1x1_intrawave_v3,0,0,0
80,16384,32768,1536,3,0,8991.3448,a8w8_blockscale_1x128x128_256x64x64x128_16x16_32x32_8x32x1_8x32x1_1x32x1x8_8_1x1_intrawave_v3,0,0,0
80,32768,32768,1536,0,0,15429.1559,a8w8_blockscale_1x128x128_256x128x128x128_16x16_32x32_8x32x1_8x32x1_1x32x1x8_8_1x1_intrawave_v3,0,0,0
80,1,36864,7168,8,0,126.2421,a8w8_blockscale_1x128x128_256x16x64x256_16x16_16x16_16x16x1_16x16x1_1x16x1x16_4_1x1_intrawave_v1,0,0,0
80,2,36864,7168,8,0,127.8185,a8w8_blockscale_1x128x128_256x16x64x256_16x16_16x16_16x16x1_16x16x1_1x16x1x16_4_1x1_intrawave_v1,0,0,0
80,4,36864,7168,8,0,129.7421,a8w8_blockscale_1x128x128_256x16x64x256_16x16_16x16_16x16x1_16x16x1_1x16x1x16_4_1x1_intrawave_v1,0,0,0
80,8,36864,7168,8,0,131.4905,a8w8_blockscale_1x128x128_256x16x64x256_16x16_16x16_16x16x1_16x16x1_1x16x1x16_4_1x1_intrawave_v1,0,0,0
80,16,36864,7168,8,0,126.5277,a8w8_blockscale_1x128x128_256x16x64x256_16x16_16x16_16x16x1_16x16x1_1x16x1x16_4_1x1_intrawave_v1,0,0,0
80,32,36864,7168,13,0,181.66,a8w8_blockscale_1x128x128_256x32x64x256_16x16_16x16_16x16x1_16x16x1_1x32x1x8_8_2x1_intrawave_v1,0,0,0
80,64,36864,7168,18,0,204.0713,a8w8_blockscale_1x128x128_256x64x64x256_16x16_32x32_16x16x1_16x16x1_1x32x1x8_8_1x1_intrawave_v1,0,0,0
80,96,36864,7168,12,0,375.3626,a8w8_blockscale_1x128x128_256x32x128x256_16x16_32x32_16x16x1_16x16x1_1x32x1x8_8_1x1_intrawave_v1,0,0,0
80,128,36864,7168,0,0,355.7861,a8w8_blockscale_1x128x128_256x128x128x128_16x16_32x32_8x32x1_8x32x1_1x32x1x8_8_1x1_intrawave_v3,0,0,0
80,160,36864,7168,18,0,559.152,a8w8_blockscale_1x128x128_256x64x64x256_16x16_32x32_16x16x1_16x16x1_1x32x1x8_8_1x1_intrawave_v1,0,0,0
80,192,36864,7168,18,0,513.2381,a8w8_blockscale_1x128x128_256x64x64x256_16x16_32x32_16x16x1_16x16x1_1x32x1x8_8_1x1_intrawave_v1,0,0,0
80,224,36864,7168,2,0,725.3164,a8w8_blockscale_1x128x128_256x64x128x128_16x16_32x32_8x32x1_8x32x1_1x32x1x8_8_1x1_intrawave_v3,0,0,0
80,256,36864,7168,0,0,606.9262,a8w8_blockscale_1x128x128_256x128x128x128_16x16_32x32_8x32x1_8x32x1_1x32x1x8_8_1x1_intrawave_v3,0,0,0
80,288,36864,7168,2,0,976.0007,a8w8_blockscale_1x128x128_256x64x128x128_16x16_32x32_8x32x1_8x32x1_1x32x1x8_8_1x1_intrawave_v3,0,0,0
80,320,36864,7168,18,0,865.4396,a8w8_blockscale_1x128x128_256x64x64x256_16x16_32x32_16x16x1_16x16x1_1x32x1x8_8_1x1_intrawave_v1,0,0,0
80,352,36864,7168,18,0,1107.0329,a8w8_blockscale_1x128x128_256x64x64x256_16x16_32x32_16x16x1_16x16x1_1x32x1x8_8_1x1_intrawave_v1,0,0,0
80,384,36864,7168,0,0,823.1322,a8w8_blockscale_1x128x128_256x128x128x128_16x16_32x32_8x32x1_8x32x1_1x32x1x8_8_1x1_intrawave_v3,0,0,0
80,416,36864,7168,18,0,1289.8574,a8w8_blockscale_1x128x128_256x64x64x256_16x16_32x32_16x16x1_16x16x1_1x32x1x8_8_1x1_intrawave_v1,0,0,0
80,448,36864,7168,2,0,1317.354,a8w8_blockscale_1x128x128_256x64x128x128_16x16_32x32_8x32x1_8x32x1_1x32x1x8_8_1x1_intrawave_v3,0,0,0
80,480,36864,7168,2,0,1375.2819,a8w8_blockscale_1x128x128_256x64x128x128_16x16_32x32_8x32x1_8x32x1_1x32x1x8_8_1x1_intrawave_v3,0,0,0
80,512,36864,7168,0,0,1092.6052,a8w8_blockscale_1x128x128_256x128x128x128_16x16_32x32_8x32x1_8x32x1_1x32x1x8_8_1x1_intrawave_v3,0,0,0
80,1024,36864,7168,0,0,2089.0389,a8w8_blockscale_1x128x128_256x128x128x128_16x16_32x32_8x32x1_8x32x1_1x32x1x8_8_1x1_intrawave_v3,0,0,0
80,2048,36864,7168,0,0,4009.9839,a8w8_blockscale_1x128x128_256x128x128x128_16x16_32x32_8x32x1_8x32x1_1x32x1x8_8_1x1_intrawave_v3,0,0,0
80,4096,36864,7168,0,0,7895.1562,a8w8_blockscale_1x128x128_256x128x128x128_16x16_32x32_8x32x1_8x32x1_1x32x1x8_8_1x1_intrawave_v3,0,0,0
80,6144,36864,7168,0,0,12073.6156,a8w8_blockscale_1x128x128_256x128x128x128_16x16_32x32_8x32x1_8x32x1_1x32x1x8_8_1x1_intrawave_v3,0,0,0
80,8192,36864,7168,0,0,15680.1116,a8w8_blockscale_1x128x128_256x128x128x128_16x16_32x32_8x32x1_8x32x1_1x32x1x8_8_1x1_intrawave_v3,0,0,0
80,10240,36864,7168,0,0,19995.2839,a8w8_blockscale_1x128x128_256x128x128x128_16x16_32x32_8x32x1_8x32x1_1x32x1x8_8_1x1_intrawave_v3,0,0,0
80,12288,36864,7168,0,0,23625.3537,a8w8_blockscale_1x128x128_256x128x128x128_16x16_32x32_8x32x1_8x32x1_1x32x1x8_8_1x1_intrawave_v3,0,0,0
80,14336,36864,7168,0,0,27944.1037,a8w8_blockscale_1x128x128_256x128x128x128_16x16_32x32_8x32x1_8x32x1_1x32x1x8_8_1x1_intrawave_v3,0,0,0
80,16384,36864,7168,0,0,31524.9476,a8w8_blockscale_1x128x128_256x128x128x128_16x16_32x32_8x32x1_8x32x1_1x32x1x8_8_1x1_intrawave_v3,0,0,0
80,32768,36864,7168,0,0,62743.4272,a8w8_blockscale_1x128x128_256x128x128x128_16x16_32x32_8x32x1_8x32x1_1x32x1x8_8_1x1_intrawave_v3,0,0,0
80,65536,36864,7168,0,0,127114.4032,a8w8_blockscale_1x128x128_256x128x128x128_16x16_32x32_8x32x1_8x32x1_1x32x1x8_8_1x1_intrawave_v3,0,0,0
256,1,2112,7168,8,0,23.1423,a8w8_blockscale_1x128x128_256x16x64x256_16x16_16x16_16x16x1_16x16x1_1x16x1x16_4_1x1_intrawave_v1,1.31,654.65,0
256,2,2112,7168,8,0,23.1821,a8w8_blockscale_1x128x128_256x16x64x256_16x16_16x16_16x16x1_16x16x1_1x16x1x16_4_1x1_intrawave_v1,2.61,654.02,0
256,4,2112,7168,8,0,23.0544,a8w8_blockscale_1x128x128_256x16x64x256_16x16_16x16_16x16x1_16x16x1_1x16x1x16_4_1x1_intrawave_v1,5.25,658.63,0
256,8,2112,7168,8,0,23.2634,a8w8_blockscale_1x128x128_256x16x64x256_16x16_16x16_16x16x1_16x16x1_1x16x1x16_4_1x1_intrawave_v1,10.41,654.67,0
256,16,2112,7168,8,0,20.2497,a8w8_blockscale_1x128x128_256x16x64x256_16x16_16x16_16x16x1_16x16x1_1x16x1x16_4_1x1_intrawave_v1,23.92,756.61,0
256,32,2112,7168,8,0,20.0548,a8w8_blockscale_1x128x128_256x16x64x256_16x16_16x16_16x16x1_16x16x1_1x16x1x16_4_1x1_intrawave_v1,48.31,773.05,0
256,64,2112,7168,8,0,19.8696,a8w8_blockscale_1x128x128_256x16x64x256_16x16_16x16_16x16x1_16x16x1_1x16x1x16_4_1x1_intrawave_v1,97.52,798.6,0
256,128,2112,7168,8,0,20.2426,a8w8_blockscale_1x128x128_256x16x64x256_16x16_16x16_16x16x1_16x16x1_1x16x1x16_4_1x1_intrawave_v1,191.45,819.9,0
256,256,2112,7168,18,0,22.1462,a8w8_blockscale_1x128x128_256x64x64x256_16x16_32x32_16x16x1_16x16x1_1x32x1x8_8_1x1_intrawave_v1,350,815.27,0
256,512,2112,7168,18,0,29.0228,a8w8_blockscale_1x128x128_256x64x64x256_16x16_32x32_16x16x1_16x16x1_1x32x1x8_8_1x1_intrawave_v1,534.14,722.59,0
256,1024,2112,7168,18,0,44.836,a8w8_blockscale_1x128x128_256x64x64x256_16x16_32x32_16x16x1_16x16x1_1x32x1x8_8_1x1_intrawave_v1,691.5,597.83,0
256,2048,2112,7168,18,0,74.5268,a8w8_blockscale_1x128x128_256x64x64x256_16x16_32x32_16x16x1_16x16x1_1x32x1x8_8_1x1_intrawave_v1,832.03,516.19,0
256,4096,2112,7168,0,0,124.1349,a8w8_blockscale_1x128x128_256x128x128x128_16x16_32x32_8x32x1_8x32x1_1x32x1x8_8_1x1_intrawave_v3,999.05,497.85,0
256,8192,2112,7168,0,0,198.3448,a8w8_blockscale_1x128x128_256x128x128x128_16x16_32x32_8x32x1_8x32x1_1x32x1x8_8_1x1_intrawave_v3,1250.52,546.84,0
256,16384,2112,7168,0,0,351.5932,a8w8_blockscale_1x128x128_256x128x128x128_16x16_32x32_8x32x1_8x32x1_1x32x1x8_8_1x1_intrawave_v3,1410.92,573.92,0
256,32768,2112,7168,0,0,706.8872,a8w8_blockscale_1x128x128_256x128x128x128_16x16_32x32_8x32x1_8x32x1_1x32x1x8_8_1x1_intrawave_v3,1403.53,549.5,0
256,1,3072,1536,8,0,7.4103,a8w8_blockscale_1x128x128_256x16x64x256_16x16_16x16_16x16x1_16x16x1_1x16x1x16_4_1x1_intrawave_v1,1.27,637.8,0
256,2,3072,1536,8,0,7.4266,a8w8_blockscale_1x128x128_256x16x64x256_16x16_16x16_16x16x1_16x16x1_1x16x1x16_4_1x1_intrawave_v1,2.54,637.43,0
256,4,3072,1536,13,0,7.8966,a8w8_blockscale_1x128x128_256x32x64x256_16x16_16x16_16x16x1_16x16x1_1x32x1x8_8_2x1_intrawave_v1,4.78,601.44,0
256,8,3072,1536,18,0,7.9267,a8w8_blockscale_1x128x128_256x64x64x256_16x16_32x32_16x16x1_16x16x1_1x32x1x8_8_1x1_intrawave_v1,9.52,603.03,0
256,16,3072,1536,8,0,7.4157,a8w8_blockscale_1x128x128_256x16x64x256_16x16_16x16_16x16x1_16x16x1_1x16x1x16_4_1x1_intrawave_v1,20.36,652.87,0
256,32,3072,1536,8,0,7.0426,a8w8_blockscale_1x128x128_256x16x64x256_16x16_16x16_16x16x1_16x16x1_1x16x1x16_4_1x1_intrawave_v1,42.88,704.9,0
256,64,3072,1536,8,0,7.5522,a8w8_blockscale_1x128x128_256x16x64x256_16x16_16x16_16x16x1_16x16x1_1x16x1x16_4_1x1_intrawave_v1,79.97,689.88,0
256,128,3072,1536,8,0,8.1319,a8w8_blockscale_1x128x128_256x16x64x256_16x16_16x16_16x16x1_16x16x1_1x16x1x16_4_1x1_intrawave_v1,148.55,701.14,0
256,256,3072,1536,18,0,7.6382,a8w8_blockscale_1x128x128_256x64x64x256_16x16_32x32_16x16x1_16x16x1_1x32x1x8_8_1x1_intrawave_v1,316.29,875.16,0
256,512,3072,1536,18,0,10.6592,a8w8_blockscale_1x128x128_256x64x64x256_16x16_32x32_16x16x1_16x16x1_1x32x1x8_8_1x1_intrawave_v1,453.3,811.58,0
256,1024,3072,1536,18,0,15.1443,a8w8_blockscale_1x128x128_256x64x64x256_16x16_32x32_16x16x1_16x16x1_1x32x1x8_8_1x1_intrawave_v1,638.11,830.87,0
256,2048,3072,1536,2,0,23.8432,a8w8_blockscale_1x128x128_256x64x128x128_16x16_32x32_8x32x1_8x32x1_1x32x1x8_8_1x1_intrawave_v3,810.6,857.57,0
256,4096,3072,1536,0,0,37.7108,a8w8_blockscale_1x128x128_256x128x128x128_16x16_32x32_8x32x1_8x32x1_1x32x1x8_8_1x1_intrawave_v3,1025.03,959.3,0
256,8192,3072,1536,0,0,66.4578,a8w8_blockscale_1x128x128_256x128x128x128_16x16_32x32_8x32x1_8x32x1_1x32x1x8_8_1x1_intrawave_v3,1163.29,1017.69,0
256,16384,3072,1536,0,0,125.1134,a8w8_blockscale_1x128x128_256x128x128x128_16x16_32x32_8x32x1_8x32x1_1x32x1x8_8_1x1_intrawave_v3,1235.83,1043.44,0
256,20480,3072,1536,0,0,223.3253,a8w8_blockscale_1x128x128_256x128x128x128_16x16_32x32_8x32x1_8x32x1_1x32x1x8_8_1x1_intrawave_v3,865.43,725.42,0
256,32768,3072,1536,0,0,227.0388,a8w8_blockscale_1x128x128_256x128x128x128_16x16_32x32_8x32x1_8x32x1_1x32x1x8_8_1x1_intrawave_v3,1362.05,1129.22,0
256,1,4096,512,8,0,3.8518,a8w8_blockscale_1x128x128_256x16x64x256_16x16_16x16_16x16x1_16x16x1_1x16x1x16_4_1x1_intrawave_v1,1.09,546.72,0
256,2,4096,512,8,0,3.8129,a8w8_blockscale_1x128x128_256x16x64x256_16x16_16x16_16x16x1_16x16x1_1x16x1x16_4_1x1_intrawave_v1,2.2,554.58,0
256,4,4096,512,13,0,3.4246,a8w8_blockscale_1x128x128_256x32x64x256_16x16_16x16_16x16x1_16x16x1_1x32x1x8_8_2x1_intrawave_v1,4.9,622.55,0
256,8,4096,512,8,0,3.8517,a8w8_blockscale_1x128x128_256x16x64x256_16x16_16x16_16x16x1_16x16x1_1x16x1x16_4_1x1_intrawave_v1,8.71,562.55,0
256,16,4096,512,8,0,3.835,a8w8_blockscale_1x128x128_256x16x64x256_16x16_16x16_16x16x1_16x16x1_1x16x1x16_4_1x1_intrawave_v1,17.5,583.16,0
256,32,4096,512,11,0,3.8544,a8w8_blockscale_1x128x128_256x32x64x128_16x16_16x16_8x32x1_8x32x1_1x32x1x8_8_2x1_intrawave_v1,34.82,616.36,0
256,64,4096,512,6,0,4.0748,a8w8_blockscale_1x128x128_256x16x64x128_8x16_16x16_16x16x1_8x32x1_1x16x1x16_4_1x1_intrawave_v1,65.88,651.37,0
256,128,4096,512,11,0,4.4446,a8w8_blockscale_1x128x128_256x32x64x128_16x16_16x16_8x32x1_8x32x1_1x32x1x8_8_2x1_intrawave_v1,120.79,722.51,0
256,256,4096,512,12,0,4.6202,a8w8_blockscale_1x128x128_256x32x128x256_16x16_32x32_16x16x1_16x16x1_1x32x1x8_8_1x1_intrawave_v1,232.4,936.19,0
256,512,4096,512,18,0,7.2254,a8w8_blockscale_1x128x128_256x64x64x256_16x16_32x32_16x16x1_16x16x1_1x32x1x8_8_1x1_intrawave_v1,297.21,907.02,0
256,1024,4096,512,0,0,9.5064,a8w8_blockscale_1x128x128_256x128x128x128_16x16_32x32_8x32x1_8x32x1_1x32x1x8_8_1x1_intrawave_v3,451.8,1158.17,0
256,2048,4096,512,0,0,14.9624,a8w8_blockscale_1x128x128_256x128x128x128_16x16_32x32_8x32x1_8x32x1_1x32x1x8_8_1x1_intrawave_v3,574.1,1331.53,0
256,4096,4096,512,0,0,25.9147,a8w8_blockscale_1x128x128_256x128x128x128_16x16_32x32_8x32x1_8x32x1_1x32x1x8_8_1x1_intrawave_v3,662.94,1456.65,0
256,8192,4096,512,0,0,45.4707,a8w8_blockscale_1x128x128_256x128x128x128_16x16_32x32_8x32x1_8x32x1_1x32x1x8_8_1x1_intrawave_v3,755.65,1614.23,0
256,16384,4096,512,0,0,85.3201,a8w8_blockscale_1x128x128_256x128x128x128_16x16_32x32_8x32x1_8x32x1_1x32x1x8_8_1x1_intrawave_v3,805.43,1696.01,0
256,20480,4096,512,18,0,144.807,a8w8_blockscale_1x128x128_256x64x64x256_16x16_32x32_16x16x1_16x16x1_1x32x1x8_8_1x1_intrawave_v1,593.2,1245.49,0
256,32768,4096,512,0,0,159.2565,a8w8_blockscale_1x128x128_256x128x128x128_16x16_32x32_8x32x1_8x32x1_1x32x1x8_8_1x1_intrawave_v3,863,1804.07,0
256,1,7168,2048,8,0,8.5724,a8w8_blockscale_1x128x128_256x16x64x256_16x16_16x16_16x16x1_16x16x1_1x16x1x16_4_1x1_intrawave_v1,3.42,1714.39,0
256,2,7168,2048,8,0,8.6049,a8w8_blockscale_1x128x128_256x16x64x256_16x16_16x16_16x16x1_16x16x1_1x16x1x16_4_1x1_intrawave_v1,6.82,1709.82,0
256,4,7168,2048,8,0,8.188,a8w8_blockscale_1x128x128_256x16x64x256_16x16_16x16_16x16x1_16x16x1_1x16x1x16_4_1x1_intrawave_v1,14.34,1800.88,0
256,8,7168,2048,8,0,8.3523,a8w8_blockscale_1x128x128_256x16x64x256_16x16_16x16_16x16x1_16x16x1_1x16x1x16_4_1x1_intrawave_v1,28.12,1773.3,0
256,16,7168,2048,8,0,8.3043,a8w8_blockscale_1x128x128_256x16x64x256_16x16_16x16_16x16x1_16x16x1_1x16x1x16_4_1x1_intrawave_v1,56.57,1799.33,0
256,32,7168,2048,7,0,8.4862,a8w8_blockscale_1x128x128_256x16x128x256_16x16_16x16_16x16x1_16x16x1_1x16x1x16_8_1x2_intrawave_v1,110.71,1791.66,0
256,64,7168,2048,8,0,8.825,a8w8_blockscale_1x128x128_256x16x64x256_16x16_16x16_16x16x1_16x16x1_1x16x1x16_4_1x1_intrawave_v1,212.92,1782.28,0
256,128,7168,2048,18,0,9.0903,a8w8_blockscale_1x128x128_256x64x64x256_16x16_32x32_16x16x1_16x16x1_1x32x1x8_8_1x1_intrawave_v1,413.42,1845.62,0
256,256,7168,2048,18,0,13.0936,a8w8_blockscale_1x128x128_256x64x64x256_16x16_32x32_16x16x1_16x16x1_1x32x1x8_8_1x1_intrawave_v1,574.04,1441.5,0
256,512,7168,2048,0,0,19.376,a8w8_blockscale_1x128x128_256x128x128x128_16x16_32x32_8x32x1_8x32x1_1x32x1x8_8_1x1_intrawave_v3,775.83,1190.58,0
256,1024,7168,2048,0,0,31.2424,a8w8_blockscale_1x128x128_256x128x128x128_16x16_32x32_8x32x1_8x32x1_1x32x1x8_8_1x1_intrawave_v3,962.31,1006.88,0
256,2048,7168,2048,0,0,56.3503,a8w8_blockscale_1x128x128_256x128x128x128_16x16_32x32_8x32x1_8x32x1_1x32x1x8_8_1x1_intrawave_v3,1067.07,855.98,0
256,4096,7168,2048,0,0,98.6453,a8w8_blockscale_1x128x128_256x128x128x128_16x16_32x32_8x32x1_8x32x1_1x32x1x8_8_1x1_intrawave_v3,1219.11,829.12,0
256,8192,7168,2048,0,0,178.4711,a8w8_blockscale_1x128x128_256x128x128x128_16x16_32x32_8x32x1_8x32x1_1x32x1x8_8_1x1_intrawave_v3,1347.66,834.3,0
256,16384,7168,2048,0,0,330.8182,a8w8_blockscale_1x128x128_256x128x128x128_16x16_32x32_8x32x1_8x32x1_1x32x1x8_8_1x1_intrawave_v3,1454.08,855.8,0
256,20480,7168,2048,0,0,630.5854,a8w8_blockscale_1x128x128_256x128x128x128_16x16_32x32_8x32x1_8x32x1_1x32x1x8_8_1x1_intrawave_v3,953.55,555.4,0
256,32768,7168,2048,0,0,649.7976,a8w8_blockscale_1x128x128_256x128x128x128_16x16_32x32_8x32x1_8x32x1_1x32x1x8_8_1x1_intrawave_v3,1480.57,848.8,0
80,1,12288,1536,8,0,13.7246,a8w8_blockscale_1x128x128_256x16x64x256_16x16_16x16_16x16x1_16x16x1_1x16x1x16_4_1x1_intrawave_v1,2.75,1377.12,0.0
80,2,12288,1536,8,0,13.7104,a8w8_blockscale_1x128x128_256x16x64x256_16x16_16x16_16x16x1_16x16x1_1x16x1x16_4_1x1_intrawave_v1,5.51,1380.46,0.0
80,4,12288,1536,8,0,13.8564,a8w8_blockscale_1x128x128_256x16x64x256_16x16_16x16_16x16x1_16x16x1_1x16x1x16_4_1x1_intrawave_v1,10.9,1369.68,0.0
80,8,12288,1536,8,0,14.0441,a8w8_blockscale_1x128x128_256x16x64x256_16x16_16x16_16x16x1_16x16x1_1x16x1x16_4_1x1_intrawave_v1,21.5,1358.81,0.0
80,16,12288,1536,8,0,13.4533,a8w8_blockscale_1x128x128_256x16x64x256_16x16_16x16_16x16x1_16x16x1_1x16x1x16_4_1x1_intrawave_v1,44.89,1434.01,0.0
80,32,12288,1536,8,0,19.7025,a8w8_blockscale_1x128x128_256x16x64x256_16x16_16x16_16x16x1_16x16x1_1x16x1x16_4_1x1_intrawave_v1,61.31,1000.38,0.0
80,64,12288,1536,18,0,23.2003,a8w8_blockscale_1x128x128_256x64x64x256_16x16_32x32_16x16x1_16x16x1_1x32x1x8_8_1x1_intrawave_v1,104.13,885.57,0.0
80,96,12288,1536,18,0,39.0023,a8w8_blockscale_1x128x128_256x64x64x256_16x16_32x32_16x16x1_16x16x1_1x32x1x8_8_1x1_intrawave_v1,92.91,548.2,0.0
80,128,12288,1536,18,0,36.9755,a8w8_blockscale_1x128x128_256x64x64x256_16x16_32x32_16x16x1_16x16x1_1x32x1x8_8_1x1_intrawave_v1,130.68,600.85,0.0
80,160,12288,1536,3,0,55.1249,a8w8_blockscale_1x128x128_256x64x64x128_16x16_32x32_8x32x1_8x32x1_1x32x1x8_8_1x1_intrawave_v3,109.57,418.18,0.0
80,192,12288,1536,18,0,55.5281,a8w8_blockscale_1x128x128_256x64x64x256_16x16_32x32_16x16x1_16x16x1_1x32x1x8_8_1x1_intrawave_v1,130.52,430.19,0.0
80,224,12288,1536,3,0,68.5844,a8w8_blockscale_1x128x128_256x64x64x128_16x16_32x32_8x32x1_8x32x1_1x32x1x8_8_1x1_intrawave_v3,123.29,360.48,0.0
80,256,12288,1536,0,0,68.1899,a8w8_blockscale_1x128x128_256x128x128x128_16x16_32x32_8x32x1_8x32x1_1x32x1x8_8_1x1_intrawave_v3,141.72,374.82,0.0
80,288,12288,1536,3,0,82.8453,a8w8_blockscale_1x128x128_256x64x64x128_16x16_32x32_8x32x1_8x32x1_1x32x1x8_8_1x1_intrawave_v3,131.23,318.6,0.0
80,320,12288,1536,18,0,83.3528,a8w8_blockscale_1x128x128_256x64x64x256_16x16_32x32_16x16x1_16x16x1_1x32x1x8_8_1x1_intrawave_v1,144.92,326.69,0.0
80,352,12288,1536,3,0,97.6398,a8w8_blockscale_1x128x128_256x64x64x128_16x16_32x32_8x32x1_8x32x1_1x32x1x8_8_1x1_intrawave_v3,136.09,287.44,0.0
80,384,12288,1536,0,0,85.1039,a8w8_blockscale_1x128x128_256x128x128x128_16x16_32x32_8x32x1_8x32x1_1x32x1x8_8_1x1_intrawave_v3,170.33,339.6,0.0
80,416,12288,1536,3,0,113.9823,a8w8_blockscale_1x128x128_256x64x64x128_16x16_32x32_8x32x1_8x32x1_1x32x1x8_8_1x1_intrawave_v3,137.77,260.89,0.0
80,448,12288,1536,16,0,112.4137,a8w8_blockscale_1x128x128_256x64x64x128_16x16_32x32_8x32x1_8x32x1_1x32x1x8_8_1x1_intrawave_v1,150.44,271.96,0.0
80,480,12288,1536,3,0,125.2026,a8w8_blockscale_1x128x128_256x64x64x128_16x16_32x32_8x32x1_8x32x1_1x32x1x8_8_1x1_intrawave_v3,144.72,250.86,0.0
80,512,12288,1536,0,0,106.2009,a8w8_blockscale_1x128x128_256x128x128x128_16x16_32x32_8x32x1_8x32x1_1x32x1x8_8_1x1_intrawave_v3,181.99,303.61,0.0
80,1024,12288,1536,0,0,198.2771,a8w8_blockscale_1x128x128_256x128x128x128_16x16_32x32_8x32x1_8x32x1_1x32x1x8_8_1x1_intrawave_v3,194.95,230.05,0.0
80,2048,12288,1536,0,0,384.3137,a8w8_blockscale_1x128x128_256x128x128x128_16x16_32x32_8x32x1_8x32x1_1x32x1x8_8_1x1_intrawave_v3,201.16,188.26,0.0
80,4096,12288,1536,0,0,740.1191,a8w8_blockscale_1x128x128_256x128x128x128_16x16_32x32_8x32x1_8x32x1_1x32x1x8_8_1x1_intrawave_v3,208.91,170.01,0.0
80,6144,12288,1536,0,0,1099.3244,a8w8_blockscale_1x128x128_256x128x128x128_16x16_32x32_8x32x1_8x32x1_1x32x1x8_8_1x1_intrawave_v3,210.97,163.11,0.0
80,8192,12288,1536,0,0,1462.0613,a8w8_blockscale_1x128x128_256x128x128x128_16x16_32x32_8x32x1_8x32x1_1x32x1x8_8_1x1_intrawave_v3,211.51,159.22,0.0
80,10240,12288,1536,0,0,1808.8595,a8w8_blockscale_1x128x128_256x128x128x128_16x16_32x32_8x32x1_8x32x1_1x32x1x8_8_1x1_intrawave_v3,213.7,158.26,0.0
80,12288,12288,1536,0,0,2177.6474,a8w8_blockscale_1x128x128_256x128x128x128_16x16_32x32_8x32x1_8x32x1_1x32x1x8_8_1x1_intrawave_v3,213.01,156.01,0.0
80,14336,12288,1536,0,0,2540.2416,a8w8_blockscale_1x128x128_256x128x128x128_16x16_32x32_8x32x1_8x32x1_1x32x1x8_8_1x1_intrawave_v3,213.04,154.79,0.0
80,16384,12288,1536,0,0,2896.2346,a8w8_blockscale_1x128x128_256x128x128x128_16x16_32x32_8x32x1_8x32x1_1x32x1x8_8_1x1_intrawave_v3,213.54,154.23,0.0
80,32768,12288,1536,0,0,5813.5926,a8w8_blockscale_1x128x128_256x128x128x128_16x16_32x32_8x32x1_8x32x1_1x32x1x8_8_1x1_intrawave_v3,212.77,150.43,0.0
80,65536,12288,1536,0,0,11556.2228,a8w8_blockscale_1x128x128_256x128x128x128_16x16_32x32_8x32x1_8x32x1_1x32x1x8_8_1x1_intrawave_v3,214.08,149.72,0.0
80,98304,12288,1536,0,0,17278.7152,a8w8_blockscale_1x128x128_256x128x128x128_16x16_32x32_8x32x1_8x32x1_1x32x1x8_8_1x1_intrawave_v3,214.76,149.65,0.0
80,131072,12288,1536,0,0,23025.7714,a8w8_blockscale_1x128x128_256x128x128x128_16x16_32x32_8x32x1_8x32x1_1x32x1x8_8_1x1_intrawave_v3,214.88,149.46,0.0
80,1,16384,512,8,0,8.0843,a8w8_blockscale_1x128x128_256x16x64x256_16x16_16x16_16x16x1_16x16x1_1x16x1x16_4_1x1_intrawave_v1,2.08,1041.76,0.0
80,2,16384,512,8,0,7.9934,a8w8_blockscale_1x128x128_256x16x64x256_16x16_16x16_16x16x1_16x16x1_1x16x1x16_4_1x1_intrawave_v1,4.2,1057.77,0.0
80,4,16384,512,8,0,8.6236,a8w8_blockscale_1x128x128_256x16x64x256_16x16_16x16_16x16x1_16x16x1_1x16x1x16_4_1x1_intrawave_v1,7.78,988.19,0.0
80,8,16384,512,8,0,8.1259,a8w8_blockscale_1x128x128_256x16x64x256_16x16_16x16_16x16x1_16x16x1_1x16x1x16_4_1x1_intrawave_v1,16.52,1065.09,0.0
80,16,16384,512,8,0,9.3687,a8w8_blockscale_1x128x128_256x16x64x256_16x16_16x16_16x16x1_16x16x1_1x16x1x16_4_1x1_intrawave_v1,28.65,952.22,0.0
80,32,16384,512,13,0,11.9513,a8w8_blockscale_1x128x128_256x32x64x256_16x16_16x16_16x16x1_16x16x1_1x32x1x8_8_2x1_intrawave_v1,44.92,791.01,0.0
80,64,16384,512,18,0,15.4435,a8w8_blockscale_1x128x128_256x64x64x256_16x16_32x32_16x16x1_16x16x1_1x32x1x8_8_1x1_intrawave_v1,69.53,681.1,0.0
80,96,16384,512,10,0,22.6452,a8w8_blockscale_1x128x128_256x32x128x128_16x16_32x32_8x32x1_8x32x1_1x32x1x8_8_1x1_intrawave_v1,71.12,511.52,0.0
80,128,16384,512,16,0,25.118,a8w8_blockscale_1x128x128_256x64x64x128_16x16_32x32_8x32x1_8x32x1_1x32x1x8_8_1x1_intrawave_v1,85.5,503.56,0.0
80,160,16384,512,10,0,32.7941,a8w8_blockscale_1x128x128_256x32x128x128_16x16_32x32_8x32x1_8x32x1_1x32x1x8_8_1x1_intrawave_v1,81.85,418.17,0.0
80,192,16384,512,16,0,33.0455,a8w8_blockscale_1x128x128_256x64x64x128_16x16_32x32_8x32x1_8x32x1_1x32x1x8_8_1x1_intrawave_v1,97.48,447.21,0.0
80,224,16384,512,16,0,41.121,a8w8_blockscale_1x128x128_256x64x64x128_16x16_32x32_8x32x1_8x32x1_1x32x1x8_8_1x1_intrawave_v1,91.39,385.29,0.0
80,256,16384,512,16,0,41.1389,a8w8_blockscale_1x128x128_256x64x64x128_16x16_32x32_8x32x1_8x32x1_1x32x1x8_8_1x1_intrawave_v1,104.4,411.0,0.0
80,288,16384,512,16,0,49.2719,a8w8_blockscale_1x128x128_256x64x64x128_16x16_32x32_8x32x1_8x32x1_1x32x1x8_8_1x1_intrawave_v1,98.06,364.78,0.0
80,320,16384,512,16,0,49.1681,a8w8_blockscale_1x128x128_256x64x64x128_16x16_32x32_8x32x1_8x32x1_1x32x1x8_8_1x1_intrawave_v1,109.19,387.21,0.0
80,352,16384,512,3,0,58.823,a8w8_blockscale_1x128x128_256x64x64x128_16x16_32x32_8x32x1_8x32x1_1x32x1x8_8_1x1_intrawave_v3,100.4,341.76,0.0
80,384,16384,512,16,0,57.628,a8w8_blockscale_1x128x128_256x64x64x128_16x16_32x32_8x32x1_8x32x1_1x32x1x8_8_1x1_intrawave_v1,111.79,367.32,0.0
80,416,16384,512,16,0,66.8409,a8w8_blockscale_1x128x128_256x64x64x128_16x16_32x32_8x32x1_8x32x1_1x32x1x8_8_1x1_intrawave_v1,104.42,332.63,0.0
80,448,16384,512,16,0,65.8249,a8w8_blockscale_1x128x128_256x64x64x128_16x16_32x32_8x32x1_8x32x1_1x32x1x8_8_1x1_intrawave_v1,114.18,353.94,0.0
80,480,16384,512,3,0,74.6182,a8w8_blockscale_1x128x128_256x64x64x128_16x16_32x32_8x32x1_8x32x1_1x32x1x8_8_1x1_intrawave_v3,107.92,326.5,0.0
80,512,16384,512,16,0,73.4953,a8w8_blockscale_1x128x128_256x64x64x128_16x16_32x32_8x32x1_8x32x1_1x32x1x8_8_1x1_intrawave_v1,116.88,345.98,0.0
80,1024,16384,512,16,0,136.7216,a8w8_blockscale_1x128x128_256x64x64x128_16x16_32x32_8x32x1_8x32x1_1x32x1x8_8_1x1_intrawave_v1,125.66,310.61,0.0
80,2048,16384,512,16,0,264.2616,a8w8_blockscale_1x128x128_256x64x64x128_16x16_32x32_8x32x1_8x32x1_1x32x1x8_8_1x1_intrawave_v1,130.02,289.66,0.0
80,4096,16384,512,16,0,516.6324,a8w8_blockscale_1x128x128_256x64x64x128_16x16_32x32_8x32x1_8x32x1_1x32x1x8_8_1x1_intrawave_v1,133.01,280.09,0.0
80,6144,16384,512,16,0,766.3397,a8w8_blockscale_1x128x128_256x64x64x128_16x16_32x32_8x32x1_8x32x1_1x32x1x8_8_1x1_intrawave_v1,134.51,277.76,0.0
80,8192,16384,512,16,0,1024.65,a8w8_blockscale_1x128x128_256x64x64x128_16x16_32x32_8x32x1_8x32x1_1x32x1x8_8_1x1_intrawave_v1,134.13,274.26,0.0
80,10240,16384,512,16,0,1268.427,a8w8_blockscale_1x128x128_256x64x64x128_16x16_32x32_8x32x1_8x32x1_1x32x1x8_8_1x1_intrawave_v1,135.44,275.28,0.0
80,12288,16384,512,16,0,1531.1406,a8w8_blockscale_1x128x128_256x64x64x128_16x16_32x32_8x32x1_8x32x1_1x32x1x8_8_1x1_intrawave_v1,134.64,272.56,0.0
80,14336,16384,512,16,0,1774.6095,a8w8_blockscale_1x128x128_256x64x64x128_16x16_32x32_8x32x1_8x32x1_1x32x1x8_8_1x1_intrawave_v1,135.53,273.58,0.0
80,16384,16384,512,16,0,2023.3026,a8w8_blockscale_1x128x128_256x64x64x128_16x16_32x32_8x32x1_8x32x1_1x32x1x8_8_1x1_intrawave_v1,135.86,273.64,0.0
80,32768,16384,512,16,0,4043.5011,a8w8_blockscale_1x128x128_256x64x64x128_16x16_32x32_8x32x1_8x32x1_1x32x1x8_8_1x1_intrawave_v1,135.96,271.77,0.0
80,65536,16384,512,16,0,8124.9253,a8w8_blockscale_1x128x128_256x64x64x128_16x16_32x32_8x32x1_8x32x1_1x32x1x8_8_1x1_intrawave_v1,135.33,269.47,0.0
80,98304,16384,512,16,0,12076.0202,a8w8_blockscale_1x128x128_256x64x64x128_16x16_32x32_8x32x1_8x32x1_1x32x1x8_8_1x1_intrawave_v1,136.57,271.61,0.0
80,65536,7168,9216,0,0,31220.6403,a8w8_blockscale_1x128x128_256x128x128x128_16x16_32x32_8x32x1_8x32x1_1x32x1x8_8_1x1_intrawave_v3,277.34,51.55,0.0
80,98304,7168,9216,0,0,46757.9752,a8w8_blockscale_1x128x128_256x128x128x128_16x16_32x32_8x32x1_8x32x1_1x32x1x8_8_1x1_intrawave_v3,277.77,50.93,0.0
80,131072,7168,9216,0,0,62471.1151,a8w8_blockscale_1x128x128_256x128x128x128_16x16_32x32_8x32x1_8x32x1_1x32x1x8_8_1x1_intrawave_v3,277.21,50.47,0.0
80,1,20480,1536,8,0,20.1747,a8w8_blockscale_1x128x128_256x16x64x256_16x16_16x16_16x16x1_16x16x1_1x16x1x16_4_1x1_intrawave_v1,3.12,1561.35,0.0
80,2,20480,1536,8,0,20.1423,a8w8_blockscale_1x128x128_256x16x64x256_16x16_16x16_16x16x1_16x16x1_1x16x1x16_4_1x1_intrawave_v1,6.25,1565.97,0.0
80,4,20480,1536,8,0,19.309,a8w8_blockscale_1x128x128_256x16x64x256_16x16_16x16_16x16x1_16x16x1_1x16x1x16_4_1x1_intrawave_v1,13.03,1637.95,0.0
80,8,20480,1536,8,0,19.199,a8w8_blockscale_1x128x128_256x16x64x256_16x16_16x16_16x16x1_16x16x1_1x16x1x16_4_1x1_intrawave_v1,26.22,1656.19,0.0
80,16,20480,1536,8,0,18.2803,a8w8_blockscale_1x128x128_256x16x64x256_16x16_16x16_16x16x1_16x16x1_1x16x1x16_4_1x1_intrawave_v1,55.07,1758.02,0.0
80,32,20480,1536,12,0,23.8728,a8w8_blockscale_1x128x128_256x32x128x256_16x16_32x32_16x16x1_16x16x1_1x32x1x8_8_1x1_intrawave_v1,84.33,1374.67,0.0
80,64,20480,1536,18,0,30.4482,a8w8_blockscale_1x128x128_256x64x64x256_16x16_32x32_16x16x1_16x16x1_1x32x1x8_8_1x1_intrawave_v1,132.24,1122.46,0.0
80,96,20480,1536,0,0,57.5182,a8w8_blockscale_1x128x128_256x128x128x128_16x16_32x32_8x32x1_8x32x1_1x32x1x8_8_1x1_intrawave_v3,105.01,617.84,0.0
80,128,20480,1536,0,0,49.9755,a8w8_blockscale_1x128x128_256x128x128x128_16x16_32x32_8x32x1_8x32x1_1x32x1x8_8_1x1_intrawave_v3,161.14,738.3,0.0
80,160,20480,1536,2,0,82.5071,a8w8_blockscale_1x128x128_256x64x128x128_16x16_32x32_8x32x1_8x32x1_1x32x1x8_8_1x1_intrawave_v3,122.01,463.68,0.0
80,192,20480,1536,2,0,83.3475,a8w8_blockscale_1x128x128_256x64x128x128_16x16_32x32_8x32x1_8x32x1_1x32x1x8_8_1x1_intrawave_v3,144.93,475.32,0.0
80,224,20480,1536,0,0,105.9979,a8w8_blockscale_1x128x128_256x128x128x128_16x16_32x32_8x32x1_8x32x1_1x32x1x8_8_1x1_intrawave_v3,132.95,386.58,0.0
80,256,20480,1536,0,0,88.3997,a8w8_blockscale_1x128x128_256x128x128x128_16x16_32x32_8x32x1_8x32x1_1x32x1x8_8_1x1_intrawave_v3,182.2,478.92,0.0
80,288,20480,1536,3,0,134.8979,a8w8_blockscale_1x128x128_256x64x64x128_16x16_32x32_8x32x1_8x32x1_1x32x1x8_8_1x1_intrawave_v3,134.32,323.92,0.0
80,320,20480,1536,18,0,138.6704,a8w8_blockscale_1x128x128_256x64x64x256_16x16_32x32_16x16x1_16x16x1_1x32x1x8_8_1x1_intrawave_v1,145.18,324.91,0.0
80,352,20480,1536,0,0,151.4946,a8w8_blockscale_1x128x128_256x128x128x128_16x16_32x32_8x32x1_8x32x1_1x32x1x8_8_1x1_intrawave_v3,146.18,306.39,0.0
80,384,20480,1536,0,0,125.7998,a8w8_blockscale_1x128x128_256x128x128x128_16x16_32x32_8x32x1_8x32x1_1x32x1x8_8_1x1_intrawave_v3,192.04,379.78,0.0
80,416,20480,1536,2,0,180.3595,a8w8_blockscale_1x128x128_256x64x128x128_16x16_32x32_8x32x1_8x32x1_1x32x1x8_8_1x1_intrawave_v3,145.11,272.43,0.0
80,448,20480,1536,2,0,180.6281,a8w8_blockscale_1x128x128_256x64x128x128_16x16_32x32_8x32x1_8x32x1_1x32x1x8_8_1x1_intrawave_v3,156.04,279.55,0.0
80,480,20480,1536,3,0,198.2776,a8w8_blockscale_1x128x128_256x64x64x128_16x16_32x32_8x32x1_8x32x1_1x32x1x8_8_1x1_intrawave_v3,152.31,261.53,0.0
80,512,20480,1536,0,0,163.3971,a8w8_blockscale_1x128x128_256x128x128x128_16x16_32x32_8x32x1_8x32x1_1x32x1x8_8_1x1_intrawave_v3,197.14,325.68,0.0
80,1024,20480,1536,0,0,315.3769,a8w8_blockscale_1x128x128_256x128x128x128_16x16_32x32_8x32x1_8x32x1_1x32x1x8_8_1x1_intrawave_v3,204.28,237.73,0.0
80,2048,20480,1536,0,0,614.628,a8w8_blockscale_1x128x128_256x128x128x128_16x16_32x32_8x32x1_8x32x1_1x32x1x8_8_1x1_intrawave_v3,209.64,192.78,0.0
80,4096,20480,1536,0,0,1207.8012,a8w8_blockscale_1x128x128_256x128x128x128_16x16_32x32_8x32x1_8x32x1_1x32x1x8_8_1x1_intrawave_v3,213.36,170.16,0.0
80,6144,20480,1536,0,0,1805.3502,a8w8_blockscale_1x128x128_256x128x128x128_16x16_32x32_8x32x1_8x32x1_1x32x1x8_8_1x1_intrawave_v3,214.11,162.05,0.0
80,8192,20480,1536,0,0,2410.7858,a8w8_blockscale_1x128x128_256x128x128x128_16x16_32x32_8x32x1_8x32x1_1x32x1x8_8_1x1_intrawave_v3,213.79,157.45,0.0
80,10240,20480,1536,0,0,3008.7113,a8w8_blockscale_1x128x128_256x128x128x128_16x16_32x32_8x32x1_8x32x1_1x32x1x8_8_1x1_intrawave_v3,214.13,155.09,0.0
80,12288,20480,1536,0,0,3606.7604,a8w8_blockscale_1x128x128_256x128x128x128_16x16_32x32_8x32x1_8x32x1_1x32x1x8_8_1x1_intrawave_v3,214.35,153.5,0.0
80,14336,20480,1536,0,0,4214.0307,a8w8_blockscale_1x128x128_256x128x128x128_16x16_32x32_8x32x1_8x32x1_1x32x1x8_8_1x1_intrawave_v3,214.03,152.03,0.0
80,16384,20480,1536,0,0,4804.6683,a8w8_blockscale_1x128x128_256x128x128x128_16x16_32x32_8x32x1_8x32x1_1x32x1x8_8_1x1_intrawave_v3,214.54,151.46,0.0
80,32768,20480,1536,0,0,9596.4512,a8w8_blockscale_1x128x128_256x128x128x128_16x16_32x32_8x32x1_8x32x1_1x32x1x8_8_1x1_intrawave_v3,214.83,148.38,0.0
80,65536,20480,1536,0,0,19267.1382,a8w8_blockscale_1x128x128_256x128x128x128_16x16_32x32_8x32x1_8x32x1_1x32x1x8_8_1x1_intrawave_v3,214.0,146.18,0.0
80,98304,20480,1536,0,0,28755.7419,a8w8_blockscale_1x128x128_256x128x128x128_16x16_32x32_8x32x1_8x32x1_1x32x1x8_8_1x1_intrawave_v3,215.08,146.37,0.0
80,16384,6144,1536,0,0,1452.0128,a8w8_blockscale_1x128x128_256x128x128x128_16x16_32x32_8x32x1_8x32x1_1x32x1x8_8_1x1_intrawave_v3,212.97,162.48,0.0
80,32768,6144,1536,0,0,2896.8999,a8w8_blockscale_1x128x128_256x128x128x128_16x16_32x32_8x32x1_8x32x1_1x32x1x8_8_1x1_intrawave_v3,213.5,159.63,0.0
80,65536,6144,1536,0,0,5779.8447,a8w8_blockscale_1x128x128_256x128x128x128_16x16_32x32_8x32x1_8x32x1_1x32x1x8_8_1x1_intrawave_v3,214.01,158.38,0.0
80,98304,6144,1536,0,0,8634.7843,a8w8_blockscale_1x128x128_256x128x128x128_16x16_32x32_8x32x1_8x32x1_1x32x1x8_8_1x1_intrawave_v3,214.88,158.47,0.0
80,131072,6144,1536,0,0,11507.6078,a8w8_blockscale_1x128x128_256x128x128x128_16x16_32x32_8x32x1_8x32x1_1x32x1x8_8_1x1_intrawave_v3,214.98,158.28,0.0
80,1,8192,512,8,0,6.2308,a8w8_blockscale_1x128x128_256x16x64x256_16x16_16x16_16x16x1_16x16x1_1x16x1x16_4_1x1_intrawave_v1,1.35,675.87,0.0
80,2,8192,512,8,0,6.2465,a8w8_blockscale_1x128x128_256x16x64x256_16x16_16x16_16x16x1_16x16x1_1x16x1x16_4_1x1_intrawave_v1,2.69,676.87,0.0
80,4,8192,512,8,0,6.2187,a8w8_blockscale_1x128x128_256x16x64x256_16x16_16x16_16x16x1_16x16x1_1x16x1x16_4_1x1_intrawave_v1,5.4,685.33,0.0
80,8,8192,512,8,0,6.2639,a8w8_blockscale_1x128x128_256x16x64x256_16x16_16x16_16x16x1_16x16x1_1x16x1x16_4_1x1_intrawave_v1,10.71,691.18,0.0
80,16,8192,512,8,0,6.3003,a8w8_blockscale_1x128x128_256x16x64x256_16x16_16x16_16x16x1_16x16x1_1x16x1x16_4_1x1_intrawave_v1,21.3,708.64,0.0
80,32,8192,512,13,0,7.4619,a8w8_blockscale_1x128x128_256x32x64x256_16x16_16x16_16x16x1_16x16x1_1x32x1x8_8_2x1_intrawave_v1,35.97,634.55,0.0
80,64,8192,512,18,0,10.2556,a8w8_blockscale_1x128x128_256x64x64x256_16x16_32x32_16x16x1_16x16x1_1x32x1x8_8_1x1_intrawave_v1,52.35,514.42,0.0
80,96,8192,512,13,0,14.8089,a8w8_blockscale_1x128x128_256x32x64x256_16x16_16x16_16x16x1_16x16x1_1x32x1x8_8_2x1_intrawave_v1,54.38,392.76,0.0
80,128,8192,512,18,0,15.829,a8w8_blockscale_1x128x128_256x64x64x256_16x16_32x32_16x16x1_16x16x1_1x32x1x8_8_1x1_intrawave_v1,67.83,401.6,0.0
80,160,8192,512,10,0,19.3165,a8w8_blockscale_1x128x128_256x32x128x128_16x16_32x32_8x32x1_8x32x1_1x32x1x8_8_1x1_intrawave_v1,69.48,357.09,0.0
80,192,8192,512,16,0,19.2089,a8w8_blockscale_1x128x128_256x64x64x128_16x16_32x32_8x32x1_8x32x1_1x32x1x8_8_1x1_intrawave_v1,83.85,387.23,0.0
80,224,8192,512,16,0,24.4936,a8w8_blockscale_1x128x128_256x64x64x128_16x16_32x32_8x32x1_8x32x1_1x32x1x8_8_1x1_intrawave_v1,76.72,325.76,0.0
80,256,8192,512,16,0,24.5284,a8w8_blockscale_1x128x128_256x64x64x128_16x16_32x32_8x32x1_8x32x1_1x32x1x8_8_1x1_intrawave_v1,87.55,347.34,0.0
80,288,8192,512,16,0,27.9683,a8w8_blockscale_1x128x128_256x64x64x128_16x16_32x32_8x32x1_8x32x1_1x32x1x8_8_1x1_intrawave_v1,86.38,323.95,0.0
80,320,8192,512,16,0,27.5201,a8w8_blockscale_1x128x128_256x64x64x128_16x16_32x32_8x32x1_8x32x1_1x32x1x8_8_1x1_intrawave_v1,97.54,348.87,0.0
80,352,8192,512,16,0,32.6549,a8w8_blockscale_1x128x128_256x64x64x128_16x16_32x32_8x32x1_8x32x1_1x32x1x8_8_1x1_intrawave_v1,90.42,310.57,0.0
80,384,8192,512,16,0,32.1154,a8w8_blockscale_1x128x128_256x64x64x128_16x16_32x32_8x32x1_8x32x1_1x32x1x8_8_1x1_intrawave_v1,100.3,332.62,0.0
80,416,8192,512,16,0,37.5396,a8w8_blockscale_1x128x128_256x64x64x128_16x16_32x32_8x32x1_8x32x1_1x32x1x8_8_1x1_intrawave_v1,92.96,298.97,0.0
80,448,8192,512,16,0,36.7925,a8w8_blockscale_1x128x128_256x64x64x128_16x16_32x32_8x32x1_8x32x1_1x32x1x8_8_1x1_intrawave_v1,102.14,319.73,0.0
80,480,8192,512,16,0,40.5111,a8w8_blockscale_1x128x128_256x64x64x128_16x16_32x32_8x32x1_8x32x1_1x32x1x8_8_1x1_intrawave_v1,99.39,303.73,0.0
80,512,8192,512,16,0,39.9398,a8w8_blockscale_1x128x128_256x64x64x128_16x16_32x32_8x32x1_8x32x1_1x32x1x8_8_1x1_intrawave_v1,107.54,321.61,0.0
80,1024,8192,512,16,0,72.2048,a8w8_blockscale_1x128x128_256x64x64x128_16x16_32x32_8x32x1_8x32x1_1x32x1x8_8_1x1_intrawave_v1,118.97,297.71,0.0
80,2048,8192,512,16,0,136.2515,a8w8_blockscale_1x128x128_256x64x64x128_16x16_32x32_8x32x1_8x32x1_1x32x1x8_8_1x1_intrawave_v1,126.09,284.75,0.0
80,4096,8192,512,16,0,262.2728,a8w8_blockscale_1x128x128_256x64x64x128_16x16_32x32_8x32x1_8x32x1_1x32x1x8_8_1x1_intrawave_v1,131.01,279.86,0.0
80,6144,8192,512,16,0,388.5594,a8w8_blockscale_1x128x128_256x64x64x128_16x16_32x32_8x32x1_8x32x1_1x32x1x8_8_1x1_intrawave_v1,132.64,277.96,0.0
80,8192,8192,512,16,0,515.0694,a8w8_blockscale_1x128x128_256x64x64x128_16x16_32x32_8x32x1_8x32x1_1x32x1x8_8_1x1_intrawave_v1,133.42,276.87,0.0
80,10240,8192,512,16,0,641.0942,a8w8_blockscale_1x128x128_256x64x64x128_16x16_32x32_8x32x1_8x32x1_1x32x1x8_8_1x1_intrawave_v1,133.99,276.42,0.0
80,12288,8192,512,16,0,765.8929,a8w8_blockscale_1x128x128_256x64x64x128_16x16_32x32_8x32x1_8x32x1_1x32x1x8_8_1x1_intrawave_v1,134.59,276.56,0.0
80,14336,8192,512,16,0,892.044,a8w8_blockscale_1x128x128_256x64x64x128_16x16_32x32_8x32x1_8x32x1_1x32x1x8_8_1x1_intrawave_v1,134.81,276.24,0.0
80,16384,8192,512,16,0,1019.4853,a8w8_blockscale_1x128x128_256x64x64x128_16x16_32x32_8x32x1_8x32x1_1x32x1x8_8_1x1_intrawave_v1,134.81,275.65,0.0
80,32768,8192,512,16,0,2024.5447,a8w8_blockscale_1x128x128_256x64x64x128_16x16_32x32_8x32x1_8x32x1_1x32x1x8_8_1x1_intrawave_v1,135.77,275.54,0.0
80,65536,8192,512,16,0,4043.6218,a8w8_blockscale_1x128x128_256x64x64x128_16x16_32x32_8x32x1_8x32x1_1x32x1x8_8_1x1_intrawave_v1,135.96,274.88,0.0
80,98304,8192,512,16,0,6057.9405,a8w8_blockscale_1x128x128_256x64x64x128_16x16_32x32_8x32x1_8x32x1_1x32x1x8_8_1x1_intrawave_v1,136.12,274.87,0.0
80,131072,8192,512,16,0,8069.2123,a8w8_blockscale_1x128x128_256x64x64x128_16x16_32x32_8x32x1_8x32x1_1x32x1x8_8_1x1_intrawave_v1,136.26,274.97,0.0
80,1,7168,4096,8,0,23.698,a8w8_blockscale_1x128x128_256x16x64x256_16x16_16x16_16x16x1_16x16x1_1x16x1x16_4_1x1_intrawave_v1,2.48,1239.71,0.0
80,2,7168,4096,8,0,23.768,a8w8_blockscale_1x128x128_256x16x64x256_16x16_16x16_16x16x1_16x16x1_1x16x1x16_4_1x1_intrawave_v1,4.94,1236.83,0.0
80,4,7168,4096,8,0,24.1016,a8w8_blockscale_1x128x128_256x16x64x256_16x16_16x16_16x16x1_16x16x1_1x16x1x16_4_1x1_intrawave_v1,9.75,1221.24,0.0
80,8,7168,4096,8,0,24.6514,a8w8_blockscale_1x128x128_256x16x64x256_16x16_16x16_16x16x1_16x16x1_1x16x1x16_4_1x1_intrawave_v1,19.06,1196.99,0.0
80,16,7168,4096,8,0,23.8355,a8w8_blockscale_1x128x128_256x16x64x256_16x16_16x16_16x16x1_16x16x1_1x16x1x16_4_1x1_intrawave_v1,39.42,1244.15,0.0
80,32,7168,4096,12,0,26.3802,a8w8_blockscale_1x128x128_256x32x128x256_16x16_32x32_16x16x1_16x16x1_1x32x1x8_8_1x1_intrawave_v1,71.23,1135.32,0.0
80,64,7168,4096,18,0,35.7808,a8w8_blockscale_1x128x128_256x64x64x256_16x16_32x32_16x16x1_16x16x1_1x32x1x8_8_1x1_intrawave_v1,105.03,853.52,0.0
80,96,7168,4096,18,0,53.5294,a8w8_blockscale_1x128x128_256x64x64x256_16x16_32x32_16x16x1_16x16x1_1x32x1x8_8_1x1_intrawave_v1,105.31,581.54,0.0
80,128,7168,4096,18,0,50.9601,a8w8_blockscale_1x128x128_256x64x64x256_16x16_32x32_16x16x1_16x16x1_1x32x1x8_8_1x1_intrawave_v1,147.49,622.44,0.0
80,160,7168,4096,18,0,82.4385,a8w8_blockscale_1x128x128_256x64x64x256_16x16_32x32_16x16x1_16x16x1_1x32x1x8_8_1x1_intrawave_v1,113.97,391.92,0.0
80,192,7168,4096,18,0,78.3058,a8w8_blockscale_1x128x128_256x64x64x256_16x16_32x32_16x16x1_16x16x1_1x32x1x8_8_1x1_intrawave_v1,143.98,420.14,0.0
80,224,7168,4096,18,0,96.502,a8w8_blockscale_1x128x128_256x64x64x256_16x16_32x32_16x16x1_16x16x1_1x32x1x8_8_1x1_intrawave_v1,136.3,347.03,0.0
80,256,7168,4096,18,0,91.1961,a8w8_blockscale_1x128x128_256x64x64x256_16x16_32x32_16x16x1_16x16x1_1x32x1x8_8_1x1_intrawave_v1,164.84,373.69,0.0
80,288,7168,4096,18,0,114.7325,a8w8_blockscale_1x128x128_256x64x64x256_16x16_32x32_16x16x1_16x16x1_1x32x1x8_8_1x1_intrawave_v1,147.4,302.17,0.0
80,320,7168,4096,18,0,109.3499,a8w8_blockscale_1x128x128_256x64x64x256_16x16_32x32_16x16x1_16x16x1_1x32x1x8_8_1x1_intrawave_v1,171.84,322.44,0.0
80,352,7168,4096,18,0,143.0167,a8w8_blockscale_1x128x128_256x64x64x256_16x16_32x32_16x16x1_16x16x1_1x32x1x8_8_1x1_intrawave_v1,144.53,250.66,0.0
80,384,7168,4096,18,0,134.5173,a8w8_blockscale_1x128x128_256x64x64x256_16x16_32x32_16x16x1_16x16x1_1x32x1x8_8_1x1_intrawave_v1,167.63,270.88,0.0
80,416,7168,4096,2,0,157.252,a8w8_blockscale_1x128x128_256x64x128x128_16x16_32x32_8x32x1_8x32x1_1x32x1x8_8_1x1_intrawave_v3,155.34,235.47,0.0
80,448,7168,4096,18,0,147.8812,a8w8_blockscale_1x128x128_256x64x64x256_16x16_32x32_16x16x1_16x16x1_1x32x1x8_8_1x1_intrawave_v1,177.89,254.38,0.0
80,480,7168,4096,2,0,176.8323,a8w8_blockscale_1x128x128_256x64x128x128_16x16_32x32_8x32x1_8x32x1_1x32x1x8_8_1x1_intrawave_v3,159.39,216.07,0.0
80,512,7168,4096,0,0,148.947,a8w8_blockscale_1x128x128_256x128x128x128_16x16_32x32_8x32x1_8x32x1_1x32x1x8_8_1x1_intrawave_v3,201.85,260.48,0.0
80,1024,7168,4096,0,0,273.3106,a8w8_blockscale_1x128x128_256x128x128x128_16x16_32x32_8x32x1_8x32x1_1x32x1x8_8_1x1_intrawave_v3,220.0,176.48,0.0
80,2048,7168,4096,0,0,522.9649,a8w8_blockscale_1x128x128_256x128x128x128_16x16_32x32_8x32x1_8x32x1_1x32x1x8_8_1x1_intrawave_v3,229.96,128.32,0.0
80,4096,7168,4096,0,0,996.4217,a8w8_blockscale_1x128x128_256x128x128x128_16x16_32x32_8x32x1_8x32x1_1x32x1x8_8_1x1_intrawave_v3,241.38,105.23,0.0
80,6144,7168,4096,0,0,1467.0707,a8w8_blockscale_1x128x128_256x128x128x128_16x16_32x32_8x32x1_8x32x1_1x32x1x8_8_1x1_intrawave_v3,245.92,97.2,0.0
80,8192,7168,4096,0,0,1938.9561,a8w8_blockscale_1x128x128_256x128x128x128_16x16_32x32_8x32x1_8x32x1_1x32x1x8_8_1x1_intrawave_v3,248.09,93.02,0.0
80,10240,7168,4096,0,0,2404.7023,a8w8_blockscale_1x128x128_256x128x128x128_16x16_32x32_8x32x1_8x32x1_1x32x1x8_8_1x1_intrawave_v3,250.05,90.7,0.0
80,12288,7168,4096,0,0,2905.2222,a8w8_blockscale_1x128x128_256x128x128x128_16x16_32x32_8x32x1_8x32x1_1x32x1x8_8_1x1_intrawave_v3,248.36,88.07,0.0
80,14336,7168,4096,0,0,3370.1295,a8w8_blockscale_1x128x128_256x128x128x128_16x16_32x32_8x32x1_8x32x1_1x32x1x8_8_1x1_intrawave_v3,249.79,87.12,0.0
80,16384,7168,4096,0,0,3866.6496,a8w8_blockscale_1x128x128_256x128x128x128_16x16_32x32_8x32x1_8x32x1_1x32x1x8_8_1x1_intrawave_v3,248.81,85.69,0.0
80,32768,7168,4096,0,0,7721.0201,a8w8_blockscale_1x128x128_256x128x128x128_16x16_32x32_8x32x1_8x32x1_1x32x1x8_8_1x1_intrawave_v3,249.21,82.03,0.0
80,65536,7168,4096,0,0,15298.138,a8w8_blockscale_1x128x128_256x128x128x128_16x16_32x32_8x32x1_8x32x1_1x32x1x8_8_1x1_intrawave_v3,251.55,80.88,0.0
80,98304,7168,4096,0,0,22943.7411,a8w8_blockscale_1x128x128_256x128x128x128_16x16_32x32_8x32x1_8x32x1_1x32x1x8_8_1x1_intrawave_v3,251.59,80.25,0.0
80,131072,7168,4096,0,0,30759.419,a8w8_blockscale_1x128x128_256x128x128x128_16x16_32x32_8x32x1_8x32x1_1x32x1x8_8_1x1_intrawave_v3,250.22,79.5,0.0
80,1,9216,7168,8,0,38.2341,a8w8_blockscale_1x128x128_256x16x64x256_16x16_16x16_16x16x1_16x16x1_1x16x1x16_4_1x1_intrawave_v1,3.46,1728.45,0.0
80,2,9216,7168,8,0,38.1143,a8w8_blockscale_1x128x128_256x16x64x256_16x16_16x16_16x16x1_16x16x1_1x16x1x16_4_1x1_intrawave_v1,6.93,1734.56,0.0
80,4,9216,7168,8,0,37.7854,a8w8_blockscale_1x128x128_256x16x64x256_16x16_16x16_16x16x1_16x16x1_1x16x1x16_4_1x1_intrawave_v1,13.99,1751.01,0.0
80,8,9216,7168,8,0,37.8704,a8w8_blockscale_1x128x128_256x16x64x256_16x16_16x16_16x16x1_16x16x1_1x16x1x16_4_1x1_intrawave_v1,27.91,1749.79,0.0
80,16,9216,7168,7,0,35.2313,a8w8_blockscale_1x128x128_256x16x128x256_16x16_16x16_16x16x1_16x16x1_1x16x1x16_8_1x2_intrawave_v1,60.0,1886.67,0.0
80,32,9216,7168,12,0,38.0015,a8w8_blockscale_1x128x128_256x32x128x256_16x16_32x32_16x16x1_16x16x1_1x32x1x8_8_1x1_intrawave_v1,111.26,1759.92,0.0
80,64,9216,7168,18,0,55.4595,a8w8_blockscale_1x128x128_256x64x64x256_16x16_32x32_16x16x1_16x16x1_1x32x1x8_8_1x1_intrawave_v1,152.47,1220.69,0.0
80,96,9216,7168,12,0,104.7498,a8w8_blockscale_1x128x128_256x32x128x256_16x16_32x32_16x16x1_16x16x1_1x32x1x8_8_1x1_intrawave_v1,121.08,654.11,0.0
80,128,9216,7168,18,0,98.5164,a8w8_blockscale_1x128x128_256x64x64x256_16x16_32x32_16x16x1_16x16x1_1x32x1x8_8_1x1_intrawave_v1,171.66,703.81,0.0
80,160,9216,7168,18,0,156.2348,a8w8_blockscale_1x128x128_256x64x64x256_16x16_32x32_16x16x1_16x16x1_1x32x1x8_8_1x1_intrawave_v1,135.3,449.04,0.0
80,192,9216,7168,18,0,143.0928,a8w8_blockscale_1x128x128_256x64x64x256_16x16_32x32_16x16x1_16x16x1_1x32x1x8_8_1x1_intrawave_v1,177.28,496.01,0.0
80,224,9216,7168,2,0,200.3918,a8w8_blockscale_1x128x128_256x64x128x128_16x16_32x32_8x32x1_8x32x1_1x32x1x8_8_1x1_intrawave_v3,147.69,358.27,0.0
80,256,9216,7168,0,0,160.0672,a8w8_blockscale_1x128x128_256x128x128x128_16x16_32x32_8x32x1_8x32x1_1x32x1x8_8_1x1_intrawave_v3,211.3,453.65,0.0
80,288,9216,7168,18,0,237.3836,a8w8_blockscale_1x128x128_256x64x64x256_16x16_32x32_16x16x1_16x16x1_1x32x1x8_8_1x1_intrawave_v1,160.29,309.34,0.0
80,320,9216,7168,18,0,222.3656,a8w8_blockscale_1x128x128_256x64x64x256_16x16_32x32_16x16x1_16x16x1_1x32x1x8_8_1x1_intrawave_v1,190.13,333.92,0.0
80,352,9216,7168,18,0,284.3507,a8w8_blockscale_1x128x128_256x64x64x256_16x16_32x32_16x16x1_16x16x1_1x32x1x8_8_1x1_intrawave_v1,163.55,264.01,0.0
80,384,9216,7168,0,0,240.777,a8w8_blockscale_1x128x128_256x128x128x128_16x16_32x32_8x32x1_8x32x1_1x32x1x8_8_1x1_intrawave_v3,210.71,315.19,0.0
80,416,9216,7168,18,0,335.1017,a8w8_blockscale_1x128x128_256x64x64x256_16x16_32x32_16x16x1_16x16x1_1x32x1x8_8_1x1_intrawave_v1,164.02,228.92,0.0
80,448,9216,7168,18,0,307.4923,a8w8_blockscale_1x128x128_256x64x64x256_16x16_32x32_16x16x1_16x16x1_1x32x1x8_8_1x1_intrawave_v1,192.49,252.13,0.0
80,480,9216,7168,2,0,384.7345,a8w8_blockscale_1x128x128_256x64x128x128_16x16_32x32_8x32x1_8x32x1_1x32x1x8_8_1x1_intrawave_v3,164.84,203.64,0.0
80,512,9216,7168,0,0,303.453,a8w8_blockscale_1x128x128_256x128x128x128_16x16_32x32_8x32x1_8x32x1_1x32x1x8_8_1x1_intrawave_v3,222.92,260.89,0.0
80,1024,9216,7168,0,0,569.5857,a8w8_blockscale_1x128x128_256x128x128x128_16x16_32x32_8x32x1_8x32x1_1x32x1x8_8_1x1_intrawave_v3,237.53,162.0,0.0
80,2048,9216,7168,0,0,1055.1056,a8w8_blockscale_1x128x128_256x128x128x128_16x16_32x32_8x32x1_8x32x1_1x32x1x8_8_1x1_intrawave_v3,256.45,112.3,0.0
80,4096,9216,7168,0,0,2001.3436,a8w8_blockscale_1x128x128_256x128x128x128_16x16_32x32_8x32x1_8x32x1_1x32x1x8_8_1x1_intrawave_v3,270.4,85.4,0.0
80,6144,9216,7168,0,0,3008.618,a8w8_blockscale_1x128x128_256x128x128x128_16x16_32x32_8x32x1_8x32x1_1x32x1x8_8_1x1_intrawave_v3,269.81,74.24,0.0
80,8192,9216,7168,0,0,3981.6222,a8w8_blockscale_1x128x128_256x128x128x128_16x16_32x32_8x32x1_8x32x1_1x32x1x8_8_1x1_intrawave_v3,271.83,69.26,0.0
80,10240,9216,7168,0,0,4952.5692,a8w8_blockscale_1x128x128_256x128x128x128_16x16_32x32_8x32x1_8x32x1_1x32x1x8_8_1x1_intrawave_v3,273.17,66.27,0.0
80,12288,9216,7168,0,0,5923.0667,a8w8_blockscale_1x128x128_256x128x128x128_16x16_32x32_8x32x1_8x32x1_1x32x1x8_8_1x1_intrawave_v3,274.1,64.26,0.0
80,14336,9216,7168,0,0,6940.2617,a8w8_blockscale_1x128x128_256x128x128x128_16x16_32x32_8x32x1_8x32x1_1x32x1x8_8_1x1_intrawave_v3,272.91,62.4,0.0
80,16384,9216,7168,0,0,7893.9297,a8w8_blockscale_1x128x128_256x128x128x128_16x16_32x32_8x32x1_8x32x1_1x32x1x8_8_1x1_intrawave_v3,274.22,61.5,0.0
80,32768,9216,7168,0,0,15727.5192,a8w8_blockscale_1x128x128_256x128x128x128_16x16_32x32_8x32x1_8x32x1_1x32x1x8_8_1x1_intrawave_v3,275.27,57.54,0.0
80,65536,9216,7168,0,0,31347.8623,a8w8_blockscale_1x128x128_256x128x128x128_16x16_32x32_8x32x1_8x32x1_1x32x1x8_8_1x1_intrawave_v3,276.21,55.63,0.0
80,98304,9216,7168,0,0,47024.1315,a8w8_blockscale_1x128x128_256x128x128x128_16x16_32x32_8x32x1_8x32x1_1x32x1x8_8_1x1_intrawave_v3,276.2,54.92,0.0
80,131072,9216,7168,0,0,62683.9394,a8w8_blockscale_1x128x128_256x128x128x128_16x16_32x32_8x32x1_8x32x1_1x32x1x8_8_1x1_intrawave_v3,276.26,54.58,0.0
80,1,7168,4608,8,0,25.235,a8w8_blockscale_1x128x128_256x16x64x256_16x16_16x16_16x16x1_16x16x1_1x16x1x16_4_1x1_intrawave_v1,2.62,1309.65,0.0
80,2,7168,4608,8,0,25.2478,a8w8_blockscale_1x128x128_256x16x64x256_16x16_16x16_16x16x1_16x16x1_1x16x1x16_4_1x1_intrawave_v1,5.23,1309.74,0.0
80,4,7168,4608,8,0,25.5885,a8w8_blockscale_1x128x128_256x16x64x256_16x16_16x16_16x16x1_16x16x1_1x16x1x16_4_1x1_intrawave_v1,10.33,1293.78,0.0
80,8,7168,4608,8,0,25.6197,a8w8_blockscale_1x128x128_256x16x64x256_16x16_16x16_16x16x1_16x16x1_1x16x1x16_4_1x1_intrawave_v1,20.63,1295.16,0.0
80,16,7168,4608,8,0,22.9228,a8w8_blockscale_1x128x128_256x16x64x256_16x16_16x16_16x16x1_16x16x1_1x16x1x16_4_1x1_intrawave_v1,46.11,1454.15,0.0
80,32,7168,4608,12,0,26.3416,a8w8_blockscale_1x128x128_256x32x128x256_16x16_32x32_16x16x1_16x16x1_1x32x1x8_8_1x1_intrawave_v1,80.25,1276.93,0.0
80,64,7168,4608,18,0,37.0046,a8w8_blockscale_1x128x128_256x64x64x256_16x16_32x32_16x16x1_16x16x1_1x32x1x8_8_1x1_intrawave_v1,114.25,925.36,0.0
80,96,7168,4608,18,0,58.662,a8w8_blockscale_1x128x128_256x64x64x256_16x16_32x32_16x16x1_16x16x1_1x32x1x8_8_1x1_intrawave_v1,108.11,594.06,0.0
80,128,7168,4608,18,0,54.7053,a8w8_blockscale_1x128x128_256x64x64x256_16x16_32x32_16x16x1_16x16x1_1x32x1x8_8_1x1_intrawave_v1,154.57,648.11,0.0
80,160,7168,4608,18,0,90.4231,a8w8_blockscale_1x128x128_256x64x64x256_16x16_32x32_16x16x1_16x16x1_1x32x1x8_8_1x1_intrawave_v1,116.89,398.8,0.0
80,192,7168,4608,18,0,83.6925,a8w8_blockscale_1x128x128_256x64x64x256_16x16_32x32_16x16x1_16x16x1_1x32x1x8_8_1x1_intrawave_v1,151.55,438.12,0.0
80,224,7168,4608,18,0,106.6608,a8w8_blockscale_1x128x128_256x64x64x256_16x16_32x32_16x16x1_16x16x1_1x32x1x8_8_1x1_intrawave_v1,138.73,349.46,0.0
80,256,7168,4608,18,0,97.5185,a8w8_blockscale_1x128x128_256x64x64x256_16x16_32x32_16x16x1_16x16x1_1x32x1x8_8_1x1_intrawave_v1,173.42,388.44,0.0
80,288,7168,4608,18,0,125.2875,a8w8_blockscale_1x128x128_256x64x64x256_16x16_32x32_16x16x1_16x16x1_1x32x1x8_8_1x1_intrawave_v1,151.85,307.18,0.0
80,320,7168,4608,18,0,116.9678,a8w8_blockscale_1x128x128_256x64x64x256_16x16_32x32_16x16x1_16x16x1_1x32x1x8_8_1x1_intrawave_v1,180.73,334.21,0.0
80,352,7168,4608,18,0,158.3101,a8w8_blockscale_1x128x128_256x64x64x256_16x16_32x32_16x16x1_16x16x1_1x32x1x8_8_1x1_intrawave_v1,146.88,250.76,0.0
80,384,7168,4608,18,0,144.7769,a8w8_blockscale_1x128x128_256x64x64x256_16x16_32x32_16x16x1_16x16x1_1x32x1x8_8_1x1_intrawave_v1,175.22,278.39,0.0
80,416,7168,4608,2,0,170.1933,a8w8_blockscale_1x128x128_256x64x128x128_16x16_32x32_8x32x1_8x32x1_1x32x1x8_8_1x1_intrawave_v3,161.47,240.38,0.0
80,448,7168,4608,18,0,159.9989,a8w8_blockscale_1x128x128_256x64x64x256_16x16_32x32_16x16x1_16x16x1_1x32x1x8_8_1x1_intrawave_v1,184.97,259.48,0.0
80,480,7168,4608,2,0,192.9885,a8w8_blockscale_1x128x128_256x64x128x128_16x16_32x32_8x32x1_8x32x1_1x32x1x8_8_1x1_intrawave_v3,164.3,218.27,0.0
80,512,7168,4608,0,0,156.0535,a8w8_blockscale_1x128x128_256x128x128x128_16x16_32x32_8x32x1_8x32x1_1x32x1x8_8_1x1_intrawave_v3,216.74,273.81,0.0
80,1024,7168,4608,0,0,284.1532,a8w8_blockscale_1x128x128_256x128x128x128_16x16_32x32_8x32x1_8x32x1_1x32x1x8_8_1x1_intrawave_v3,238.06,184.51,0.0
80,2048,7168,4608,0,0,544.4404,a8w8_blockscale_1x128x128_256x128x128x128_16x16_32x32_8x32x1_8x32x1_1x32x1x8_8_1x1_intrawave_v3,248.5,131.93,0.0
80,4096,7168,4608,0,0,1038.9684,a8w8_blockscale_1x128x128_256x128x128x128_16x16_32x32_8x32x1_8x32x1_1x32x1x8_8_1x1_intrawave_v3,260.43,106.48,0.0
80,6144,7168,4608,0,0,1531.8326,a8w8_blockscale_1x128x128_256x128x128x128_16x16_32x32_8x32x1_8x32x1_1x32x1x8_8_1x1_intrawave_v3,264.96,97.54,0.0
80,8192,7168,4608,0,0,2021.682,a8w8_blockscale_1x128x128_256x128x128x128_16x16_32x32_8x32x1_8x32x1_1x32x1x8_8_1x1_intrawave_v3,267.68,93.1,0.0
80,10240,7168,4608,0,0,2506.8762,a8w8_blockscale_1x128x128_256x128x128x128_16x16_32x32_8x32x1_8x32x1_1x32x1x8_8_1x1_intrawave_v3,269.84,90.56,0.0
80,12288,7168,4608,0,0,3045.7196,a8w8_blockscale_1x128x128_256x128x128x128_16x16_32x32_8x32x1_8x32x1_1x32x1x8_8_1x1_intrawave_v3,266.52,87.27,0.0
80,14336,7168,4608,0,0,3540.3882,a8w8_blockscale_1x128x128_256x128x128x128_16x16_32x32_8x32x1_8x32x1_1x32x1x8_8_1x1_intrawave_v3,267.5,86.04,0.0
80,16384,7168,4608,0,0,4051.8584,a8w8_blockscale_1x128x128_256x128x128x128_16x16_32x32_8x32x1_8x32x1_1x32x1x8_8_1x1_intrawave_v3,267.12,84.75,0.0
80,32768,7168,4608,0,0,8080.2071,a8w8_blockscale_1x128x128_256x128x128x128_16x16_32x32_8x32x1_8x32x1_1x32x1x8_8_1x1_intrawave_v3,267.9,80.91,0.0
80,65536,7168,4608,0,0,16083.0586,a8w8_blockscale_1x128x128_256x128x128x128_16x16_32x32_8x32x1_8x32x1_1x32x1x8_8_1x1_intrawave_v3,269.19,79.25,0.0
80,98304,7168,4608,0,0,24025.1598,a8w8_blockscale_1x128x128_256x128x128x128_16x16_32x32_8x32x1_8x32x1_1x32x1x8_8_1x1_intrawave_v3,270.3,78.89,0.0
80,131072,7168,4608,0,0,31967.0145,a8w8_blockscale_1x128x128_256x128x128x128_16x16_32x32_8x32x1_8x32x1_1x32x1x8_8_1x1_intrawave_v3,270.86,78.71,0.0
80,1,14336,1536,8,0,14.7519,a8w8_blockscale_1x128x128_256x16x64x256_16x16_16x16_16x16x1_16x16x1_1x16x1x16_4_1x1_intrawave_v1,2.99,1494.74,0.0
80,2,14336,1536,8,0,13.9482,a8w8_blockscale_1x128x128_256x16x64x256_16x16_16x16_16x16x1_16x16x1_1x16x1x16_4_1x1_intrawave_v1,6.31,1583.04,0.0
80,4,14336,1536,8,0,14.0724,a8w8_blockscale_1x128x128_256x16x64x256_16x16_16x16_16x16x1_16x16x1_1x16x1x16_4_1x1_intrawave_v1,12.52,1573.36,0.0
80,8,14336,1536,8,0,14.9217,a8w8_blockscale_1x128x128_256x16x64x256_16x16_16x16_16x16x1_16x16x1_1x16x1x16_4_1x1_intrawave_v1,23.61,1491.91,0.0
80,16,14336,1536,8,0,13.7308,a8w8_blockscale_1x128x128_256x16x64x256_16x16_16x16_16x16x1_16x16x1_1x16x1x16_4_1x1_intrawave_v1,51.32,1638.9,0.0
80,32,14336,1536,13,0,20.6799,a8w8_blockscale_1x128x128_256x32x64x256_16x16_16x16_16x16x1_16x16x1_1x32x1x8_8_2x1_intrawave_v1,68.15,1111.55,0.0
80,64,14336,1536,18,0,23.603,a8w8_blockscale_1x128x128_256x64x64x256_16x16_32x32_16x16x1_16x16x1_1x32x1x8_8_1x1_intrawave_v1,119.42,1014.85,0.0
80,96,14336,1536,2,0,44.7292,a8w8_blockscale_1x128x128_256x64x128x128_16x16_32x32_8x32x1_8x32x1_1x32x1x8_8_1x1_intrawave_v3,94.52,557.13,0.0
80,128,14336,1536,18,0,42.9005,a8w8_blockscale_1x128x128_256x64x64x256_16x16_32x32_16x16x1_16x16x1_1x32x1x8_8_1x1_intrawave_v1,131.4,603.41,0.0
80,160,14336,1536,3,0,63.0602,a8w8_blockscale_1x128x128_256x64x64x128_16x16_32x32_8x32x1_8x32x1_1x32x1x8_8_1x1_intrawave_v3,111.74,425.84,0.0
80,192,14336,1536,18,0,63.134,a8w8_blockscale_1x128x128_256x64x64x256_16x16_32x32_16x16x1_16x16x1_1x32x1x8_8_1x1_intrawave_v1,133.93,440.65,0.0
80,224,14336,1536,3,0,79.7551,a8w8_blockscale_1x128x128_256x64x64x128_16x16_32x32_8x32x1_8x32x1_1x32x1x8_8_1x1_intrawave_v3,123.69,360.94,0.0
80,256,14336,1536,0,0,68.6792,a8w8_blockscale_1x128x128_256x128x128x128_16x16_32x32_8x32x1_8x32x1_1x32x1x8_8_1x1_intrawave_v3,164.16,433.22,0.0
80,288,14336,1536,3,0,95.5302,a8w8_blockscale_1x128x128_256x64x64x128_16x16_32x32_8x32x1_8x32x1_1x32x1x8_8_1x1_intrawave_v3,132.77,321.57,0.0
80,320,14336,1536,18,0,96.6992,a8w8_blockscale_1x128x128_256x64x64x256_16x16_32x32_16x16x1_16x16x1_1x32x1x8_8_1x1_intrawave_v1,145.74,327.68,0.0
80,352,14336,1536,3,0,111.6424,a8w8_blockscale_1x128x128_256x64x64x128_16x16_32x32_8x32x1_8x32x1_1x32x1x8_8_1x1_intrawave_v3,138.86,292.48,0.0
80,384,14336,1536,0,0,104.6939,a8w8_blockscale_1x128x128_256x128x128x128_16x16_32x32_8x32x1_8x32x1_1x32x1x8_8_1x1_intrawave_v3,161.53,321.13,0.0
80,416,14336,1536,2,0,128.7635,a8w8_blockscale_1x128x128_256x64x128x128_16x16_32x32_8x32x1_8x32x1_1x32x1x8_8_1x1_intrawave_v3,142.28,268.61,0.0
80,448,14336,1536,2,0,128.8181,a8w8_blockscale_1x128x128_256x64x128x128_16x16_32x32_8x32x1_8x32x1_1x32x1x8_8_1x1_intrawave_v3,153.16,276.0,0.0
80,480,14336,1536,3,0,143.3348,a8w8_blockscale_1x128x128_256x64x64x128_16x16_32x32_8x32x1_8x32x1_1x32x1x8_8_1x1_intrawave_v3,147.48,254.79,0.0
80,512,14336,1536,0,0,123.6713,a8w8_blockscale_1x128x128_256x128x128x128_16x16_32x32_8x32x1_8x32x1_1x32x1x8_8_1x1_intrawave_v3,182.33,303.11,0.0
80,1024,14336,1536,0,0,235.774,a8w8_blockscale_1x128x128_256x128x128x128_16x16_32x32_8x32x1_8x32x1_1x32x1x8_8_1x1_intrawave_v3,191.27,224.59,0.0
80,2048,14336,1536,0,0,441.4481,a8w8_blockscale_1x128x128_256x128x128x128_16x16_32x32_8x32x1_8x32x1_1x32x1x8_8_1x1_intrawave_v3,204.31,190.02,0.0
80,4096,14336,1536,0,0,852.3557,a8w8_blockscale_1x128x128_256x128x128x128_16x16_32x32_8x32x1_8x32x1_1x32x1x8_8_1x1_intrawave_v3,211.64,171.0,0.0
80,6144,14336,1536,0,0,1284.9071,a8w8_blockscale_1x128x128_256x128x128x128_16x16_32x32_8x32x1_8x32x1_1x32x1x8_8_1x1_intrawave_v3,210.59,161.58,0.0
80,8192,14336,1536,0,0,1694.2911,a8w8_blockscale_1x128x128_256x128x128x128_16x16_32x32_8x32x1_8x32x1_1x32x1x8_8_1x1_intrawave_v3,212.94,159.05,0.0
80,10240,14336,1536,0,0,2110.1332,a8w8_blockscale_1x128x128_256x128x128x128_16x16_32x32_8x32x1_8x32x1_1x32x1x8_8_1x1_intrawave_v3,213.72,157.03,0.0
80,12288,14336,1536,0,0,2535.3381,a8w8_blockscale_1x128x128_256x128x128x128_16x16_32x32_8x32x1_8x32x1_1x32x1x8_8_1x1_intrawave_v3,213.45,155.09,0.0
80,14336,14336,1536,0,0,2967.1103,a8w8_blockscale_1x128x128_256x128x128x128_16x16_32x32_8x32x1_8x32x1_1x32x1x8_8_1x1_intrawave_v3,212.79,153.38,0.0
80,16384,14336,1536,0,0,3394.5816,a8w8_blockscale_1x128x128_256x128x128x128_16x16_32x32_8x32x1_8x32x1_1x32x1x8_8_1x1_intrawave_v3,212.56,152.29,0.0
80,32768,14336,1536,0,0,6710.7768,a8w8_blockscale_1x128x128_256x128x128x128_16x16_32x32_8x32x1_8x32x1_1x32x1x8_8_1x1_intrawave_v3,215.04,150.78,0.0
80,65536,14336,1536,0,0,13429.1506,a8w8_blockscale_1x128x128_256x128x128x128_16x16_32x32_8x32x1_8x32x1_1x32x1x8_8_1x1_intrawave_v3,214.92,149.06,0.0
80,98304,14336,1536,0,0,20129.3082,a8w8_blockscale_1x128x128_256x128x128x128_16x16_32x32_8x32x1_8x32x1_1x32x1x8_8_1x1_intrawave_v3,215.08,148.62,0.0
80,131072,14336,1536,0,0,26855.6987,a8w8_blockscale_1x128x128_256x128x128x128_16x16_32x32_8x32x1_8x32x1_1x32x1x8_8_1x1_intrawave_v3,214.94,148.25,0.0
80,1,1024,7168,8,0,29.6416,a8w8_blockscale_1x128x128_256x16x64x256_16x16_16x16_16x16x1_16x16x1_1x16x1x16_4_1x1_intrawave_v1,0.5,247.94,0.0
80,2,1024,7168,8,0,29.6451,a8w8_blockscale_1x128x128_256x16x64x256_16x16_16x16_16x16x1_16x16x1_1x16x1x16_4_1x1_intrawave_v1,0.99,248.22,0.0
80,4,1024,7168,8,0,30.4071,a8w8_blockscale_1x128x128_256x16x64x256_16x16_16x16_16x16x1_16x16x1_1x16x1x16_4_1x1_intrawave_v1,1.93,242.6,0.0
80,8,1024,7168,8,0,30.7755,a8w8_blockscale_1x128x128_256x16x64x256_16x16_16x16_16x16x1_16x16x1_1x16x1x16_4_1x1_intrawave_v1,3.82,240.9,0.0
80,16,1024,7168,8,0,23.6965,a8w8_blockscale_1x128x128_256x16x64x256_16x16_16x16_16x16x1_16x16x1_1x16x1x16_4_1x1_intrawave_v1,9.91,315.97,0.0
80,32,1024,7168,8,0,23.4929,a8w8_blockscale_1x128x128_256x16x64x256_16x16_16x16_16x16x1_16x16x1_1x16x1x16_4_1x1_intrawave_v1,20.0,324.99,0.0
80,64,1024,7168,8,0,23.4857,a8w8_blockscale_1x128x128_256x16x64x256_16x16_16x16_16x16x1_16x16x1_1x16x1x16_4_1x1_intrawave_v1,40.0,337.65,0.0
80,96,1024,7168,8,0,28.0612,a8w8_blockscale_1x128x128_256x16x64x256_16x16_16x16_16x16x1_16x16x1_1x16x1x16_4_1x1_intrawave_v1,50.22,293.1,0.0
80,128,1024,7168,8,0,29.1371,a8w8_blockscale_1x128x128_256x16x64x256_16x16_16x16_16x16x1_16x16x1_1x16x1x16_4_1x1_intrawave_v1,64.49,292.4,0.0
80,160,1024,7168,8,0,30.0125,a8w8_blockscale_1x128x128_256x16x64x256_16x16_16x16_16x16x1_16x16x1_1x16x1x16_4_1x1_intrawave_v1,78.26,293.7,0.0
80,192,1024,7168,18,0,32.5357,a8w8_blockscale_1x128x128_256x64x64x256_16x16_32x32_16x16x1_16x16x1_1x32x1x8_8_1x1_intrawave_v1,86.63,279.98,0.0
80,224,1024,7168,12,0,36.3297,a8w8_blockscale_1x128x128_256x32x128x256_16x16_32x32_16x16x1_16x16x1_1x32x1x8_8_1x1_intrawave_v1,90.51,258.86,0.0
80,256,1024,7168,18,0,32.5897,a8w8_blockscale_1x128x128_256x64x64x256_16x16_32x32_16x16x1_16x16x1_1x32x1x8_8_1x1_intrawave_v1,115.32,297.62,0.0
80,288,1024,7168,12,0,36.6559,a8w8_blockscale_1x128x128_256x32x128x256_16x16_32x32_16x16x1_16x16x1_1x32x1x8_8_1x1_intrawave_v1,115.34,272.65,0.0
80,320,1024,7168,18,0,32.8345,a8w8_blockscale_1x128x128_256x64x64x256_16x16_32x32_16x16x1_16x16x1_1x32x1x8_8_1x1_intrawave_v1,143.07,313.36,0.0
80,352,1024,7168,18,0,53.6774,a8w8_blockscale_1x128x128_256x64x64x256_16x16_32x32_16x16x1_16x16x1_1x32x1x8_8_1x1_intrawave_v1,96.27,197.18,0.0
80,384,1024,7168,18,0,48.4286,a8w8_blockscale_1x128x128_256x64x64x256_16x16_32x32_16x16x1_16x16x1_1x32x1x8_8_1x1_intrawave_v1,116.4,224.64,0.0
80,416,1024,7168,18,0,54.3776,a8w8_blockscale_1x128x128_256x64x64x256_16x16_32x32_16x16x1_16x16x1_1x32x1x8_8_1x1_intrawave_v1,112.31,205.49,0.0
80,448,1024,7168,18,0,49.4017,a8w8_blockscale_1x128x128_256x64x64x256_16x16_32x32_16x16x1_16x16x1_1x32x1x8_8_1x1_intrawave_v1,133.13,232.15,0.0
80,480,1024,7168,18,0,54.561,a8w8_blockscale_1x128x128_256x64x64x256_16x16_32x32_16x16x1_16x16x1_1x32x1x8_8_1x1_intrawave_v1,129.15,215.61,0.0
80,512,1024,7168,18,0,49.3665,a8w8_blockscale_1x128x128_256x64x64x256_16x16_32x32_16x16x1_16x16x1_1x32x1x8_8_1x1_intrawave_v1,152.25,244.27,0.0
80,1024,1024,7168,18,0,95.6441,a8w8_blockscale_1x128x128_256x64x64x256_16x16_32x32_16x16x1_16x16x1_1x32x1x8_8_1x1_intrawave_v1,157.17,175.41,0.0
80,2048,1024,7168,0,0,141.1911,a8w8_blockscale_1x128x128_256x128x128x128_16x16_32x32_8x32x1_8x32x1_1x32x1x8_8_1x1_intrawave_v3,212.94,185.67,0.0
80,4096,1024,7168,0,0,289.1222,a8w8_blockscale_1x128x128_256x128x128x128_16x16_32x32_8x32x1_8x32x1_1x32x1x8_8_1x1_intrawave_v3,207.97,155.95,0.0
80,6144,1024,7168,0,0,368.4727,a8w8_blockscale_1x128x128_256x128x128x128_16x16_32x32_8x32x1_8x32x1_1x32x1x8_8_1x1_intrawave_v3,244.78,173.59,0.0
80,8192,1024,7168,0,0,504.7214,a8w8_blockscale_1x128x128_256x128x128x128_16x16_32x32_8x32x1_8x32x1_1x32x1x8_8_1x1_intrawave_v3,238.27,164.13,0.0
80,10240,1024,7168,0,0,592.7477,a8w8_blockscale_1x128x128_256x128x128x128_16x16_32x32_8x32x1_8x32x1_1x32x1x8_8_1x1_intrawave_v3,253.61,171.59,0.0
80,12288,1024,7168,0,0,711.891,a8w8_blockscale_1x128x128_256x128x128x128_16x16_32x32_8x32x1_8x32x1_1x32x1x8_8_1x1_intrawave_v3,253.39,169.39,0.0
80,14336,1024,7168,0,0,849.0672,a8w8_blockscale_1x128x128_256x128x128x128_16x16_32x32_8x32x1_8x32x1_1x32x1x8_8_1x1_intrawave_v3,247.86,164.25,0.0
80,16384,1024,7168,0,0,948.0846,a8w8_blockscale_1x128x128_256x128x128x128_16x16_32x32_8x32x1_8x32x1_1x32x1x8_8_1x1_intrawave_v3,253.69,167.01,0.0
80,32768,1024,7168,0,0,1887.0501,a8w8_blockscale_1x128x128_256x128x128x128_16x16_32x32_8x32x1_8x32x1_1x32x1x8_8_1x1_intrawave_v3,254.91,163.92,0.0
80,65536,1024,7168,0,0,3747.427,a8w8_blockscale_1x128x128_256x128x128x128_16x16_32x32_8x32x1_8x32x1_1x32x1x8_8_1x1_intrawave_v3,256.73,163.13,0.0
80,98304,1024,7168,0,0,5607.9409,a8w8_blockscale_1x128x128_256x128x128x128_16x16_32x32_8x32x1_8x32x1_1x32x1x8_8_1x1_intrawave_v3,257.33,162.86,0.0
80,131072,1024,7168,0,0,7499.3021,a8w8_blockscale_1x128x128_256x128x128x128_16x16_32x32_8x32x1_8x32x1_1x32x1x8_8_1x1_intrawave_v3,256.58,162.06,0.0
80,1,7168,512,8,0,6.1417,a8w8_blockscale_1x128x128_256x16x64x256_16x16_16x16_16x16x1_16x16x1_1x16x1x16_4_1x1_intrawave_v1,1.2,599.97,0.0
80,2,7168,512,8,0,6.1288,a8w8_blockscale_1x128x128_256x16x64x256_16x16_16x16_16x16x1_16x16x1_1x16x1x16_4_1x1_intrawave_v1,2.4,603.66,0.0
80,4,7168,512,8,0,6.1886,a8w8_blockscale_1x128x128_256x16x64x256_16x16_16x16_16x16x1_16x16x1_1x16x1x16_4_1x1_intrawave_v1,4.74,602.63,0.0
80,8,7168,512,8,0,6.2348,a8w8_blockscale_1x128x128_256x16x64x256_16x16_16x16_16x16x1_16x16x1_1x16x1x16_4_1x1_intrawave_v1,9.42,607.69,0.0
80,16,7168,512,8,0,6.2136,a8w8_blockscale_1x128x128_256x16x64x256_16x16_16x16_16x16x1_16x16x1_1x16x1x16_4_1x1_intrawave_v1,18.9,628.88,0.0
80,32,7168,512,13,0,7.438,a8w8_blockscale_1x128x128_256x32x64x256_16x16_16x16_16x16x1_16x16x1_1x32x1x8_8_2x1_intrawave_v1,31.58,557.29,0.0
80,64,7168,512,18,0,10.216,a8w8_blockscale_1x128x128_256x64x64x256_16x16_32x32_16x16x1_16x16x1_1x32x1x8_8_1x1_intrawave_v1,45.98,452.26,0.0
80,96,7168,512,18,0,13.364,a8w8_blockscale_1x128x128_256x64x64x256_16x16_32x32_16x16x1_16x16x1_1x32x1x8_8_1x1_intrawave_v1,52.73,381.28,0.0
80,128,7168,512,18,0,13.2228,a8w8_blockscale_1x128x128_256x64x64x256_16x16_32x32_16x16x1_16x16x1_1x32x1x8_8_1x1_intrawave_v1,71.05,421.28,0.0
80,160,7168,512,10,0,18.4087,a8w8_blockscale_1x128x128_256x32x128x128_16x16_32x32_8x32x1_8x32x1_1x32x1x8_8_1x1_intrawave_v1,63.8,328.42,0.0
80,192,7168,512,16,0,18.5292,a8w8_blockscale_1x128x128_256x64x64x128_16x16_32x32_8x32x1_8x32x1_1x32x1x8_8_1x1_intrawave_v1,76.06,351.92,0.0
80,224,7168,512,10,0,21.9294,a8w8_blockscale_1x128x128_256x32x128x128_16x16_32x32_8x32x1_8x32x1_1x32x1x8_8_1x1_intrawave_v1,74.98,319.02,0.0
80,256,7168,512,16,0,21.6398,a8w8_blockscale_1x128x128_256x64x64x128_16x16_32x32_8x32x1_8x32x1_1x32x1x8_8_1x1_intrawave_v1,86.83,345.25,0.0
80,288,7168,512,16,0,25.393,a8w8_blockscale_1x128x128_256x64x64x128_16x16_32x32_8x32x1_8x32x1_1x32x1x8_8_1x1_intrawave_v1,83.25,312.93,0.0
80,320,7168,512,16,0,24.8244,a8w8_blockscale_1x128x128_256x64x64x128_16x16_32x32_8x32x1_8x32x1_1x32x1x8_8_1x1_intrawave_v1,94.62,339.24,0.0
80,352,7168,512,3,0,30.2024,a8w8_blockscale_1x128x128_256x64x64x128_16x16_32x32_8x32x1_8x32x1_1x32x1x8_8_1x1_intrawave_v3,85.55,294.56,0.0
80,384,7168,512,16,0,29.5228,a8w8_blockscale_1x128x128_256x64x64x128_16x16_32x32_8x32x1_8x32x1_1x32x1x8_8_1x1_intrawave_v1,95.47,317.44,0.0
80,416,7168,512,16,0,32.972,a8w8_blockscale_1x128x128_256x64x64x128_16x16_32x32_8x32x1_8x32x1_1x32x1x8_8_1x1_intrawave_v1,92.61,298.64,0.0
80,448,7168,512,16,0,32.2173,a8w8_blockscale_1x128x128_256x64x64x128_16x16_32x32_8x32x1_8x32x1_1x32x1x8_8_1x1_intrawave_v1,102.07,320.38,0.0
80,480,7168,512,3,0,37.4596,a8w8_blockscale_1x128x128_256x64x64x128_16x16_32x32_8x32x1_8x32x1_1x32x1x8_8_1x1_intrawave_v3,94.05,288.23,0.0
80,512,7168,512,16,0,36.8456,a8w8_blockscale_1x128x128_256x64x64x128_16x16_32x32_8x32x1_8x32x1_1x32x1x8_8_1x1_intrawave_v1,102.0,305.93,0.0
80,1024,7168,512,16,0,64.4201,a8w8_blockscale_1x128x128_256x64x64x128_16x16_32x32_8x32x1_8x32x1_1x32x1x8_8_1x1_intrawave_v1,116.67,292.99,0.0
80,2048,7168,512,16,0,119.3592,a8w8_blockscale_1x128x128_256x64x64x128_16x16_32x32_8x32x1_8x32x1_1x32x1x8_8_1x1_intrawave_v1,125.94,285.51,0.0
80,4096,7168,512,16,0,230.3733,a8w8_blockscale_1x128x128_256x64x64x128_16x16_32x32_8x32x1_8x32x1_1x32x1x8_8_1x1_intrawave_v1,130.5,279.93,0.0
80,6144,7168,512,16,0,340.4453,a8w8_blockscale_1x128x128_256x64x64x128_16x16_32x32_8x32x1_8x32x1_1x32x1x8_8_1x1_intrawave_v1,132.47,278.74,0.0
80,8192,7168,512,16,0,450.0817,a8w8_blockscale_1x128x128_256x64x64x128_16x16_32x32_8x32x1_8x32x1_1x32x1x8_8_1x1_intrawave_v1,133.6,278.4,0.0
80,10240,7168,512,16,0,562.1557,a8w8_blockscale_1x128x128_256x64x64x128_16x16_32x32_8x32x1_8x32x1_1x32x1x8_8_1x1_intrawave_v1,133.7,276.99,0.0
80,12288,7168,512,16,0,673.2671,a8w8_blockscale_1x128x128_256x64x64x128_16x16_32x32_8x32x1_8x32x1_1x32x1x8_8_1x1_intrawave_v1,133.97,276.45,0.0
80,14336,7168,512,16,0,781.9774,a8w8_blockscale_1x128x128_256x64x64x128_16x16_32x32_8x32x1_8x32x1_1x32x1x8_8_1x1_intrawave_v1,134.56,276.9,0.0
80,16384,7168,512,16,0,895.7598,a8w8_blockscale_1x128x128_256x64x64x128_16x16_32x32_8x32x1_8x32x1_1x32x1x8_8_1x1_intrawave_v1,134.25,275.68,0.0
80,32768,7168,512,16,0,1777.7932,a8w8_blockscale_1x128x128_256x64x64x128_16x16_32x32_8x32x1_8x32x1_1x32x1x8_8_1x1_intrawave_v1,135.29,275.74,0.0
80,65536,7168,512,16,0,3567.7508,a8w8_blockscale_1x128x128_256x64x64x128_16x16_32x32_8x32x1_8x32x1_1x32x1x8_8_1x1_intrawave_v1,134.83,273.77,0.0
80,98304,7168,512,16,0,5306.7403,a8w8_blockscale_1x128x128_256x64x64x128_16x16_32x32_8x32x1_8x32x1_1x32x1x8_8_1x1_intrawave_v1,135.97,275.74,0.0
80,131072,7168,512,16,0,7085.0116,a8w8_blockscale_1x128x128_256x64x64x128_16x16_32x32_8x32x1_8x32x1_1x32x1x8_8_1x1_intrawave_v1,135.79,275.2,0.0
